Title,Singer,Lyric
TONIGHT,BIGBANG,Tonight such a beautiful night sing with me now 2011 follow me big bang big bang we're back again one more time say no way no way 너무 쉽게 또 남이 돼 big bang big bang don't stop let's play ok ok go go go 나 미칠 것 같애 아마 지친 것 같애 아냐 질린 것 같애 벌써 따분해 시시해 한 여자로는 만족 못 하는 bad boy but I'm nice 안 넘어가고는 못 배길걸 let me blow ya mind 언제부터였는지 감흥이 없어진 우리 이젠 마치 진 빠진 김 빠진 콜라같지 무감각해진 첫 느낌 서로를 향한 곁눈질 그깟 사랑에 난 목매지 않아 Don't wanna try no more 너를 찾아서 우에오 날 비춰주는 저 달빛아래로 그댈 찾아서 우에오오오 끝이 어딘지 모르겠지만 hey Tonight tonight tonight tonight 아직 난 사랑을 몰라 또 홀로 가여운 이 밤 상처 날 이별이 무서워 so what so what 널 처음 만난 순간이 그리워 no more no more 그저 아픔에 서툰 걸 난 피하고 싶은 걸 But You know that I love you girl girl girl 질질끄는 성격 say no 차가운 입술로 널 얼어 붙게 하는 나나나 Take ma soul take ma heart back 새로운 설레임 get that 사랑은 내게는 어울리지 않아 don't think too much it's simple 너를 찾아서 우에오 날 비춰주는 저 달빛아래로 그댈 찾아서 우에오오오 끝이 어딘진 모르겠지만 hey Tonight tonight tonight tonight 아직 난 사랑을 몰라 또 홀로 가여운 이 밤 안녕이란 말의 슬픈 의미 어두운 그림자는 가려지고 내 마음 속 잊어버린 너를 향한 나의 기억 너를 찾아서 우에오 날 비춰주는 저 달빛아래로 저 달빛아래로 그댈 찾아서 우에오오오 끝이 어딘지 모르겠지만 어딘지 몰라 Tonight tonight tonight tonight 아직 난 사랑을 몰라 또 홀로 가여운 이 밤 너를 찾아서 우에오 날 비춰주는 저 달빛아래로 그댈 찾아서 우에오오오 끝이 어딘지 모르겠지만 goodnight
STEP,카라,Step it up now 오 오 오 라라라라라라라라라라라라라라 라라라라라라라라라라라라라라 넘어지진 않을거야 슬픔아 안녕 친해지지 않을거야 눈물아 안녕 자신을 믿는거야 한숨은 그만 이깟 고민쯤은 웃으며 bye bye 또 한번 더 배웠어 I will never forget about U ye 커졌어 난 강하게 더 높게 오 예 예 예 예 Step it up step it up 다시 시작이야 또 템포를 올려서 앞질러 갈래 Just step it up step it up 다 보란듯이 크게 볼륨 높여 baby my bebe 라라라라라라라라라라라라라라 라라라라라라라라라라라라라라 내일은 새로울꺼야 기대를 높여 그게 사는 재미같아 근심은 날려 누구나 같을꺼야 기 죽지 않아 작은 걱정쯤은 웃으며 bye bye 난 강하게 더 높게 오 예 예 예 예 Step it up step it up 다시 시작이야 또 템포를 올려서 앞질러 갈래 Just step it up step it up 다 보란듯이 크게 볼륨 높여 baby my bebe 내 인생에 섣불리 get louder 나 좋으라고 그랬겠어 그랬겠어 one two one two step 모두 박자에 맞게 겁 낼 필요 없어 아니 울 것 없어 모두 같이 함께해 어지럽게 왜 쓸데없는 생각해 그러지 말고 우리 모두 다 Step it up now 절대 난 돌아보지 않겠어 앞만 보기도 시간은 짧아 Step it up step it up 다시 시작이야 또 템포를 올려서 앞질러 갈래 Just step it up step it up 다 보란듯이 크게 볼륨 높여 baby my bebe Step it up step it up 왜 섣불리 get louder 또 템포를 올려서 괜히 그랬겠어 그랬겠어 Just step it up step it up 다 보란듯이 크게 볼륨 높여 baby my bebe 라라라라라라라라라라라라라라 라라라라라라라라라라라라라라
난리나,블락비 (Block B),Wassup Delly boi B Block is comming rrrrrrrrrrrrah 용용죽겠지 따라와 baby 모든게 다 완벽하니까 구구가가 구구가가 나만봐 lady 돌아버리겠지 어딜가나 함성소리가 사람들 입에서 Im ta ta ta ta talkin baby 주위엔 항상 다수의 lady 가볍게 보다간 뜨겁게 데이지 난 준비 되있지 so don't be lazy 뭣하러 갑갑하게 쫙 빼입니 티 한장으로도 디테일이 살아 완전히 달라 스케일이 When you look at me make you crazy I don't know I don't know I don't know but Im hot hot you know what you know what you know what what I mean mean 여자는 감탄사 남발 알고 싶지 내 phone number 남정네들의 시기와 위기감의 시발점 난 실시간 인기검색어야 bro 용용죽겠지 따라와 baby 모든게 다 완벽하니까 구구가가 구구가가 나만봐 lady 돌아버리겠지 어딜가나 함성소리가 사람들 입에서 난리 난리 난리나 난리 난리 난리나 누가 날이 날이 날이기나 난리 난리 난리나 난리 난리 난리나 누가 날이 날이 날이기나 We rock rock rock rockin now 엄마 친구 아들의 표본 넘어져도 나오는 폼 모두 줄을지어 따라와 like 소독차 난 만인의것 do not 개인소장 Im so groove so special question 어디가 매력이냐고 Uhm 머리 어깨 무릎 발 무릎발 I don't know I don't know I don't know but Im hot hot you know what you know what you know what what I mean mean 난 절대 거짓말은 안해 이젠 두렵다고 말해 Girl you want it and love it U na na na na na 용용죽겠지 따라와 baby 모든게 다 완벽하니까 구구가가 구구가가 나만봐 lady 돌아버리겠지 어딜가나 함성소리가 사람들 입에서 용용죽겠지 따라와 baby 모든게 다 완벽하니까 구구가가 구구가가 나만봐 lady 돌아버리겠지 어딜가나 함성소리가 사람들 입에서 난리 난리 난리나 난리 난리 난리나 누가 날이 날이 날이기나 We rock rock rock rockin now 난리 난리 난리나 난리 난리 난리나 누가 날이 날이 날이기나 We rock rock rock rockin now
Twinkle,소녀시대-태티서 (Girls' Generation-TTS),The twinkle twinkle The twinkle twinkle 숨겨도 twinkle 어쩌나 눈에 확 띄잖아 베일에 싸여 있어도 나는 twinkle 티가 나 딴 사람들도 다 빛나는 나를 좋아해 끝까지 경계해야 해 보석을 훔친 너잖아 늘 나의 곁을 지켜줘 내 주위만 맴돌아 눈을 떼지 말아줘 내 매력에 빠져 숨겨도 twinkle 어쩌나 눈에 확 띄잖아 베일에 싸여 있어도 나는 twinkle 티가 나 난 미지의 세계 시간을 잊어버릴걸 아침에 눈을 떠봐도 꿈은 계속될 거야 난 너를 위해 꾸미고 더 예쁘게 날 반짝일래 왜 너만 혼자 몰라 나의 진가를 숨겨도 twinkle 어쩌나 눈에 확 띄잖아 베일에 싸여 있어도 나는 twinkle 티가 나 너무 태연해 너무 뻔뻔해 밖에는 날 소원하는 줄이 끝이 안 보여 말도 안되게 넌 너무 담담해 난 하늘 아래 떨어진 별 숨겨도 twinkle 어쩌나 눈에 확 띄잖아 베일에 싸여 있어도 나는 twinkle 티가 나 그대의 twinkle 나를 봐 어딜 봐 나를 봐 칙칙한 옷 속에서도 나는 twinkle 태가 나 숨겨도 twinkle 어쩌나 눈에 확 띄잖아 베일에 싸여 있어도 나는 twinkle 티가 나
누난 너무 예뻐 (Replay),SHINee (샤이니),누난 너무 예뻐서 남자들이 가만 안 둬 흔들리는 그녀의 맘 사실 알고 있어 그녀에게 사랑은 한순간의 느낌일 뿐 뭐라 해도 나에겐 삶의 everything 아마 그녀는 어린 내가 부담스러운가봐 날 바라보는 눈빛이 말해주잖아 and I think I'm gonna hate it girl 끝이 다가 오는 걸 가슴이 말해준다 누가 뭐래도 누난 너무 예뻐 그 그녀를 보는 나는 미쳐 하 하지만 이젠 지쳐 Replay Replay Replay 추억이 내 맘을 할퀴어 아 아파서 이젠 맘을 고쳐 다 다가올 이별에 난 Replay Replay Replay 누난 나의 M V P 부러움에 뿌듯했지 늘 시선집중 그녀와 함께 있는 난 So cool 제발 이 손을 놓지 말자 던 나의 다짐은 어느 순간부터 거짓인걸 알아 아마 그녀는 착한 내가 별 재미없었나 봐 날 대하는 몸짓이 말하고 있잖아 and I think I'm gonna hate it girl 끝이 다가 오는 걸 가슴이 소리친다 이별 앞에서 누난 너무 예뻐 그 그녀를 보는 나는 미쳐 하 하지만 이젠 지쳐 Make up Shake up Break up 추억이 내 맘을 할퀴어 아 아파서 이젠 맘을 고쳐 다 다가올 이별에 난 Make up Shake up Break up 아 아 아름다운 그녀는 아 아 아직까지 누구와 진실 된 사랑의 맛을 본적이 없는 게 분명해 아 아 아쉽게도 그녀는 아 아 아직 어린 나에겐 진실 된 사랑의 마음을 받을 수 없는지 누난 너무 예뻐 그 그녀를 보는 나는 미쳐 하 하지만 이젠 지쳐 Replay Replay Replay 추억이 내 맘을 할퀴어 아 아파서 이젠 맘을 고쳐 다 다가올 이별에 난 Replay Replay Replay 누난 너무 예뻐 그 그녀를 보는 나는 미쳐 하 하지만 이젠 지쳐 Replay Replay Replay 추억이 내 맘을 할퀴어 아 아파서 이젠 맘을 고쳐 다 다가올 이별에 난 Replay Replay Replay 누난 너무 예뻐 I keep thinkin 'bout you 누난 예뻐 I keep dreaming 'bout you 진실된 사랑의 맛을 본 적이 누난 너무 예뻐 I keep thinkin 'bout you 누난 예뻐 I keep dreaming 'bout you 진실된 사랑의 마음을
날 떠나지마,박진영,멀어지는 너의 모습은 나의 눈물속에서 점점 더 번져가고 작아지는 널 느낄 수록 내마음속에서 넌 커져가고 하지만 난 괜찮아 내사랑이 떠나는 널 다시 내게 돌려줄걸 난 알아 난알아 날 떠나지마 가는 널 볼수가 없어 넌 떠나지만 난 뒷모습만 보며 서있어 다시 한번 말하지만 제발 날 떠나지마 내 사랑이 너의 오는 길을 비춰줄거야 oh baby 희미해진 너를 보면서 나의 그리움들은 커져가고 하지만 난 괜찮아 내 사랑이 떠나는 널 다시 내게 돌려줄걸 난 알아 난 알아 날 떠나지마 가는 널 볼수가 없어 넌 떠나지만 난 뒷모습만 보며 서있어 다시 한번 말하지만 제발 날 떠나지마 내 사랑이 너의 오는 길을 비춰줄거야 날 떠나지마 가는 널 볼수가 없어 넌 떠나지만 난 뒷모습만 보며 서있어 다시 한번 말하지만 제발 날 떠나지마 내 사랑이 너의 오는 길을 비춰줄거야 oh baby
잠 못 드는 밤 비는 내리고,김건모,슬픈 노래는 듣고 싶지않아 내 마음 속에 잠들어있는 네가 다시 나를 찾아와 나는 긴긴 밤을 잠 못들것 같아 창밖에 비가 내리면 우두커니 창가에 기대어 앉아 기타를 퉁기며 노래를 불렀지 네가 즐겨듣던 그 노래 창밖을 보면 비는 오는데 괜시리 마음만 울적해 울적한 마음을 달랠 수가 없네 잠도 오지 않는 밤에 이젠 나의 희미한 기억 속에 너는 점점 더 멀어져가고 너의 슬픈 미소만이 나의 마음속에 가득 남아 흐르고 있어 이렇게 비가 오는 밤이면 너는 나를 더욱 슬퍼지게해 언제나 즐겨듣던 그 노래가 내 귓가에 아직 남아있는데 이렇게 비가오는 밤이면 내 지친 그리움으로 널 만나고 이 비가 그치고 나면 난 너를 찾아 떠나갈거야 슬픈 노래는 듣고 싶지않아 내 마음 속에 잠들어있는 네가 다시 나를 찾아와 나는 긴긴 밤을 잠 못들것 같아 창밖에 비가 내리면 우두커니 창가에 기대어 앉아 기타를 퉁기며 노래를 불렀지 네가 즐겨듣던 그 노래 두눈을 감고 잠을 청해도 비오는 소리만 처량해 비오는 소리에 내 마음 젖었네 잠도 오지 않는 밤에 이젠 나의 희미한 기억 속에 너는 점점 더 멀어져가고 너의 슬픈 미소만이 나의 마음속에 가득 남아 흐르고 있어 이렇게 비가 오는 밤이면 너는 나를 더욱 슬퍼지게해 언제나 즐겨듣던 그 노래가 내 귓가에 아직 남아있는데 이렇게 비가오는 밤이면 내 지친 그리움으로 널 만나고 이 비가 그치고 나면 난 너를 찾아 떠나갈거야 이렇게 비가오는 밤이면 내 지친 그리움으로 널 만나고 이 비가 그치고 나면 난 너를 찾아 떠나갈거야
10 Minutes,이효리,Just One 10 MINUTES 내 것이 되는 시간 순진한 내숭에 속아 우는 남자들 Baby 다른 매력에 흔들리고 있잖아 용기내봐 다가와 날 가질 수도 있잖아 어느 늦은 밤 혼자 들어선 곳 춤추는 사람들 그 속에 그녀와 너 왠지 끌리는 널 갖고 싶어져 그녀가 자릴 비운 그 10분 안에 지루했던 순간이 날 보는 순간 달라졌어 I'm telling you 오래된 연인 그게 아니던 중요한 사실은 넌 내게 더 끌리는 것 I say 너의 그녀는 지금 거울을 보며 붉은색 립스틱 화장을 덧칠하고 Baby 높은 구두에 아파하고 있을걸 나는 달라 그녀와 날 비교하진 말아줘 짧은 순간이 아니라고 했잖아 영화속에 갇힌 우리가 되는 거야 영화속 10분 1년도 지나쳐 어때 겁먹지는 마 너도 날 원해 지루했던 순간이 날 보는 순간 달라졌어 I'm telling you 오래된 연인 그게 아니던 중요한 사실은 넌 내게 더 끌리는 것 Just one 10 MINUTES 내 것이 되는 시간 모든 게 끝난 후 그녀가 오고 있어 Baby 붉은 립스틱 촌스럽기도 하지 내게와봐 이제 넌 날 안아봐도 괜찮아 Don't tell a lie just be yourself 힘들게 둘러 대지마 널 떠나달라 말을해 have it your way Bling Bling shine it's right to come 사랑에 빠진 거라고 거짓을 말할거라면 모두 없던 걸로 해 I say 너의 그녀는 지금 거울을 보며 붉은색 립스틱 화장을 덧칠하고 Baby 높은 구두에 아파하고 있을걸 나는 달라 그녀와 날 비교하진 말아줘 Just one 10 MINUTES 내 것이 되는 시간 순진한 내숭에 속아 우는 남자들 Baby 다른 매력에 흔들리고 있잖아 용기 내봐 다가와 날 가질 수도 있잖아 Just one 10 MINUTES Just one 10 MINUTES
기대해,걸스데이,Ooh Ooh Ooh Ooh Ooh Ooh Ooh Ooh Ooh Ooh 귀엽게 Ooh Ooh Ooh Ooh Ooh Ooh Ooh Ooh Ooh Ooh 예쁘게 Oh 하루에도 열번씩 네 전화번호 지워보고 너를 또 지워보고 생각에서 지워봐도 너의 번호 뒷자리에 내 가슴은 내려앉아 그렇게 통화하고 다시 또 미소짓고 나는 네가 불안해 그게 불만인데도 자존심 탓 때문에 말도 못해 이렇게 내가 아님 안되는 남자 많고 많은데 네가 숨기고 쓰는 문자가 더 신경쓰여 문자가 신경쓰여 문자가 신경쓰여 Ooh Ooh Ooh Ooh Ooh Ooh Ooh Ooh Ooh Ooh 귀엽게 Ooh Ooh Ooh Ooh Ooh Ooh Ooh Ooh Ooh Ooh 예쁘게 널 내게 널 내게 다가오게 만들래 Ooh Ooh Ooh Ooh Ooh Ooh Ooh Ooh Ooh Ooh 기대해 너땜에 너땜에 미쳐가 Whoa uh uh 너땜에 너땜에 미쳐가 Whoa uh uh 내 앞에서 그 여자랑 다정하게 얘기하고 토라진 나를 보고 별일 없이 미소 짓고 이런 기분 너무 싫어 나 또 다시 널 잊으려 잊으려 애를 쓰고 그렇게 아파하고 너란 남자 왜 그래 너 때문에 난 미쳐 나 하나면 안되니 내 가슴은 찢어져 나만 보는 남자들 많고 많고 많은데 네 전화만 기다리는 바보 같은 나는 뭐니 바보 같은 나는 뭐니 바보 같은 나는 뭐니 Ooh Ooh Ooh Ooh Ooh Ooh Ooh Ooh Ooh Ooh 귀엽게 Ooh Ooh Ooh Ooh Ooh Ooh Ooh Ooh Ooh Ooh 예쁘게 널 내게 널 내게 다가오게 만들래 Ooh Ooh Ooh Ooh Ooh Ooh Ooh Ooh Ooh Ooh 기대해 너땜에 너땜에 미쳐가 Whoa uh uh 너땜에 너땜에 미쳐가 Whoa uh uh I just want you to come to me 다가와봐 내가 손짓 하잖니 I just need you to give your love 어서 내게 네 마음을 보여줘 나 왜이래 내 마음은 고장 났어 난 나 왜이래 내 마음은 너만 찾아 난 네가 미워 미워 미치겠어도 난 너의 웃는 네 네 입꼬리에 네 입꼬리에 네 입꼬리에 네 목소리에 네 목소리에 네 목소리에 난 가슴이 떨려 널 내게 널 내게 다가오게 Ooh Ooh Ooh 널 내게 널 내게 미쳐보게 Yeah eh eh 나 없음 나 없음 안되게 널 만들래 Ooh Ooh Ooh Ooh Ooh Ooh Ooh Ooh Ooh Ooh 기대해 넌 내게 넌 내게 미쳐가 Wuh Oh Oh 넌 내게 넌 내게 미쳐가 Wuh Oh Oh I’m gonna get to you Ooh Ooh Ooh Ooh Ooh Ooh Ooh Ooh Ooh Ooh 기대해
와,이정현,사실이 아니길 믿고 싶었어 널 놓치기 싫었어 혹시나 우리의 사랑이 잘못 돼 끝나면 어떡해 가슴은 아프지만 모른척 해야해 이별보단 덜 아플 테니까 설마했던 네가 나를 떠나버렸어 설마했던 네가 나를 버렸어 깊었던 정을 쉽게 잊을 수 없어 늦었어 이미 난 네 여자야 오오오오오오오오 독한 여자라 하지마 오오오오오오오오 사랑했으니 책임져 다시는 사랑에 속지 않기를 나 간절히 바랬어 네가 내 인생의 마지막 남자가 돼 주길 바랬어 하지만 이게 뭐야 눈물 뿐이야 이제 남은건 절망 뿐이야 설마했던 네가 나를 떠나버렸어 설마했던 네가 나를 버렸어 깊었던 정을 쉽게 잊을 수 없어 늦었어 이미 난 네 여자야 오오오오오오오오 독한 여자라 하지마 오오오오오오오오 사랑했으니 책임져 날 봐 잘 봐 내 사랑을 다시 봐 와와 봐봐 이번이 마지막 뭣하러 뭣하러 떠나 날 뭣하러 뭣하러 버려 이제 잔소리 말고 내게로 다시 와줘 와줘
쏘리 쏘리 (Sorry Sorry),SUPER JUNIOR (슈퍼주니어),- 쏘리 쏘리 (Sorry Sorry) -  Sorry Sorry Sorry Sorry 내가 내가 내가 먼저 네게 네게 네게 빠져 빠져 빠져 버려 baby Shawty Shawty Shawty Shawty 눈이 부셔 부셔 부셔 숨이 막혀 막혀 막혀 내가 미쳐 미쳐 baby 바라보는 눈빛 속에 눈빛 속에 나는 마치 나는 마치 뭐에 홀린 놈 이젠 벗어나지도 못해 걸어오는 너의 모습 너의 모습 너는 마치 내 심장을 밟고 왔나봐 이젠 벗어나지도 못해 어딜 가나 당당하게 웃는 너는 매력적 착한 여자 일색이란 생각들은 보편적 도도하게 거침 없게 정말 너는 환상적 돌이킬 수 없을만큼 네게 빠져 버렸어 Sorry Sorry Sorry Sorry 내가 내가 내가 먼저 네게 네게 네게 빠져 빠져 빠져 버려 baby Shawty Shawty Shawty Shawty 눈이 부셔 부셔 부셔 숨이 막혀 막혀 막혀 내가 미쳐 미쳐 baby 딴딴 딴따다 따 따란딴 딴딴 딴따다 따 네게 반해버렸어 baby 딴딴 딴따다 따 따란딴 딴딴 딴따다 따 따라빠빠라 Hey girl gir gir gir gir gir girl I 눈만뜨면 니 생각 Hey girl 자나깨나 사실 너 하나 밖에 안보여 말해봐 니 맘에 내가 말해봐 자리 잡았는지 말해줘 내게 말해줘 나는 바보 바보 바보 주변 사람들은 말해 내가 너무 적극적 이 세상에 그런 사람 어디 한둘이냐고 그걸 몰라 그녈 몰라 시기하며 하는 말 내가 부럽다면 그건 그대들이 지는 거 Sorry Sorry Sorry Sorry 내가 내가 내가 먼저 네게 네게 네게 빠져 빠져 빠져 버려 baby Shawty Shawty Shawty Shawty 눈이 부셔 부셔 부셔 숨이 막혀 막혀 막혀 내가 미쳐 미쳐 baby 딴딴 딴따다 따 따란딴 딴딴 딴따다 따 네게 반해버렸어 baby 딴딴 딴따다 따 따라라라 딴딴 딴따다 따 따라빠빠라 Let's dance dance dance dance Let's dance dance dance dance Let's dance dance dance dance dance dance Hey 이제 그만 내게 와줄래 정말 미칠 것만 같아 yeah 난 너만 사랑하고 싶어 절대 다시 한눈 팔 생각 없어 hey 애인이라기보다 친구같은 내가 되고 싶어 너의 모든 고민 슬픔 함께 간직하고파 다시 없을 만큼 만큼 너를 너무 사랑해 내가 바란 사람 니가 바로 그 that that that girl Sorry Sorry Sorry Sorry 내가 내가 내가 먼저 네게 네게 네게 빠져 빠져 빠져 버려 baby Shawty Shawty Shawty Shawty 눈이 부셔 부셔 부셔 숨이 막혀 막혀 막혀 내가 미쳐 미쳐 baby
여름이야기 (Sky Mix),DJ DOC,지나간 여름 하하 그 바닷가에서 만났던 그녀 허리까지 내려오는 까만 생머리 이것저것 잴 것 없이 난 그냥 푹 빠져 버렸어 아예아예 난 사랑에 푹 빠져버렸어   지나간 그 여름 바닷가에서 꿈처럼 눈부신 그녈 만났지 믿을수가 없어 아름다운 그녀 내겐 너무 행운이었어 별이 쏟아지던 하얀 모래위에 우린 너무 행복했었지   가을 겨울 가고 그녀 볼 수 없어 어디 있는 거야 제발 돌아와줘 그녀없는 여름 다시 찾아오면 나는 어떻게해 우린 그 바닷가에서 만났고 또 아쉬운 작별을 했어 서울로 돌아오는 그 시간이 몇년처럼 더디기만했어 그런데 돌아온 서울에서 널 찾을 수가 없었어 정신나간 사람처럼 가을 겨울 너를찾아 하루종일 헤매고 다녔었지   여름이 또 오면 어떡하라고 나 혼자 남기고 어딜 간거야 믿을 수가 없어 어디 있는거야 아직 너를 기다리잖아 하얀 파도처럼 영원토록 나를 사랑한다 속삭였잖아 야야이야야야   친구들 날 달래준다고 그 바닷가로 다시 오게됐어 청천벽력 날벼락 그녀가 내 앞에 나타난거야 내가 사준 썬그라스 목걸이 그대로인데 단지 틀려진건 내 친구와 함께라는 것  하늘 무너지는 소릴 듣고 있어 내가 기다려온 그녈 만난거야 우리 헤어졌던 그때 그 바닷가 다시 널 본거야   친구와 함께 온 그녀 앞에서 그 어떤 얘기도 할 수 없었어 믿을수가 없어 어쩔 수도 없어 이런 만남 이건 아니야 누가 얘기해줘 그녀 아직 나를 사랑하며 찾고 있다고   주책없는 내 친구 그녀가 그녀인줄 모르고 내지난 여름 얘기를 마구마구 해버린거야 고개숙인 그녀가 펑펑 울었고 나도 울고 하늘도 울고 아~ 슬프다  랄랄랄 라 랄라 헤이 랄랄랄 라 랄라 헤이 랄랄랄랄라라라라라~    
꿍따리 샤바라,클론,마음이 울적하고 답답할 땐 산으로 올라가 소릴 한번 질러봐 나처럼 이렇게 가슴을 펴고 꿍따리 샤바라 빠빠빠빠 누구나 세상을 살다 보면은 마음먹은 대로 되지 않을 때가 있어 그럴땐 나처럼 노래를 불러봐 꿍따리 샤바라 빠빠빠빠 기쁨과 슬픔이 엇갈리고 좌절과 용기가 교차되고 만남과 이별을 나누면서 그렇게 우리는 살아가고 뜻대로 되지 않을 때도 있고 마음먹은 대로 될 때도 있어 다 그런 거야 누구나 세상은 그렇게 돌아가니까 다 그렇게 사는거야 희비가 엇갈리는 세상속에서 내일이 다시 찾아오기에 우리는 희망을 안고 사는 거야 마음대로 일이 되지 않을 때 하던 일을 멈추고 여행을 떠나봐 바다를 찾아가 소릴 질러봐 꿍따리 샤바라 빠빠빠빠 꿍따리 샤바라 빠빠빠 빠빠빠빠빠 빠빠빠 꿍따리 샤바라 빠빠빠 빠빠빠빠빠 빠빠빠 우울한 날이 계속 이어질 땐 신나는 음악에 신나게 춤을 춰봐 나처럼 이렇게 리듬에 맞춰 꿍따리 샤바라 빠빠빠빠 누구나 괴로운 일은 있는 것 한가지 생각에 너무 집착하지마 그럴땐 나처럼 툭툭 털면서 꿍따리 샤바라 빠빠빠빠 기쁨과 슬픔이 엇갈리고 좌절과 용기가 교차되고 만남과 이별을 나누면서 그렇게 우리는 살아가고 뜻대로 되지 않을 때도 있고 마음먹은 대로 될 때도 있어 다 그런거야 누구나 세상은 그렇게 돌아가니까 다 그렇게 사는 거야 희비가 엇갈리는 세상속에서 내일이 다시 찾아오기에 우리는 희망을 안고 사는 거야 마음대로 일이 되지않을 땐 하던 일을 멈추고 여행을 떠나봐 바다를 찾아가 소릴 질러봐 꿍따리 샤바라 빠빠빠빠 꿍따리 샤바라 빠빠빠 빠빠빠빠빠 빠빠빠 꿍따리 샤바라 빠빠빠 빠빠빠빠빠 빠빠빠
Trouble Maker,트러블메이커,1 2 3 니 눈을 보면 난 Trouble Maker 니 곁에 서면 난 Trouble Maker 조금씩 더 더 더 갈수록 더 더 더 이젠 내 맘을 나도 어쩔 수 없어 니가 나를 잊지 못하게 자꾸 니 앞에서 또 니 맘 자꾸 내가 흔들어 벗어날 수 없도록 니 입술을 또 훔치고 멀리 달아나버려 난 Trou a a a ble Trouble Trou Trouble Maker Trouble Maker Trouble Maker Trouble Maker Trouble Maker 니 맘을 깨물고 도망칠 거야 고양이처럼 넌 자꾸 안달이 날 거야 내 앞으로 와 어서 화내보렴 내 섹시한 걸음 니 머리 속에 발동을 거는 은근한 스킨십 얼굴에 비친 못 참아 죽겠단 니 눈빛 갈수록 깊이 더 빠져들어 알수록 니가 더 맘에 들어 Baby 아무래도 니 생각에 취했나봐 Lady I never never never stop 니가 나를 잊지 못하게 자꾸 니 앞에서 또 니 맘 자꾸 내가 흔들어 벗어날 수 없도록 니 입술을 또 훔치고 멀리 달아나버려 난 Trou a a a ble Trouble Trou Trouble Maker Trouble Maker Trouble Maker Trouble Maker Trouble Maker 어떻게 널 내 맘에 담아둘 수 있는지 Trouble Maker 그냥 내 맘이 가는대로 이젠 I never never stop 멈출 수 없어 니가 나를 잊지 못하게 자꾸 니 앞에서 또 니 맘 자꾸 내가 흔들어 벗어날 수 없도록 니 입술을 또 훔치고 멀리 달아나버려 난 Trou a a a ble Trouble Trou Trouble Maker Trouble Maker Trouble Maker Trouble Maker Trouble Maker
