Title,Singer,Lyric
그 놈 목소리,씨야,그래 그랬지 넌 솔깃솔깃 할 만했었지 부드럽게 나를 Holic Holic 하게 했었지 너무 뻔했었던 거짓말을 들어도 믿고만 싶게한 그런 목소리였어 흔들리잖아 너의 전화 한 콜에 나 믿고 싶잖아 변한 너일지도 몰라 바보같잖아 왜 이렇게 쉬워 내가 다짐이나 말지 너를 잊겠다고 귀를 감아 넘어오는 그 놈 목소리 지겨워도 듣게 되는 그런 멜로디 다시 나를 조여오는 너의 메모리 어떡해야 너를 벗어나니 난 제발 그만 제발 그만 이제 그만 날 놓아줘 어쩜 이리 쉽게 철렁철렁 내려 앉는지 왜 넌 아직도 날 들고 놓고 할 수 있는지 Turn it left Turn it right 나를 이리 저리로 가지고 놀다가 내려놓을 너인데 알고 있잖아 모르는게 아닌데도 가고 있잖아 니가 있단 그 곳으로 바보같잖아 왜 이렇게 쉬워 내가 말하지나 말지 마지막이라고 귀를 감아 넘어오는 그 놈 목소리 지겨워도 듣게 되는 그런 멜로디 다시 나를 조여오는 너의 메모리 어떡해야 너를 벗어나니 난 지금 어딘데요 집으로 갈게요 이렇게라도 잠시라해도 이렇게라도 거짓이래도 너에게 또 무너지는 나의 목소리 너에게 난 편하기만한 Accessory 알면서 또 보게 되는 뻔한 스토리 어떡해야 너를 이제 그만 너를 귀를 감아 넘어오는 그 놈 목소리 지겨워도 듣게 되는 그런 멜로디 다시 나를 조여 오는 너의 메모리 어떡해야 너를 벗어나니 난 제발 그만 제발 그만 이제 그만 날 놓아줘
달빛바다,아이유/피에스타,Yeah It's summer 어디라도 좋아 Falling love 오늘은 기어코 어디든지 가보자 이 여름 다 가기 전에 워우예에 물결이 들리고 풀이 많은 곳이 어때 솔직히 너랑은 어디라도 난 좋아 달빛바다 닮은 저 하늘 조각배처럼 예쁜 저 별들 Only for you 달빛 한 스푼 별빛 두 방울을 우리 추억에 담는 이 여름 달빛바다 Hey You Just a feeling Just a dreaming 바람을 따라서 가는거야 All right 내일은 기어코 다른 데서 눈 뜨자 젤 먼저 해 뜨는 데서 워우예에 어어어 부서진 파도에 무지개도 볼지 몰라 솔직히 너랑은 무얼 봐도 난 좋아 달빛바다 닮은 저 하늘 조각배처럼 예쁜 저 별들 Only for you 달빛 한 스푼 별빛 두 방울을 우리 추억에 담는 이 여름 달빛바다 Beautiful moon night 시원한 바다로 함께 떠나 보는건 어때 Yes 너와 함께라면 OK 내년 여름에도 우린 함께일거야 두 손을 꼭 잡고 오늘 얘길 나누게 될 걸 물빛하늘 닮은 저 바다 구름같은 파도가 밀려와 Only for you 여름마다 쌓인 추억들이 걸음마다 밟히는 이 여름 달빛바다
Love Is... (3+3=0),터보,우린 6년 전에 만났지 널 사랑하게 됐어 내 마음을 숨긴 채 널 따라 다녔었지 내 친구는 나를 위해 애썼고 마침내 내 사랑을 3년만에 고백하게 됐어 처음 만났을때 첫눈에 반한다는 그 말을 그때야 알게 되었어 눈이 부시도록 아름다워 너의 눈빛조차 쳐다볼 수 없었지 너를 만나면 아무 말 못하고서 애매한 담배만 피워댔고 너와 헤어지고 나서야 못 다한 말들을 후회 했어 세월 흘러가서 3년 되던 날 나 얼마나 너를 사랑 하는지 그때서야 힘겨운 고백을 했어 아무 대답 없이 앉아만 있던 너 무슨 얘기라도 해주길 바랬어 한참 지난 후에 어렵게 꺼낸 말 너도 나를 좋아한다는 그 말 나를 친구로써 좋아는 하지만 사랑 느낀적은 없다고 영원히 좋은 친구로만 남아 사랑은 하지 말자고 그 말 듣자 마자 군대를 가 버렸던 거야 친구에게 널 맡기고 내 자릴 비웠지 둘은 면회 왔었고 믿었지 그러나 내 친구와 약혼했고 나만 이제 혼자야 다행일지 몰라 이런 일들이 널 맡겨논 가장 친한 친구가 네게 생긴 새로운 사랑 이란게 혹시 다른 남자 사랑을 했다면 다신 너를 볼 수가 없을 테니까 가장 친한 친구 애인이 됐으니 니가 행복한 걸 볼 수 있잖아 친군 내 앞에서 미안해 하지만 나는 아무렇지 않은 걸 어차피 너의 곁에 남은 채로 너만을 사랑 할테니
My Man,다비치,you got to be my man baby I want your love 넌 내게 와 oh yeh yeh yeh I'm got you not a friend gonna be your be fine 갖고 싶은너 my love 나 왠지 맞지 않을 것만 같아서 정말로 매너 없다 생각했었어 뭐그리 잘났는지 너무 튕기는데 I don't know I don't know 니 맘만 하지만 궁금해져 궁금해져 나 어디서 나온 그런 자신감인지 아무리 생각해도 이해가 안되지만 나도 몰래 집착을해 you got to be my man baby I want your love 넌 내게 와 oh yeh yeh yeh I'm got you not a friend gonna be your be fine 갖고 싶은너 my love 이상해 내가 너무 이상해졌어 시계추처럼 맘이 왔다갔다해 관심을 줘야할까 멋대로 튕겨볼까 올때까지 기다릴까 you got to be my man baby I want your love 넌 내게 와 oh yeh yeh yeh I'm got you not a friend gonna be your be fine 갖고 싶은너 my love oh 사랑해도 되겠니 가져도 되겠니 그래도 되겠니 oh oh oh love is funny oh I guess i'm funny funny oh oh love is funny oh I like you honey 사랑을 쉽게 쉽게 하긴 싫지만 자꾸만 깊게 깊게 들어오는 너 내 맘에 쏙들어와 나가려 하지않아 이젠 나를 어떻게 해 you got to be my man baby I want your love 넌 내게 와 oh yeh yeh yeh I'm got you not a friend gonna be your be fine 갖고 싶은너 my love you got to be my man baby I want your love 넌 내게 와 oh yeh yeh yeh I'm got you not a friend gonna be your be fine 갖고 싶은너 my love
으샤! 으샤!,신화,Hey come on everybody swimming in the sea Saying doo wa diddy diddy dum dee ree dum Hey come on everybody walking down the sea Saying doo wa diddy diddy dum dee ree dum 한밤 중에 기차타고 가네 어린 시절에 바다 찾아 가네 걱정거리 근심거리 하나없던 그 시절로 돌아가고 싶어 나 이젠 피곤 해요 일 그만 할래요 다 접어 두고 우리 함께 물놀이 가면 안될까요 으샤 으샤 Hey Hey Hey huh 으샤 으샤 Hey Hey Hey huh 시원하게 부서지는 파도 햇살 모래사장 바다가 좋아 덥지도 않고 질리지도 않는 수박은 더 좋아 이렇게 좋은 여름을 기다려 온 나는 기분 좋아덤디리덤 여름밤이 찾아오면 모닥불을 피워놓고 둘러 앉아 이것 저것 아무 재미 없는 얘기도 할 거야 썰렁한 얘기라도 그런 밤에 다 용서 받고 싶어 덤디리덤 나 나 어릴적에 살던 동네 여름오면 너무너무 행복했지 시냇가에 친구들도 첨벙첨벙 덩달아 바둑이도 깡총깡총 그렇게 앉아 있지 말고 나랑 같이 가요 Come on baby 안되는 일 억지로 붙잡고 늘어져서 된다는 보장하나 없을 테니까 인생을 낭비하지 마세요 오 그렇게 살다보면 찌들어 가니까 한번이라도 툭툭 털고 모든 걸 잊고 즐기며 살아봐요 하루종일 지루하고 짜증나는 일이 많이 있었다면 이것저것 재 보지 말고 여행을 떠나봐 기차를 타고 버스를 타고서 떠나자 Hey come on everybody swimming in the sea Saying doo wa diddy diddy dum dee ree dum Hey come on everybody walking down the sea Saying doo wa diddy diddy dum dee ree dum 인생을 낭비하지 마세요 오 그렇게 살다보면 찌들어 가니까 한번이라도 툭툭 털고 모든 걸 잊고 즐기며 살아봐요 하루종일 지루하고 짜증나는 일이 많이 있었다면 이것저것 재 보지 말고 여행을 떠나봐 기차를 타고 버스를 타고서 떠나자 으샤 으샤 Hey Hey Hey huh 으샤 으샤 Hey Hey Hey huh
너 때문에 (2011 New Recordings),애프터스쿨,아직도 나 그대를 잊지 못해 I never forget boy I never forget boy 헤어진지 벌써 몇 년이 지났는지 몰라 그대 생각만하면 자꾸 눈물만 흘러 오늘따라 왜 그렇게 니가 보고플까 창 밖의 빗소리가 내 맘을 흔들어놔 사랑하지 말걸 그랬어 정주지 말걸 그랬어 붙잡지말걸 그랬어 왜 이렇게 나 혼자 아파 사랑하지 말걸 그랬어 정주지 말걸 그랬어 붙잡지말걸 그랬어 왜 이렇게 나 혼자 아파 난 항상 너만의 장미가 되려던 내 맘을 아니 이제 조각난 사랑의 마침표가 됐다는 걸 눈물이 밀려와 메마른 입술이 젖어 이제 어떡해 그댈 잊을 수 없어 너 때문에 많이도 울었어 너 때문에 많이도 웃었어 너 때문에 사랑을 믿었어 너 때문에 너 때문에 모두 다 잃었어 정말 답답답해 갑갑갑해 막막막해 너 없는 세상이 내 말을 씹어놓고 자존심 짓밟아놓고 내 맘을 찢어놓고 왜 나를 떠나가 그날도 비가 왔었지 한참을 그댄 말없이 나를 바라보기만 했어 흔들리는 눈빛과 애써 짓는 어색한 미소가 이별을 얘기해줘 사랑하지 말걸 그랬어 정주지 말걸 그랬어 붙잡지말걸 그랬어 왜 이렇게 나 혼자 아파 사랑하지 말걸 그랬어 정주지 말걸 그랬어 붙잡지말걸 그랬어 왜 이렇게 나 혼자 아파 나보고 떠나라고 할 땐 언제고 떠난다니까 어쩌고 미친 사람 취급만해 정말 힘들어 boy slow down 아무런 말도 못한 채 울어 cause I want to stay next to u my luv is true wanna go back to when I was with u 너 때문에 많이도 울었어 너 때문에 많이도 웃었어 너 때문에 사랑을 믿었어 너 때문에 너 때문에 모두 다 잃었어 정말 답답답해 갑갑갑해 막막막해 너 없는 세상이 내 말을 씹어놓고 자존심 짓밟아놓고 내 맘을 찢어놓고 왜 나를 떠나가 I miss u I need u 꿈속에선 아직도 I'm with u I miss u I need u 시간을 되돌려 wanna kiss u again ma boy 맘이 너무 아픈데 견디기 괴로운데 너는 어디서 뭘하니 나 울었어 참 많이 너 없인 난 못살어 내게로 돌아와줘 날 떠나가지마 너 때문에 많이도 울었어 너 때문에 많이도 웃었어 너 때문에 사랑을 믿었어 너 때문에 너 때문에 모두 다 잃었어 정말 답답답해 갑갑갑해 막막막해 너 없는 세상이 내 말을 씹어놓고 자존심 짓밟아놓고 내 맘을 찢어놓고 왜 나를 떠나가
사랑스러워,김종국,워워 머리부터 발끝까지 다 사랑스러워 워워 니가 나의 여자라는게 자랑스러워 기다림이 즐겁고 이젠 공기마저 달콤해 이렇게 너를 사랑해 세상이 힘들어도 널 보면 마음에 바람이 통해 이런 게 사는 거지 이런 게 행복이지 이제야 느끼게 됐어 나는 온종일 우울해도 널 보면 머리에 햇빛이 들어 이렇게 놀라운게 사랑이지 기다린 보람이 있어 지난번 사랑처럼 울까봐 한참을 망설였지만 보채지 않고 나를 기다려준 너 편안하게 스며들어와 워워 머리부터 발끝까지 다 사랑스러워 워워 니가 나의 여자라는게 자랑스러워 무뚝뚝하던 내가 종일 싱글벙글 웃잖아 대체 내게 무슨 짓을 한거야 워워 그림자와 뒷 모습까지 사랑스러워 워워 부끄러운 애정표현도 자연스러워 기다림이 즐겁고 이젠 공기마저 달콤해 이렇게 너를 사랑해 널 행복하게 해주기 위해 내가 날 아끼게 됐어 내 모습 내가 봐도 이제 조금은 괜찮은 놈이 된 것 같아 워워 머리부터 발끝까지 다 사랑스러워 워워 니가 나의 여자라는 게 자랑스러워 무뚝뚝하던 내가 종일 싱글벙글 웃잖아 대체 내게 무슨 짓을 한 거야 워워 그림자와 뒷 모습까지 사랑스러워 워워 부끄러운 애정표현도 자연스러워 기다림이 즐겁고 이젠 공기마저 달콤해 이렇게 너를 사랑해 워워 나나 나나 나나나 나나 나나 나나나 워워 나나 나나 나나나 나나 나나 나나나 사람들이 모두들 부러워서 견딜 수 없게 그렇게 우리 사랑해 우 한가지만 약속해 세상 끝날 때까지 나에게만 사랑스럽기
Midnight (별 헤는 밤),비스트,그대는 어떤가요 가끔은 나를 생각한 적 있나요 이 긴 밤에 다시 눈을 감고 그댈 생각하고 잠들지 못하고 그래요 조금 유난히 기네요 그대 없는 밤이아쉬워지네요 그때 보낸 그 날이 더 계속 무뎌지겠죠 점점 잊혀지겠죠 언젠가는 그대가 잠이 오지 않는 밤 So sad tonight 그대와 함께할 수 없는 이 밤 In the midnight a a a midnight 니 생각에 잠 못 드는 Midnight 다시 찾아온 이 밤 So sad tonight 그대가 없이 다시 맞는 이 밤 In the midnight a a a midnight a 니가 없이 잠 못 드는 midnight 눈감았다 뜨는 사이보다 더 빠르게 날 찾아왔다 떠나가 버린 사랑 당신 You can’t do this to me 충분하다 충분해 그만 좀 해라 날 아프게 내게 미련이란 이름에 밤은 끝나지 않아 다 지난 얘기 다시 하고 싶진 않지만 내가 그댈 많이 좋아하긴 했나 봐요 계속 생각나겠죠 더 그리워지겠죠 시간이 지날수록 잠이 오지 않는 밤 So sad tonight 그대와 함께할 수 없는 이 밤 In the midnight a a a midnight 니 생각에 잠 못 드는 Midnight 다시 찾아 온 이 밤 So sad tonight 그대가 없이 다시 맞는 이 밤 In the midnight a a a midnight a 니가 없이 잠 못 드는 Midnight 저기 반짝이는 Little star 날 위로해주라 기댈 곳 하나 없이 쓰러지는 오늘 밤 저기 반짝이는 Little star 날 위로해주라 기댈 곳 하나 없이 쓰러지는 별 헤는 밤 계절이 지나 조금씩 달라져가는 이 밤 하지만 난 여전히 난 잠 못 이룬 밤 다시 찾아온 이 밤 So sad tonight 그대가 없이 다시 맞는 이 밤 In the midnight a a a midnight a 니가 없이 잠 못 드는 Midnight
애수(哀愁),god,난 아직도 그대를 잊지 못해 오늘도 그댈 찾아 이 거리를 헤매 난 아직까지 그대만을 원해 다른 사랑을 하지 못해 세상 모든 곳 그대가 있을 만한곳 모두 뒤져봐도 그대를 찾지 못했어 그대는 어딨는 거야 왜 날날 떠나간 거야 내말 안 들리는 거야 내가 널 찾는걸 모르는거야 그런 거야 아니면 나를 만나면 안 될 이유라도 있는 거야 그러면 좋아 내가 널 이렇게 목놓아 부르지 않게 한번만이라도 잠깐만이라도 내 앞에 나타나 줘 꿈속에서라도 나를 봐 조금씩 무너지는 내 모습을 봐 널 찾아 헤매이는 난 지금 힘들어 니가 보고 싶어 니가 날 떠난 그 직후부터 난 아직도 그대를 잊지 못해 오늘도 그댈 찾아 이 거리를 헤매 난 아직까지 그대만을 원해 다른 사랑을 하지 못해 우린 행복했어 정말 행복했어 세상 누구보다 예쁜 사랑을 했어 처음 만난 그 순간 하늘에서 예쁜 눈을 뿌려줬어 마치 한 장면의 영화처럼 너무 아름다운 너와 내가 눈이 맞았었지 움직일 수 없었지 그렇게 우리의 사랑은 시작되었지 그리고 나서 우리는 예쁜 그림을 그리는 꼬마 아이들처럼 그 눈빛처럼 맑고 맑은 유리구슬처럼 투명한 사랑을 만들어 갔어 꿈을 꾸며 함께 미래를 그려봤어 그러다 그녀가 사라졌어 한마디 말도 없이 그렇게 그렇게 내곁을 떠났어 난 아직도 그대를 잊지 못해 오늘도 그댈 찾아 이 거리를 헤매 난 아직까지 그대만을 원해 다른 사랑을 하지 못해 제발 돌아와 내말 안 들려 어서 나타나 나 지금 흔들려 나를 잡아 줘 나를 붙잡아 줘 어서 하루가 다르게 무너지는 날 일으켜 줘 너는 나를 잘 알잖아 난 너밖에 없잖아 니가 없으면 아무 것도 못한다는 걸 알잖아 왜 그래 도대체 왜 이래 대체 왜 이렇게 날 자꾸만 힘들게 해 니가 어디 있든 어디서 무얼 하든 누구와 있었든 그 이유가 무엇이든 아무 것도 묻지 않을게 넌 돌아오기만 하면 돼 난 그전엔 그날이 오기 전에 어쩔 수 없어 난 이렇게 밖엔 살아갈 수 없어 너만을 기다리며 멈출 수 없어 널 찾아 헤매이며 ah girl No I can't live without you everything I see it reminds me of you My heart is so cold Please come back to me 난 아직도 그대를 잊지 못해 오늘도 그댈 찾아 이 거리를 헤매 난 아직까지 그대만을 원해 다른 사랑을 하지 못해
Twist King,터보,Let's twist Come on a people on your big Come on a people in the air You know you gotta be your ware You gotta mope You gotta group U no Dost Crass Quai Quai 바바바 Everybody Dance 춤을 춰봐 모든걸 잊고 세상속에 답답했던 일 벗어버려 소리 높여봐 고함을 질러버려 Everybody Dance 세상살이 걱정하지마 음악속에 몸을 맡긴채 트위스트킹 예 가슴이 답답하면 우리처럼 춤을 춰봐 신나게 추는거야 비벼대고 흔들어 대고 마루바닥 비닐장판 운동화든 맨발이든 상관말고 추는거야 리듬속에 몸을 실어 시원하게 바람을 맞았다면 나와 함께 춤을 춰 되는 일이 없다고 투덜 투덜 대지말고 춤을 춰 매일 지친 하루의 두려움 나를 힘겹게 할때면 사랑하는 연인들의 입맞춤보다 더 짜릿한 춤을 춰봐 바바바 Everybody Dance 춤을 춰봐 모든걸 잊고 세상속에 답답했던 일 벗어버려 소리 높여봐 고함을 질러버려 Everybody Dance 세상살이 걱정하지마 음악속에 몸을 맡긴채 트위스트킹 예 Come on a people on your big Come on a people in the air You know you gotta be your ware you gotta mope You gotta group U no Dost Crass Quai Quai 세상이 이 리저리 꼬였다고 열받지마 사랑이 떠났다고 슬퍼하고 노여워마 나처럼 히프 허리 머리 모두 흔들어대고 다같이 좌로 우로 리듬속에 몸을 실어 길을 걷다 음악이 들려오면 무조건 춤을 춰 상관치마 난 이제 누가 뭐라해도 춤을 출거야 매일 지친 하루의 두려움 나를 힘겹게 할때면 사랑하는 연인들의 입맞춤보다 더 짜릿한 춤을 춰봐 바바바 Everybody Dance 춤을 춰봐 모든걸 잊고 세상속에 답답했던 일 벗어버려 소리 높여봐 고함을 질러버려 Everybody Dance 세상살이 걱정하지마 음악 속에 몸을 맡긴채 트위스트킹 Everybody 지금은 음악이 너무 작은 것 같아 볼륨을 찢어지게 높여줘 더덕 더덕 붙어있는 세상의 찌꺼기를 털어내고파 아름다운 세상 사랑 하고 싶어 나처럼 손뼉치며 춤을 춰봐 또 다른 환상이 보여 가슴까지 시원한 춤추는거야 춤추는 우린 모두 다 Twist King 예
늑대와 함께 춤을,임창정,너를 처음 본 순간 난 숨이 멎어 버렸었지 하늘은 노랗고 머릿속엔 시계 종소리만 울려 하지만 침착해야지 정신차리지 않으면 안되는 순간이야 서두르면 망쳐버릴테니까 하나둘씩 작전을 실행해 볼까 세상엔 둘도 없는 괜찮은 남자로 보여야 할텐데 dance dance dance all right 나의 손을 잡아봐 넌 이미 내 손을 잡았으니 나를 벗어날 순 없어 사랑 사랑할거야 너만 좋아할거야 나도 이렇게 만나지다니 사랑에 빠져 버렸어 자석에 끌리듯 어느새 니앞에 멈춰 서 버린 나 내게 눈길조차 안주던 그런 니가 손을 내밀다니 오 이것 참 너는 나란 남자 있는지 없는지 모르는 듯이 관심조차 안주고 있었는데 이 순간을 너무 기다려왔어 내게 틈을 보이면 너를 향해 뛰어갈 이순간만을 dance dance dance all right 나의 손을잡아봐 넌 이미 내 손을 잡았으니 나를 벗어날 순 없어 사랑 사랑할거야 너만 좋아할거야 나도 이렇게 만나지다니 사랑에 빠져 버렸어 dance dance dance all right 나의 손을 잡아봐 넌 이미 내 손을 잡았으니 나를 벗어날 순 없어 사랑 사랑할거야 너만 좋아할거야 나도 이렇게 만나지다니 사랑에 빠져 버렸어
Push Push,씨스타,Push Push Baby Oh Push Baby Push Push baby Just like SISTAR Push Push Baby Oh Push Baby Push Push baby Push Push Baby 맘을 받아줘 Hey Push Push Baby Boy I want SISTAR Push Push Baby 달콤한 말로 Hey Push Push Baby Boy Push Push Baby Boy Wake up Wake up 감은 두 눈을 떠 Wake up 감추려 하지마 이미 넌 내 손바닥 내 Radar 내꺼 내꺼 누가 뭐래도 넌 내꺼 나는 누구보다 예뻐 We da B E S T SISTAR Welcome Welcome To the New new new World 니가 뭔데 감히 누굴 평가해 No No No More 높이 높이 날지 널 보고 윙크하지 Baby I’m ma Take ya Higher Baby I’m ma Take ya Higher 난 뭔가 다른걸 Sexy 한 Baby Girl 넌 푹 빠질걸 미쳐버릴지도 몰라 난 색다른 걸 Sexy한 Baby Girl 넌 완전 빠질걸 이젠 나만 바라봐 줘 Push Push Baby 맘을 받아줘 Hey Push Push Baby Boy I want SISTAR Push Push Baby 달콤한 말로 Hey Push Push Baby Boy Push Push Baby Boy Keep on pushin’ me 내 맘을 가져봐 We gon’ steal ya heart 날 뺏어보라고 이 떨리는 맘을 차마 난 I can’t stop 널 향한 내 맘을 차마 난 I won’t stop Keep pushin’ Ooh Keep pushin’ Ooh 쉴틈없이 Keep on dashin’ 색다른 fashion I’m on Fire 난 누구보다 Flyer 눈 돌려 내게 모든 시선이 꽂혀 돌아선 니맘을 고쳐 뜸들이다간 나를 놓쳐 I got ya’ I got got ya’ 난 뭔가 다른걸 Sexy 한 Baby Girl 너는 푹 빠질걸 미쳐버릴지도 몰라 나는 색다른 걸 Sexy한 Baby Girl 넌 완전 빠질걸 이젠 나만 바라봐 줘 Push Push Baby 맘을 받아줘 Hey Push Push Baby Boy I want SISTAR Push Push Baby 달콤한 말로 Hey Push Push Baby Boy Push Push Baby Boy 에오 에오 에오 에오 에오 에오 Boy Boy 에오 에오 에오 에오 에오 에오 Boy Push Push Baby Oh Push Baby Push Push baby Just like SISTAR Push Push Baby Oh Push Baby Push Push baby
사나이 가는 길 (폼생폼사),젝스키스,나 폼에 살고 죽고 폼 때문에 살고 폼 때문에 죽고 나 폼 하나에 죽고 살고 사나이가 가는 오 그 길에 길에 눈물 따윈 없어 못써 폼생폼사야 사나이 가는 길에 기죽진 마라 없어도 자존심만 지키면 눈물따윈 내게 없을거야 가슴을 활짝 펴라 잘난 그녀 나를 떠난단 말에 하늘이 무너질것 같아도 남자답게 그녈 보내줬지 기가막혀 홧김에 군대 갈까 했지만 머리깎기 싫어서 다시 생각 고쳤지 날 떠나든 말든 뭘해도 상관은 없지만 머리 빡빡 깎는건 난 견딜수 없어 그저 안녕이라 말하고 쓰린 눈물을 삼키며 예 그녈두고 돌아 섰던 마지막 뒷모습 내가 봐도 멋있었어 폼에살고 폼에 죽는 나인데 이제와 구차하게 붙잡을 순 없잖아 맨몸으로 부딪쳤던 내 삶에 그까짓 이별쯤은 괜찮아 이대로 무너지면 절대로 안돼 뜨거운 가슴으로 다시 시작해 나 가는 길을 누구도 막을순 없어 많은 날이 가고 우연히 다시 그녀를 만나면 예 변해버린 나를 보며 지나간 후회로 땅을치게 만들거야 기가막힌 로맨스도 슬픔도 사나이 큰 가슴에 묻어두고 살거야 그까짓것 이별땜에 지켜온 스타일 구길수는 없잖아 사랑했던 너이긴 하지만 나 째째하게 울진 않을게 두 눈 불끈 힘주고 나 끝까지 참아내고 있어 흑 두고봐 나를 두고봐 내가 얼마나 잘 살지 두고봐줘 또 돌아 내게내게 오지 말고 깨끗이 내모습을 잊어줘 그저 안녕이라 말하고 쓰린 눈물을 삼키며 예 그녈두고 돌아 섰던 마지막 뒷모습 내가 봐도 멋있었어 폼에살고 폼에 죽는 나인데 이제와 구차하게 붙잡을순 없잖아 맨몸으로 부딪쳤던 내 삶에 그까짓 이별쯤은 괜찮아 쓸데없는 미련 따윈 버리고 사나이 큰가슴을 활짝펴고 살거야 폼하나로 버텨왔던 나인데 그까짓 이별쯤은 괜찮아 나 폼에 살고 죽고 폼 때문에 살고 폼 때문에 죽고 나 폼 하나에 죽고 살고 사나이가 가는 오 그 길에 길에 눈물 따윈 없어 못써 폼생폼사야
