Title,Singer,Lyric
Nobody,원더걸스,You Know I still Love You Baby And it will never change I want nobody nobody But You I want nobody nobody But You 난 다른 사람은 싫어 니가 아니면 싫어 I want nobody nobody nobody nobody 난 싫은데 왜 날 밀어내려고 하니 자꾸 내 말은 듣지 않고 왜 이렇게 다른 남자에게 날 보내려 하니 어떻게 이러니 날 위해 그렇단 그 말 넌 부족하다는 그 말 이젠 그만해 넌 나를 알잖아 왜 원하지도 않는 걸 강요해 I want nobody nobody But You I want nobody nobody But You 난 다른 사람은 싫어 니가 아니면 싫어 I want nobody nobody nobody nobody I want nobody nobody But You I want nobody nobody But You 난 다른 사람은 싫어 니가 아니면 싫어 I want nobody nobody nobody nobody 난 좋은데 난 행복한데 너만 있으면 돼 더 바랄게 없는데 누굴 만나서 행복하란 거야 난 널 떠나서 행복할 수 없어 날 위해 그렇단 그 말 넌 부족하다는 그 말 말이 안 되는 말이란 걸 왜 몰라 니가 없이 어떻게 행복해 I want nobody nobody But You I want nobody nobody But You 난 다른 사람은 싫어 니가 아니면 싫어 I want nobody nobody nobody nobody I want nobody nobody But You I want nobody nobody But You 난 다른 사람은 싫어 니가 아니면 싫어 I want nobody nobody nobody nobody I don't want nobody body I don't want nobody body 나는 정말 니가 아니면 니가 아니면 싫단 말야 아 I want nobody nobody But You I want nobody nobody But You 난 다른 사람은 싫어 니가 아니면 싫어 I want nobody nobody nobody nobody I want nobody nobody But You I want nobody nobody But You 난 다른 사람은 싫어 니가 아니면 싫어 I want nobody nobody nobody nobody Back to the days when we were so young and wild and free 모든게 너무나 꿈만 같았던 그 때로 돌아가고 싶은데 왜 자꾸 나를 밀어내려 해 why do you push me away I don't want nobody nobody Nobody nobody but you
CALL ME BABY,EXO,CALL ME BABY   Call me baby 이 거리는 완전 난리야 Call me baby 사람들 사이는 남이야 Call me baby 함께하는 매 순간이 Like BOOM BOOM BOOM BOOM BOOM What up Hey Girl 영원 같던 찰나 운명 같은 순간 나를 한 순간 뚫고가 번개처럼 이 세계를 넌 내 이름 불러주며 나에게로 다가와 놀라워 섬광처럼 가득 차 너를 마주한 순간 oh my 편하게 여기 앉아 이제 내 얘기를 들어봐 Oh I don't care 나 멀리멀리 돌아간대도 이렇게 너의 곁에 단 한 남자가 되어줄 테니 메마른 내 입술에 너 스며들어와 나를 깨워 The time's wasting girl So don't wait don't wait too long 빛나는 것들은 많아 그 안에 진짜를 봐봐 Call me baby Call me baby Call me baby Call me baby You know my name girl 널 향해 커져간 마음아 너 말곤 그 문을 닫아 You know I'm here girl Call me baby Call me baby Call me baby Call me baby 몇 번이라도 Call me girl 나를 나로 존재하게 해 내 세상은 오직 you're the one You're the one Girl you're the one I want 빛나는 것들은 많아 그 안에 진짜를 봐봐 Call me baby Call me baby Call me baby Call me baby 몇 번이라도 Call me girl Baby girl 욕심들 속에 날 선 그 어떤 말도 넘어설 그런 믿음을 보여준 너 모두 변해 날 떠나간대도 너는 나만의 lady 내 손을 잡아주는 그거면 돼 빛나는 것들은 많아 그 안에 진짜를 봐봐 Call me baby Call me baby Call me baby Call me baby You know my name girl 널 향해 커져간 마음아 너 말곤 그 문을 닫아 You know I'm here girl Call me baby Call me baby Call me baby Call me baby 어둔 미로 속에 갇혔던 Oh 나 그 어둠 속에서 날 깨워준 네 목소리 들려와 날 다시 태어나게 해 Yeah E X O Listen Say my name Louder 혼란스러운 공간 속 날 이끌어줄 빛이 되고 놓치지 않아준 너라면 What up 널 안고 변치 않을게 널 안고 나를 떠나버린 사람들과 마주해 Never don't mind about a thing 내 가슴속 그 거대한 공백에 널 더해 흔들리는 세상 속에서 Whoo Babe 빛이 돼준 오직 한 사람 바로 너 Girl you're the one I want You're the one I want 빛나는 것들은 많아 그 안에 진짜를 봐봐 Call me baby Call me baby Call me baby I'll be your baby yeah You know my name girl Ho 나를 나로 존재하게 해 You know I'm here girl 내 세상은 오직 you're the one You're the one Girl you're the one I want 빛나는 것들은 많아 그 안에 진짜를 봐봐 Call me baby Call me baby Call me baby Call me baby 몇 번이라도 Call me girl
끼부리지마,WINNER,끼 좀 부리지마 너 땜에 난 매일매일 불안해 오늘도 빌어 빌어 딴 사람이 널 채 가지 않게 넌 항상 왜 이렇게 오빠라는 사람이 많어 친하단 말만 하곤 왜 다른 설명이 없어 언니 만난다면서 전화기는 왜 꺼져있어 웃겨 정말 화는 왜 네가 내는 건데 한번은 속아도 두 번은 안 속아 나도 어디서 꿀리진 않아 남보다 이 남자 저 남자 조금씩 간보다 또 질리면 KICK하고 차버린 뒤 돌아와 거긴 왜 또 간대 당연히 안돼 남자는 나 빼고 다 한패 니꺼 바로 여기 있잖아 탐내지마 남의 떡 정신차리라 하다 내가 정신 나가겠어 장난치지마 나 장난 아니야 짜증내지마 더 짜증나니까 끼 좀 부리지마 너 땜에 난 매일매일 불안해 오늘도 빌어 빌어 딴 사람이 너를 채가지 않게 끼 좀 부리지마 솔직히 넌 해도 해도 너무해 오늘도 빌어 빌어 딴 놈에게 널 뺏기지 않게 진한 화장하고 친구 집 간다니 참 어이없어 오늘따라 치마는 왜 이리 짧은 건데 날 사랑한다는 거 누구보다 잘 알고 있어 오해라는 네 말 진짜 믿고 싶어 긴 긴 기다림 끝에 드디어 일찍 잤다는 네 전화가 오셨네 재밌게 놀았냐 욱 하고 싶어도 참을 수 밖에 너 훅 떠날까 봐 눈웃음 치고 꼬리치고 혼자 북치고 장구치고 잊을 만 하면 내게 다시 돌아와 뒤통수 치고 이미 온 동네방네 소문났어 어젯밤 너 어딨었어 차라리 거짓말 해줘 장난치지마 나 장난 아니야 짜증내지마 더 짜증나니까 끼 좀 부리지마 너 땜에 난 매일매일 불안해 오늘도 빌어 빌어 딴 사람이 너를 채가지 않게 끼 좀 부리지마 솔직히 넌 해도 해도 너무해 오늘도 빌어 빌어 딴 놈에게 널 뺏기지 않게 웃기만 하지 좀 말고 내 생각 좀 해봐 너 떠나면 아무것도 남는 게 없어 난 울기만 하지 좀 말고 내 생각 좀 해봐 속아주는 것도 이젠 마지막이야
영원한 사랑,씨야/다비치/티아라,너는 바보 정말 너는 바보 사랑하는데 왜 너만 몰라 나는 울보 정말 나는 울보 너의 뒤에서 울고있잖아 난 너만 사랑하고 난 너만 바라보고 난 너만 기다리고 오래된 연인처럼 오래된 습관처럼 네 곁에 있나봐 세상에서 가장 슬픈 말 내겐 친구라는 말 아무리 곁에 있어도 잘해준대도 사랑하진 않으니까 너는 바보 정말 너는 바보 사랑하는데 왜 너만 몰라 나는 울보 정말 나는 울보 너의 뒤에서 울고있잖아 하루 가고 일년이 지나도 사랑 앞에선 나는 느림보 사랑해도 너를 사랑해도 말도 못하는 눈물의 바보  난 너만 사랑해도 난 너만 바라봐도 난 너만 기다려도 오래된 연인처럼 오래된 습관처럼 널 생각하나봐 세상에서 가장 좋은 말 내겐 사랑이란 말 아무리 나를 울려도 상처를 줘도 너만 있으면 괜찮아 너는 바보 정말 너는 바보 사랑하는데 왜 너만 몰라 나는 울보 정말 나는 울보 너의 뒤에서 울고있잖아 하루 가고 일년이 지나도 사랑 앞에선 나는 느림보 사랑해도 너를 사랑해도 말도 못하는 눈물의 바보 다른 사람과는 절대 사랑못해 사랑하니까 사랑하니까 너밖에 모르니까 돌아봐줘 나를 돌아봐줘 너의 뒤에서 난 서있을께 날 안아줘 나를 꼭 안아줘 너의 품 안에 안기고싶어 몰라줘도 내 맘 몰라줘도 바라만봐도 행복하니까 기다릴께 너를 기다릴께 영원히 너만 사랑할꺼야
중독 (Overdose),EXO,모든 걸 걸고 널 들이킨 나 이젠 돌이킬 수도 없다 이건 분명 위험한 중독 So bad no one can stop her Her Love Her Love 오직 그것만 바라 그녀의 사랑 하나뿐인걸 치명적인 Fantasy 황홀함 그 안에 취해 Oh She wants me Oh She’s got me Oh She hurts me 좋아 더욱 갈망하고 있어 Someone Call The Doctor 날 붙잡고 말해줘 사랑은 병 중독 Overdose 시간이 지날수록 통제는 힘들어져 점점 깊숙이 빠져간다 Eh oh Too Much 너야 Your love 이건Overdose Too Much 너야 Your love 이건Overdose 놀리는 그 손길로 온 너 본능은 너를 갈구해 좀 더 가빠진 숨으로 질식된 후에 전율 그리곤 한숨 Her Love Her Love 독한 약 같아 내겐 헤어나올 수 없는 Destiny 피는 뜨거워졌지 마침내 모두 지배해 Oh She wants me Oh She’s got me Oh She hurts me 계속 너만 그리고 그린 나 Someone Call The Doctor 날 붙잡고 말해줘 사랑은 병 중독 Overdose 시간이 지날수록 통제는 힘들어져 점점 깊숙이 빠져간다 Eh oh Too Much 너야 Your love 이건Overdose Too Much 너야 Your love 이건Overdose 모두 다 내게 물어와 내가 변한 것 같대 심장에 네가 박혀버린 듯 세상이 온통 너인데 멈출 수 없어 이미 가득한 널 지금 이 순간 You’re in my heart EXO 난 너를 맛보고 너를 마신다 온 몸이 떨려와 계속 들이켜도 아직 모자라 손끝까지 전율시킨 갈증 이 순간을 잡아 질주를 멈추지 마 너무 좋아 I can't stop Hey Doctor 지금 이대로 괜찮나 나 주체할 수 없는 이끌림 속에 녹아내려가 난 이 느낌 없이는 죽은 거나 마찬가진걸 내가 사는 이유 난 너란 달콤함에 중독 Someone call the doctor Someone Call The Doctor 난 그녀가 필요해 하루도 난 버틸 수 없어 버티지 못해 벗어나고 싶지 않은 천국 같은 너 긴 긴 이 덫은 아름다워 Eh oh Too Much 너야 Your love 이건Overdose Too Much 너야 Your love 이건Overdose
Hot Summer,f(x),Hot Hot Hot Hot Summer Hot Hot Hot Hot Hot Hot Hot Hot Summer Hot Hot Hot Hot 도저히 이렇겐 더 안되겠어 내가 어떻게든 좀 손보겠어 낡은 스타일밖에 모르는 널 프로듀스 얼마나 멋져질지 좀 알겠어 교실에서 사무실 책상에서 청소 안 한 방에서 어서 나와라 어서 뜨거운 광선 쏟아져 앗 따끔해 눈부셔 살짝 찌푸린 눈 선글래스 얼음을 깨문 입 속 와작 얼얼해 하늘은 파랗다 못해 투명해져 Hot Summer Ah Hot Hot Summer Hot Summer Ah Hot Hot 너무 더워 Hot Summer Ah Hot Hot Summer Hot Summer Ah Hot Hot 이게 제 맛 Hot Hot Hot Hot Summer Hot Hot Hot Hot 말리부 해변은 아니더라도 금가루 뿌렸니 눈부셔 파도 발 툭툭 털고 아이스크림 가게로 가십 가득한 TV가 재미없어 한강에서 물 파란 동해에서 저 워터 파크에서 재밌게 놀자 어서 뜨거운 광선 쏟아져 앗 따끔해 눈부셔 살짝 찌푸린 눈 선글래스 얼음을 깨문 입 속 와작 얼얼해 하늘은 파랗다 못해 투명해져 Hot Summer Ah Hot Hot Summer Hot Summer Ah Hot Hot 너무 더워 Hot Summer Ah Hot Hot Summer Hot Summer Ah Hot Hot 이게 제 맛 땀 흘리는 외국인은 길을 알려주자 너무 더우면 까만 긴 옷 입자 Yeah It Must Be Burning Cuz I Got You Sweating In This Weather All Them Heads Be Turning True Dat You Know I Got It 뜨거운 광선 쏟아져 앗 따끔해 눈부셔 살짝 찌푸린 눈 선글래스 얼음을 깨문 입 속 와작 얼얼해 하늘은 파랗다 못해 투명해져 Hot Summer Ah Hot Hot Summer Hot Summer Ah Hot Hot 너무 더워 Hot Summer Ah Hot Hot Summer Hot Summer Ah Hot Hot 이게 제 맛 Hot Summer Ah Hot Hot Summer Hot Summer Ah Hot Hot 너무 더워 Hot Hot Hot Hot Summer Hot Hot Hot Hot Summer
다른 남자 말고 너,미쓰에이,다른 남자 말고 너 다른 남자 말고 너너너너 너 장난해 장난해 하는데 나는 절대로 장난이 아닌데 뭔말이 뭔말이 필요해 봐봐 온몸이 설명해 Baby 남자 친구들 많아 난 그렇다고 사랑 하지 못하나 남잘 모르는 여잔 별로거든 But baby baby oh oh 숨이 콱콱 막히잖아 날 이렇게 만든 건 너였잖아 아무 말도 할 수가 없어 이런 기분 처음인걸 다른 여자완 달라 뻔한 사랑은 싫어 내가 더 많이 좋아해도 상관없어 너만 있으면 돼 다른 남자완 달라 이제 그만 받아줘 You'll be my baby baby baby 너 다른 남자 말고 너 너 다른 남자 말고 너 다른 남자 말고 너너너너 너 가슴이 가슴이 뛰는데 다른 누구도 이렇겐 못했는데 뭔 말이 뭔 말이 필요해 자 봐봐 만져봐 내 심장이 Baby 아는 오빠들 많아 난 그렇다고 절대 쉽지는 않아 남잘 모르는 여잔 별로거든 But baby baby oh oh 숨이 콱콱 막히잖아 날 이렇게 만든 건 너였잖아 아무 말도 할 수가 없어 이런 기분 처음인걸 다른 여자완 달라 뻔한 사랑은 싫어 내가 더 많이 좋아해도 상관없어 너만 있으면 돼 다른 남자완 달라 이제 그만 받아줘 You'll be my baby baby baby 너 다른 남자 말고 너 아무도 안 어울려 지금 니 옆엔 노랜 끝나가고 있는데 넌 아무 말이 없어 Baby 다른 여자완 달라 뻔한 사랑은 싫어 내가 더 많이 좋아해도 상관없어 너만 있으면 돼 다른 남자완 달라 이제 그만 받아줘 You'll be my baby baby baby 너 다른 남자 말고 너 너 다른 남자 말고 너 다른 남자 말고 너너너너 너
여름아! 부탁해,인디고,Just take my hand and I`ll take you there in the sun. I`ll be sailing away. I`ll be flying away with you... 여름아 부탁해 나의 사랑을 이루게 해줘. 많이 힘겨웠던 나의 지난 추억 버리게. 다시 찾아온 해변에서 비키닐 입은 그녈 만난 후 나의 인생이 달라 졌어. 한여름에 Sunset 석양빛이 황홀한 도시의 거리 Let me kiss you one more time 뜨거운 태양에 검게 그을린 그녀를 사귀고 싶어. 긴 머리의 눈이 부신 그대가 좋아. 나에 대해 정말 알고 싶지 않나요. 그대를 가질 수 있다면 담배라도 끊겠어요. 워 Baby. 밤바다에 반짝이는 하늘에 별빛 흔들리는 파도의 노래 소리 그대를 느끼고 싶어. Oh- Beautiful Lady-  조금만 더 기다려. 이대로 나를 떠나지 마요. 아직 사랑하기 전엔 헤어지면 안돼요. 그대 사는 곳 어디인지. 날 어떻게 생각하시는지. 화장 안한 그대얼굴을 만져 보고 싶어. 새하얀 모래 위에 단둘이 앉아 Your lips your eyes I love so much 투명한 그대 눈을 바라봐요. 무릎에 머릴 기대고 반짝이는 저 바다의 사랑의 물결. 지루하게 기다렸던 Summer Vacation 이대로 포기할 수 없어 나를 떠나가지 마요 워 Baby 한여름의 Beach Beach Beach Paradise 모래 위에 적어본 그대 이름 주말에 다시 만나면 함께 있어 줘요 긴 머리의 눈이 부신 그대가 좋아. 나에 대해 정말 알고 싶지 않나요. 그대를 가질 수 있다면 담배라도 끊겠어요.워 Baby. 밤바다에 반짝이는 하늘에 별빛 흔들리는 파도의 노래 소리 그대를 느끼고 싶어. Oh- Beautiful Lady Just take my hand and I`ll take you there in the sun. I`ll be sailing away. I`ll be flying away with cececwsdvs sd.cvmkl;dsv
Piano Man,마마무 (Mamamoo),I'm ready for some action Are you ready for perfection Hey piano man Hello um 아니 매력 없는 대화들이 참 센스 하나 없는 애들 참 힘준 내 하이힐도 공들인 립스틱도 못 알아보는 눈들이 참 따분해 그 때쯤 니가 걸어 나온 것 같애 여기엔 어울리지 않는 피아노맨 하얀 손가락 건반에 내릴 때 눈을 반짝 뜬 것 같아 붐빠빠라 붐빠빠라 붐빠빠라 붐 붐빠빠라 붐빠빠라 붐빠빠라 붐 Hey piano man 춤을 추는 너의 손짓이 The piano man 뻔하지 않은 그 몸짓이 나 뭐랄까 지금 이 곳에서 너랑 나랑 둘만 남을래 이렇게 오른쪽으로 오른쪽으로 오른쪽으로 왼쪽으로 왼쪽으로 왼쪽으로 yeah yeah yeah yeah yeah yeah yeah 손 끝이 건반들을 쓸어 내릴 때 자꾸 나쁜 상상을 했던 것 같애 가슴은 스타카토 Hey Mr 애매모호 내 온 몸은 피아노처럼 붐빠빠라 붐빠빠라 붐빠빠라 붐 붐빠빠라 붐빠빠라 붐빠빠라 붐 Hey piano man 춤을 추는 너의 손짓이 The piano man 뻔하지 않은 그 몸짓이 나 뭐랄까 지금 이 곳에서 너랑 나랑 둘만 남을래 이렇게 왼쪽으로 왼쪽으로 왼쪽으로 오른쪽으로 모두 여기로 Word up Moon Star 시작은 트럼펫 Can I get that Here 사이사이 마다 곁들어진 하이헷 드링 드럼킥 리듬이란 접시 위에다가 달콤한 피아노를 끼얹지 아이 엠 그라운드 자기소개 하기 치마보단 난 긴 청바지 근데도 쟤들은 나 좋다고 다 난리 Oh swing Let’s groove singing Oh swing Let’s groove my babe Oh swing Let’s groove 소개합니다 We are Mamamoo Darling you are my own Hey piano man 이 음악의 끝엔 내게로 oh 내게로 피아노맨 The piano man 이미 할 얘긴 다 한 걸로 네 마지막 남은 멜로디는 너랑 나랑 둘만 너랑 나랑 둘만 그렇게 그렇게 들을래 내일도 모레도 계속 우리 만날래 Ye ye ye ye ye ye ye
짧은 치마 (Miniskirt),AOA,Hey Hey Hey AOA Hey Hey Hey Brave Sound Drop it 날 바라보는 시선이 너는 예전 같지가 않은 걸 난 아직도 쓸만한데 너는 왜 날 헌 신 짝 보듯이 해 Hey 너무 이뻐 보여 내가 뭐를 입던지 너무 섹시해 보여 굳이 노출 안 해도 아찔한 나의 하이힐 새까만 스타킹 도저히 눈을 뗄 수 없을 걸 말리지마 짧은 치마를 입고 내가 길을 걸으면 모두 나를 쳐다봐 짧은 치마를 입고 근데 왜 하필 너만 날 몰라주는데 당당한 여잔데 왜 나를 힘들게 해 넌 나만 무시해 어디로 튈지 몰라 나 시간 내 nail 받고 머릴 바꿔봐도 새 구두 신고 괜히 짧은 치말 입어 봐도 넌 몰라봐 왜 무덤덤해 왜 딴 늑대들이 날 물어가기 전에 그만 정신 차려 boy 너무 이뻐 보여 내가 뭐를 입던지 너무 섹시해 보여 굳이 노출 안 해도 아찔한 나의 하이힐 새까만 스타킹 도저히 눈을 뗄 수 없을 걸 말리지마 짧은 치마를 입고 내가 길을 걸으면 모두 나를 쳐다봐 짧은 치마를 입고 근데 왜 하필 너만 날 몰라주는데 당당한 여잔데 왜 나를 힘들게 해 넌 나만 무시해 어디로 튈지 몰라 나 난 점점 지쳐가 날 바라보는 그 눈빛마저도 왜 그리 차가운지 모르겠어 이제 변할 거야 oh oh 당당한 여잔데 왜 나를 힘들게 해 넌 나만 무시해 어디로 튈지 몰라 나
Lollipop (빅뱅 & 2NE1) (Bonus Track),2NE1,Lolli Lolli Oh Lollipop Lolli Lolli Oh Lolli Lolli Lolli Lolli Lollipop Oh 넌 나의 Lollipop Lolli Lolli Lollipop Oh Lolli Pop Pop Lolli Lolli Lollipop Boy 넌 나의 Lollipop Lolli Lolli Lollipop Oh Lolli Pop Pop 막대사탕보다 더 달콤한 내 마음은 터질듯한 Dynamite 난 깔끔한 남자 T O P 내 사랑 Bling Bling like L E D Oh 그댄 딱 내 스타일이야 반짝반짝 스타야 색다른걸 원해 Let me show you if that's okay Now come on 색깔은 Rainbow 날 느낀 순간 넌 빠져버린걸 알아 You just can't control 날 사로 잡은건 너와 나만이 아는 우리 둘의 Secret Lolli Lolli Lollipop 달콤하게 다가와 Lolli Lolli Lollipop 내게 속삭여줘 Lolli Lolli Lollipop 상큼하게 다가와 Lolli Lolli Lollipop 너를 원하잖아 Lolli Lolli Lollipop Girl 넌 나의 Lollipop Lolli Lolli Lollipop Oh Lolli Pop Pop 날 설레게 하는 너의 Body 너의 Move 이미 네 시선을 가둬버린 나의 Groove 식상함들은 매일 날 지치게 해 Let's just keep You and I F R E S H let's come now 색깔은 Rainbow 날 느낀 순간 넌 빠져버린걸 알아 You just can't control 날 사로 잡은건 너와 나만이 아는 우리 둘의 Secret Lolli Lolli Lollipop 달콤하게 다가와 Lolli Lolli Lollipop 내게 속삭여줘 Lolli Lolli Lollipop 상큼하게 다가와 Lolli Lolli Lollipop 너를 원하잖아 Lolli Lolli Lollipop Boy 넌 나의 Lollipop Lolli Lolli Lollipop Oh Lolli Pop Pop 한 순간의 느낌이 아냐 지금 두 눈을 감아도 넌 내 앞에 서 있는걸 내가 바라던 그게 너야 그냥 이대로 너와 나 저 불빛아래 Lolli Lolli Lollipop 달콤하게 다가와 Lolli Lolli Lollipop 내게 속삭여줘 Lolli Lolli Lollipop 상큼하게 다가와 Lolli Lolli Lollipop 너를 원하잖아 Lolli Lolli Lollipop Oh 넌 나의 Lollipop Lolli Lolli Lollipop Oh Lolli Pop Pop Lolli Lolli Lollipop Oh 넌 나의 Lollipop Lolli Lolli Lollipop Oh Lolli Pop Pop
DADDY (Feat. CL of 2NE1),싸이 (PSY),I got it from my DADDY DADDY I feel nice you look nice 널 보자마자 나 어머나 땡잡았스 Don't think twice 이미 게임 끝났스 U be ma curry I be yo rice My name is PSY 한국말로 박재상 너의 아련한 눈동자에 빠져서 헤엄치고파 오빠 달린다 꽉 붙잡아 언니야 나는 아름다운 아가씨의 동반자 Hold up wait a minute 지금부터 선수끼리 밤이 아까워 turn up louder 불타오르는 아름다운 그대여 How do you like me now How do you like me now How do you like me now How do you like me now Hey Where did you get that body from Where did you get that body from Where did you get that body from I got it from my DADDY I got it from my DADDY I got it got it Hey Where did you get that body from I got it from my DADDY I got it from my DADDY I got it got it Hey Where did you get that body from I got it from my DAD DAD DAD DAD DAD DAD DAD DAD DAD DAD DAD DAD DAD DAD DAD DADDY I got it from my DAD DAD DAD DAD DAD DAD DAD DAD DAD DAD DAD DAD DAD DAD DAD DADDY I'm on fire Take u higher 넌 한폭의 명작 난 아낌없는 buyer Don't be a liar 까고 말해봐요 I be yo honey neva expire 낮에는 잠만 자 밤이 오면 상남자 널 보자마자 나 너무 좋아서 뻑이 가 척 보면 압니다 신나면 어린애 입니다 오빠가 오방가 깜빡이 안 키고 훅 들어갑니다 Hold up wait a minute 지금부터 선수끼리 밤이 아까워 turn up louder 불타오르는 아름다운 그대여 How do you like me now How do you like me now How do you like me now How do you like me now Hey Where did you get that body from Where did you get that body from Where did you get that body from I got it from my DADDY I got it from my DADDY I got it got it Hey Where did you get that body from I got it from my DADDY I got it from my DADDY I got it got it Hey Where did you get that body from I got it from my DAD DAD DAD DAD DAD DAD DAD DAD DAD DAD DAD DAD DAD DAD DAD DADDY I got it from my DAD DAD DAD DAD DAD DAD DAD DAD DAD DAD DAD DAD DAD DAD DAD DADDY Listen Ma papa was a superman hey 그대로 받아왔어 그 몸매 hey 신사이길 거부하는 신사 이 구역에 미친놈은 바로 나 hey I got it from my DAD DAD DAD DAD DAD DAD DAD DAD DAD DAD DAD DAD DAD DAD DAD DADDY I got it from my DAD DAD DAD DAD DAD DAD DAD DAD DAD DAD DAD DAD DAD DAD DAD DADDY I got it from my DAD DAD DAD DAD DAD DADDY
Kissing You,소녀시대 (GIRLS' GENERATION),뚜뚜루 뚜뚜뚜 Kissing you baby 뚜뚜루 뚜뚜뚜 Loving you baby 장난스런 너의 키스에 기분이 좋아 귀엽게 새침한 표정 지어도 어느 샌가 나는 숙녀처럼 내 입술은 사근사근 그대 이름 부르죠 그대와 발을 맞추며 걷고 너의 두 손을 잡고 니 어깨에 기대어 말하고 싶어 고마워 사랑해 행복만 줄게요 Kissing you oh my love 내일은 따스한 햇살 속에 너는 내 옆에 누워 사랑의 노랠 불러주며 웃어줘 달콤한 사랑해 기분 좋은 한마디 뚜뚜루 뚜뚜뚜 Kissing you baby 뚜뚜루 뚜뚜뚜 Loving you baby 눈을 감고 너의 입술에 키스를 하면 내 볼은 핑크빛 물이 들어도 내 마음은 이미 넘어가고 내 가슴엔 두근두근 심장소리 들리죠 그대와 발을 맞추며 걷고 너의 두 손을 잡고 니 어깨에 기대어 말하고 싶어 고마워 사랑해 행복만 줄게요 Kissing you oh my love 내일은 따스한 햇살 속에 너는 내 옆에 누워 사랑의 노랠 불러주며 웃어줘 달콤한 사랑해 기분 좋은 한마디 사랑해 사랑해 너만을 사랑해 하늘만큼 언제나 행복하게 환한 웃음 줄게 너만의 소중한 여자친굴 약속해 너는 내 옆에 있고 나의 두 눈에 있고 너의 품안엔 항상 내가 있을게 그대와 발을 맞추며 걷고 너의 두 손을 잡고 니 어깨에 기대어 말하고 싶어 고마워 사랑해 행복만 줄게요 Kissing you oh my love 내일은 따스한 햇살 속에 너는 내 옆에 누워 사랑의 노랠 불러주며 웃어줘 달콤한 사랑해 기분 좋은 한마디 달콤한 사랑해 기분 좋은 사랑해 한마디
