Title,Singer,Lyric
웃으며 넘길래,제이레빗(J Rabbit),거리에 많은 사람들 어딘가로 향하는 빠른 발걸음 그렇게 모두 살아가지 가슴 속 깊은 사연들 저마다 아픈 구석 하나쯤은 있네 그렇게 모두 살아가지 가끔은 뭐 하나 되는 일이 없고 한없이 작아지고 주저앉고 싶어도 하지만 단 한 가지 나에게 꿈이 있다네 힘들다 뭐래도 난 그냥 웃으며 넘길래 세상을 모른다 해도 아직 많은 길이 남았대도 내 가슴이 뛰네 언제나 그렇듯 웃으며 넘길래 스쳐간 많은 사람들 언제부턴지 기억나질 않네 그런게 모두 추억이지 가끔은 뭐 하나 되는 일이 없고 한없이 작아지고 주저앉고 싶어도 하지만 단 한 가지 나에게 꿈이 있다네 힘들다 뭐래도 난 그냥 웃으며 넘길래 세상을 모른다 해도 아직 많은 길이 남았대도 내 가슴이 뛰네 언제나 그렇듯 웃으며 넘길래
미쳤나봐 (With 권정열 Of 10cm),소란 (SORAN),얘기해 필요하면 다 사줄게 괜찮아 안 힘들어 갔다 올게 하루 종일 내가 하루 종일 내가 언제든 배고프면 다 해줄게 가만히 앉아있어 먹여줄게 하루 종일 내가 하루 종일 내가 사랑해서 그래 나를 좋아해줘 baby 내가 원래 그래 나를 칭찬해줘 everyday 너한테만 그래 나를 예뻐해줘 baby 오직 너에게만 나는 진짜 정말 미쳤나 봐 미쳤나 봐 난 너에게 잡혀 묶였나 봐 너에게만 너에게만 난 너에게 꽂혀서 박혔나 봐 혼자 있고 싶다면 사라질게 말만 해 원한다면 죽어줄게 하루 종일 내가 하루 종일 내가 사랑해서 그래 나를 좋아해 줘 baby 내가 원래 그래 나를 칭찬해줘 everyday 너한테만 그래 나를 예뻐해 줘 baby 오직 너에게만 나는 진짜 정말 미쳤나 봐 미쳤나 봐 난 너에게 잡혀 묶였나 봐 너에게만 너에게만 난 너에게 꽂혀서 박혔나 봐 어쩌려고 요즘에 넌 어쩌려고 뭐하냐고 어쩌려고 그렇게 좋아서 뭘 어쩌려고 어쩌라고 이렇게 난 어쩌라고 너에게만 어쩌라고 이렇게 좋은데 나 미쳤나봐 미쳤나 봐 난 너에게 잡혀 묶였나봐 너에게만 너에게만 난 너에게 꽂혀서 박혔나봐 미쳤나봐 미쳤나봐 난 너에게 잡혀 묶였나봐 너에게만 너에게만 난 너에게 꽂혀서 박혔나봐 미쳤나봐
설레 (Feat. 백예린 Of 15&),올티 (Olltii),넌 가까운듯 하면서도 좀 멀어 익숙한듯 하다가도 낯설어 내꺼인 듯 내꺼 아닌 내꺼처럼 헷갈리게 하지만 할 수 없는 썸이란 거론 네가 책 빼먹은 날엔 내가 네 셔틀 잔소리하다 결국 내다 줘 선뜻 너가 부탁을 하려 날 부르면 네 사소한 바람에도 크게 흔들려 남들보다 잘 아는 서로의 취향 지금보다 더 널 알아가고 싶지만 못하는 건 네 애매한 마음이 원인이야 우린 친구 이상 연인 이하 사춘기처럼 내 마음은 나만 알까 봐 더 다가서면은 너가 달아날까 봐 좋은 친구를 놓치고 후회하는 건 겁이 나 근데 널 친구로만 보긴 싫어 더 이상 내가 고집부려도 매일 져주는 너 말은 친구라 하는데 알게 모르게 설레 나름 눈치를 줘도 웃기만 하는 너 나만 이런건지 네 마음도 같은건지 확실하게 말해줘 내게 전화기를 꼭 쥐고 계속 기다리는 톡 마침내 온 네 문자에 관심 없는 척 답장해도 내 답은 객관식 아닌 주관식 막 찍지 않아 고민하며 한 문장씩 넌 나에 대해 깜지를 가득 채울 수 있겠지 정작 내 머린 너만 생각하면 백지가 되지 그곳에다 새로 써보는 자소서 친구가 아닌 한 명의 남자로서 너의 옆에 붙어있기만 해도 붕 떠 친구였던 너에게 어느 순간부터 깊게 빠져들었어 단번에 바다 같은 네 마음에 내 마음도 동해 하루종일 아른거려 너가 내게 주입되어버린 곳은 머리 아닌 마음 이제 네 연애방정식을 내게 대입해 그 결과값은 항상 거짓 아닌 참 내가 고집부려도 매일 져주는 너 말은 친구라 하는데 알게 모르게 설레 나름 눈치를 줘도 웃기만 하는 너 나만 이런건지 네 마음도 같은건지 확실하게 말해줘 내게 밀고 당겨 우리 사인 애매모호 지금 이 간격 너의 마음 때문에 너무 헷갈려 친구라고 생각하기엔 친근함보다 설렘에 더 가깝기에 망설이지 말고 지금 내 손을 잡아줘 너가 먼저 한 발짝만 다가와 줘 다시 말해 이제는 모른 체할 때가 아닌 보여줄 때 그래도 쑥스러울 듯해 내가 고집부려도 매일 져주는 너 말은 친구라 하는데 알게 모르게 설레 나름 눈치를 줘도 웃기만 하는 너 나만 이런건지 네 마음도 같은건지 확실하게 말해줘 내게 자꾸만 설레 널 바라볼 때 웃는 네 모습에도 숨이 차 헤벌레 자꾸만 설레 네 옆에 설 때 손끝이 스치면 흠칫 난 놀래 자꾸만 설레 혼자 쩔쩔매 진짜 내가 고백이라도 하면 어쩔래 자꾸만 설레 기다려볼래 근데 넌 언제쯤 다가올래
여름밤,헤르쯔 아날로그 (Herz Analog),뜨겁던 해는 지고 선선한 바람이 부는 여름 밤 어둠으로 물든 하늘엔 식은 공기만 있어 풀벌레 우는 소리 그네에 앉아 듣는 여름밤 그늘이란 없는 따가운 햇살 같던 나의 일상 긴 오후가 가 버리고 하루의 끝자락에 있지만 가로등 불빛 아래서 나의 하루를 아직 끝내지 못하고 서성이고 있어 부드러운 바람이 불면 슬며시 눈을 감아 무더웠던 나의 하루를 어루만져주는 여름밤 향기로운 바람이 불면 살며시 미소를 지어 무더웠던 나의 하루를 어루만져주는 여름밤 부드러운 바람이 불면 슬며시 눈을 감아 무더웠던 나의 하루를 어루만져주는 여름밤 향기로운 바람이 불면 살며시 미소를 지어 무더웠던 나의 하루를 어루만져주는 여름밤
International Love Song,검정치마,I wanna be with you oh I wanna be with you through the rain and snow I wanna be with you oh I wanna be with you oh I wanna be with you and I really really wanna be with you I'm so very lonely without you I can hardly breathe when you are away without you I might sleep away all day I wanna be with you oh I wanna be with you through the rain and snow I wanna be with you oh I wanna be with you oh I wanna be with you and I really really wanna be with you I'm so very lonely without you I can hardly breathe when you are away without you I might sleep away all day so you can come and see me in my dreams you can come and see me in my dreams oh my eyelids are heavy but my heart's filled with bright lights sleep all day to see you you'll be in my arms tonight and I really really wanna be with you I'm so very lonely without you I can hardly breathe when you are away without you I might sleep away all day without you I might sleep away all day without you I might sleep away all day without you I might sleep away all day
오늘밤은 어둠이 무서워요,10CM,오늘밤은 혼자 있기가 무서워요 창문을 여니 바람 소리가 드세요 사람들은 나를 보살펴 주지 않어 잠들때까지 날 떠나지 말아줘요 꾸물거리는 저기 벌레를 잡아줘요 잡은 휴지는 꼭꼭 구겨 창문밖에 던져 버려줘 오늘의 나는 절대 결코 강하지 않어 그냥 오늘밤만 네게 안겨서 불러주는 자장 노랠 들을래 오늘밤은 혼자잠들기 무서워요 저기 작은 방에 무언가 있는 거같어 잠깐만요 나 원래 이런사람 아냐 잠들때까지 집에 가지 말아줘요 혹시 모르니 저기 대문을 잠가줘요 들어올때는 불을 끄고 방문을 반쯤 열어줘 오늘의 나는 절대 결코 강하지 않어 그냥 오늘밤만 네게 안길래 혹시나 내가 못된 생각 널 갖기 위한 시커먼 마음 의심이 된다면 저 의자에 나를 묶어도 좋아 창밖을 봐요 비가 와요 지금 집에 가긴 틀렸어요 버스도 끊기고 여기까진 택시도 안와요 오늘밤은 혼자 있기가 무서워요 잠들때까지 머릿결을 만져줘요 믿어줘요 나 원래 이런사람 아냐 그냥 오늘밤만 네게 안겨서 불러주는 자장노랠 들을래 제발 오늘밤만 가지 말아요
들었다 놨다,데이브레이크 (DAYBREAK),처음 너를 본순간 정신 차릴수없어 내 마음을 들킬까봐 조심조심해 어떡하면 네 맘을 답답해진 내 맘을 쫄깃해진 심장이 나 어쩌면 좋아 가까워졌다 점점 멀어져가는 이상해 울다가 웃다 나 좀 내버려둬요 언제나 이랬따 저랬다 헷갈려 그녀는 내 맘을 들어다 놨다 들었다 놨다 들었다 놨다 hey 내 맘을 들어다 놨다 들었다 놨다 들었다 놨다 hey 내 맘을 들어다 놨다 들었다 놨다 들었다 놨다 hey 내 맘을 들어다 놨다 들었다 놨다 hey 다시 너를 본순간 차갑게 대해보려 애써 관심 없는 듯이 외면 했지만 너의 눈빛 하나에 너의 손짓 하나에 바짝바짝 말라버려 나의 입술은 멀어져갔다 다시 다가와주는 오늘도 울다가 웃다 점점 짜증이나요 언제나 이랬다 저랬다 헷갈려 그녀는 내 맘을 들어다 놨다 들었다 놨다 들었다 놨다 hey 내 맘을 들어다 놨다 들었다 놨다 들었다 놨다 hey 내 맘을 들어다 놨다 들었다 놨다 들었다 놨다 hey 내 맘을 들어다 놨다 들었다 놨다 hey  들어다 놨다 들었다 놨다 들었다 놨다 hey 내 맘을 들어다 놨다 들었다 놨다 들었다 놨다 hey 오 어떡하면 그녀를 내 맘속에 가둬둘 수 있을까 들어다 놨다 들었다 놨다 들었다 놨다 hey 내 맘을 들어다 놨다 들었다 놨다 들었다 놨다 hey 내 맘을 들어다 놨다 들었다 놨다 들었다 놨다 hey 들었다 놨다 들었다 놨다 hey
카페에 앉아 (First Album Ver.),원 모어 찬스 (one more chance),어떤 여자도 눈이 가지가 않아 다정한 연인도 부럽지가 않아 카페에 흐르는 노래는 나를 설레게 하고 혼자 계속 나 웃고 있어 들어오는 사람은 모두 그녀 같고 멋으로 찬 가지 않는 시계만 보고 유리창에 비친 얼굴을 몇 번이나 확인하고 빨리 와 너 보고 싶어 우 우 우 waiting for your love 우 우 우 카페에 앉아 우 우 우 너를 기다려 어떤 모습으로 내 앞에 나타날까 뭐라고 첫마디를 건네어 볼까 네가 왔을 때에 상황을 연습하기도 하고 세상에서 가장 행복한 기다림 우 우 우 waiting for your love 우 우 우 카페에 앉아 우 우 우 너를 기다려 한시도 가만있지 못하는 내가 이렇게 오랫동안 가만히 앉아 널 기다리고 있어 조심스럽게 내 맘을 전할까 아니면 남자답게 말할까 언제나 내 옆에 있어달라고 우 우 우 waiting for your love 우 우 우 카페에 앉아 우 우 우 너를 기다려 우 우 우 waiting for your love 우 우 우 카페에 앉아 우 우 우 너를 기다려 waiting for your love waiting for your love waiting for your love
네가 좋아 (Feat. 박원 Of 원모어찬스),안녕하신가영,우리 만나기로 한 어떤 날 조금 일찍 도착해서 너를 기다려 왠지 비슷한 옷일 것만 같아 약속한 시간이 다가오고 수많은 사람들 속에도 네가 보여 그 순간 시간이 멈춰버릴 것만 같아 나는 환하게 웃는 네가 좋아 밝게 웃는 네가 좋아 둘이서 손잡고 고른 영화가 재미없어도 그냥 좋아 나는 맛있게 먹는 네가 좋아 그런 널 보고만 있어도 웃음이 나 사실은 난 그냥 네가 좋아 나는 환하게 웃는 네가 좋아 밝게 웃는 네가 좋아 둘이서 손잡고 고른 영화가 재미없어도 그냥 좋아 나는 맛있게 먹는 네가 좋아 그런 널 보고만 있어도 웃음이 나 사실은 난 그냥 정말로 난 그냥 진짜로 난 그냥 네가 좋아 네가 좋아
나 그대의 사랑이 되리 (선잠),제이레빗(J Rabbit),그대 그 밤의 작은 불빛 외로움 짙은 차가운 밤 부질없는 욕심에 눈물을 삼킨날도 많았소 우리의 사랑이 시작되고 그대 손 마주잡고 함께한다면 이 세상 어떤 것 이라도 견뎌내리라 나 약속하겠소 언젠가 우리 삶이 힘겨울 때 세월이 지나고 아득한 그 향기가 잊혀져 간대도 사랑해 그대를 사랑해 오 나 그대의 향기가 되리 언젠가 우리 삶이 힘겨울 때 세월이 지나고 우리 지난 날 들이 바래져 간대도 사랑해 그대를 사랑해 오 나 그대의 추억이 되리 나 그대의 사랑이 되리
망고,CHEEZE (치즈),그대가 날 바라 볼 때 살며시 미소 지을 땐 조금은 알 수 있는걸 시큰둥 투정 부리지만 왠 종일 곁에 없어도 눈을 돌려봐도 더 보고 싶은 I have a chance to fall in love Falling in love 멋쩍은 그 수줍은 미소도 아직까지 생각나 그대가 따스하게 건넨 인사까지도 설레해 Your my baby Love is you 하루가 24시간이라면 너가 보고 싶은 시간은 24시간 초과 좋아한다고 말하려 해도 용기 제로에 10년째 만났어도 난 널 잘 몰라 혼자는 질려 살아가다 미뤄진 사랑 앞에서 이젠 겁먹긴 싫어 그녀가 마침내 왔을 땐 어제와는 다른 너와 나를 만들래 가끔은 묻고 싶어 언제부터 나를 안고 싶어 했었는지 You have a chance to fall in love Falling in love 멋쩍은 그 수줍은 미소도 가득 안긴 그대의 품만큼 따스하게 잡은 두 손마저도 감사해 Be my baby 품 안에 담아 놓고픈 너의 작은 몸과 간질거리는 네 손가락건반과 코끝에 닿을 듯한 아담한 키 높이와 귀여운 눈 질끈 감기를 내게만 허락해 줘서 감사해 사실은 첨부터였던 것 같아 널 꼭 안고 싶었던 때가 네 작은 행동하나에 웃던 내가 지금 하는 널 위한 거수경례 네 미소에 영원할게 멋쩍은 그 수줍은 미소도 가득 안긴 그대의 품만큼 따스하게 잡은 두 손마저도 감사해 Be my baby Love is you
챠우챠우-아무리 애를 쓰고 막아 보려 해도 너의 목소리가 들려,델리스파이스,너의 목소리가 들려 너의 목소리가 들려 너의 목소리가 들려 너의 목소리가 들려 아무리 애를 쓰고 막아 보려 하는데도 아무리 애를 쓰고 막아 보려 하는데도 너의 목소리가 들려 너의 목소리가 들려 아무리 애를 쓰고 막아 보려 하는데도 아무리 애를 쓰고 막아 보려 해도 너의 목소리가 들려 너의 목소리가 들려 아무리 애를 쓰고 막아 보려 하는데도 아무리 애를 쓰고 막아 보려 해도 너의 목소리가 들려 너의 목소리가 들려 너의 목소리 너의 목소리 너의 목소리가 들려 너의 목소리 너의 목소리 너의 목소리가 들려
내 남자친구가 고맙대,헤이즈 (Heize),내 남자친구가 고맙대 날 버려줘서 너무 고맙대 내 남자친구가 고맙대 힘들게해줘서 너무 고맙대 내 남자친구가 고맙대 내 남자친구가 고맙대 내 남자친구가 내 남자친구가 내 남자친구가 고맙대 농담이 아니고 내 남자친구가 너한테 고맙다고 전하고 싶댄다 이건 메세지 같은거지 내 노래는 니가 들어볼거라는 걸 알고 있으니까 솔직히 남자친구 입장에서 한 때나마 날 가졌던 너란 존재는 어찌보면 없애고 싶은 놈 맞어 내 눈빛 손길 온기 또 몸짓을 보고 느꼈을 너의 전부 싹 다 소멸시키고 싶다가도 내 눈빛 손길 온기 또 몸짓을 보고 느낄 수 있게 날 떠나줘서 고맙다고 말 하곤 하지 날 안았던 사실이 좆 같은거지 너따윈 그냥 귀여운 똥강아지 내 남자친구가 고맙대 날 버려줘서 너무 고맙대 내 남자친구가 고맙대 힘들게해줘서 너무 고맙대 내 남자친구가 고맙대 내 남자친구가 고맙대 내 남자친구가 내 남자친구가 내 남자친구가 고맙대 내 친구들이나 또 많은 여자 애들 말하길 누굴 만나도 다 전에 걔와 비교하게 되지 잊기 위해 만나는 남자들마다 더 생각나게 하니 이거 진짜 골치가 아퍼 맞아 나도 다 비교하게 되던 걸 그래서 다 고마운 난 감동주기 쉬운 Girl 원래 좋은 남자지만 더 빛 나 니 다음이라 아 네 여자친군 힘들겠다 내 다음이라 마지막에 넌 나를 열두번 쯤은 더 죽이고 내 심장에 칼을 꽂은 Hitler 너 때문에 내가 울 때 고마워 웃고 니가 정신 차릴까봐 겁났단 얜 너완 틀려 근데 너한테 진짜 제일 고마운 사람은 나야 그 때 안 꺼져줬음 오빠 못 만났을거 아냐 그 뿐이야 넌 내게 좋은 영감으로 남아 니가 싫어하던 내 꿈에 도움된게 더 많아 인정하지 난 자격이 있어 널 욕해도 돼도 뭣하러 그딴데 에너지 안 쏟지 너한테 고마워 해 넌 그리워해 날 그리워해 내가 보고플 땐 그리워해 후회나해 내 남자친구가 고맙대 날 버려줘서 너무 고맙대 내 남자친구가 고맙대 힘들게해줘서 너무 고맙대 내 남자친구가 고맙대 내 남자친구가 고맙대 내 남자친구가 내 남자친구가 내 남자친구가 고맙대 인정하지 난 자격이 있어 널 욕해도 돼도 뭣하러 그딴데 에너지 안 쏟지 너한테 고마워 해 넌 그리워해 날 그리워해 내가 보고플 땐 그리워해 후회나해 인정하지 난 자격이 있어 널 욕해도 돼도 뭣하러 그딴데 에너지 안 쏟지 너한테 고마워 해 넌 그리워해 날 그리워해 내가 보고플 땐 그리워해 후회나해
취미는 사랑 (Album Ver.),가을방학,미소가 어울리는 그녀 취미는 사랑이라 하네 만화책도 영화도 아닌 음악 감상도 아닌 사랑에 빠지게 된다면 취미가 같으면 좋겠대 난 어떤가 물었더니 미안하지만 자기 취향이 아니라 하네 주말에는 영화관을 찾지만 어딜 가든지 음악을 듣지만 조금 비싼 카메라도 있지만 그런 걸 취미라 할 수는 없을 것 같대 좋아하는 노래 속에서 맘에 드는 대사와 장면 속에서 사람과 사람 사이 흐르는 온기를 느끼는 것이 가장 소중하다면서 물을 준 화분처럼 웃어 보이네 미소가 어울리는 그녀 취미는 사랑이라 하네 얼마나 예뻐 보이는지 그냥 사람 표정인데 몇 잔의 커피값을 아껴 지구 반대편에 보내는 그 맘이 내 못난 맘에 못내 맘에 걸려 또 그만 들여다보게 돼  내가 취미로 모은 제법 값 나가는 컬렉션 그녀는 꼭 남자애들이 다투던 구슬 같대 그녀의 눈에 비친 삶은 서투른 춤을 추는 불꽃 따스함을 전하기 위해 재를 남길 뿐인데 미소가 어울리는 그녀 취미는 사랑이라 하네
내일을 묻는다 (Album Edit),제이레빗(J Rabbit),시간을 맴돌아 그 어릴 적 꿈꾸던 곳에 익숙한 목소리 작은 소녀가 소소한 발걸음에 부르던 콧노래  아무도 모르는 비밀의 문에 들어가 마음 가득 소망을 담아 행복한 미소 짓고 몰래 눈물도 훔치고 오늘 이 노래를 부른다 아득한 시간을 되돌아보고 모든 게 선명하지 않더라도 소중했던 추억이 기억들을 지워버린 나의 지난 날들이 또 다른 내일을 묻는다  아무도 모르는 비밀의 문에 들어가 마음 가득 소망을 담아 행복한 미소 짓고 몰래 눈물도 훔치고 오늘 이 노래를 부른다 아득한 시간을 되돌아보고 모든 게 선명하지 않더라도 소중했던 추억이 기억들을 지워버린 나의 지난 날들이 또 다른 내일을 묻는다  모든게 선명하지 않더라도 소중했던 추억이 기억들을 지워버린 나의 지난 날들이 또 다른 내일을 묻는다
큰새,혁오 (HYUKOH),기억의 기억을 훑어야 해 꽉 잡은 밤하늘을 돌봐야 해 늘 검은 천장으로 여겼더니 달은 열심히 떠올라 보름달을 보여주네 반복의 반복을 더해야해 아쉬워라 말하진 않을 거야 아 이렇게 지내다 옆을 보니 이젠 다 크고 살기 바뻐 어른 놀이를 하네 쉬어도 쉴 틈은 없어야 해 오늘도 무사히 잘 넘겨야 해 언젠가는 나도 버려질 거야 결국 이러면 우리는 아무 것도 아닌 사람
유자차,브로콜리너마저,바닥에 남은 차가운 껍질에 뜨거운 눈물을 부어 그만큼 달콤하지는 않지만 울지 않을 수 있어 온기가 필요했잖아 이제는 지친 마음을 쉬어 이 차를 다 마시고 봄날으로 가자 우리 좋았던 날들의 기억을 설탕에 켜켜이 묻어 언젠가 문득 너무 힘들 때면 꺼내어 볼 수 있게 그때는 좋았었잖아 지금은 뭐가 또 달라졌지 이 차를 다 마시고 봄날으로 가자 이 차를 다 마시고 봄날으로 가자
Love Shine,검정치마,내일이면 나를 버릴 사람들 걱정하는게 아니에요 내일이면 난 다시 바다 건너에 홀로 남을 그대는 괜찮나요 내 귓가에 노래를 불러 넣어줘요 다른 새소리가 들려오지 않게 유일했던 사랑을 두고 가는 내게 숨겨뒀던 손수건을 흔들어줘요 hey let your bright light shine on me can you love me unconditionally and sing a million lullabies on a sleepy day hey let your sea breeze blow on me when i am sailing internationally and whisper all your prayers on a stormy day 그대 입안에 내 숨을 불어 넣어줬죠 그 작은 심장이 내려앉을 때마다 내일이면 날 잡을 수도 없어요 홀로 남을 그대는 괜찮나요 hey let your bright light shine on me can you love me unconditionally and sing a million lullabies on a sleepy day hey let your sea breeze blow on me when i am sailing internationally and whisper all your prayers on a stormy day hey 눈을 붉혀선 안돼요 우리 다시 만나는 날에는 같이 늙고 싶다고 약 약속을 해줄께요 hey let your bright light shine on me can you love me unconditionally and sing a million lullabies on a sleepy day hey let your sea breeze blow on me when i am sailing internationally and whisper all your prayers on a stormy day
깜빡 (Feat. Zion.T & Crucial Star),GRAY (그레이),방금 지나간 저 여자도 예쁘기는 해 방금 또 스쳐지나간 여자도 괜찮은 몸매였어 but you know what 재미없어 no no 전부 매력없어 so so 다 거기서 거기 뭔가 가벼운 느낌 Oh 내가 말을 걸어도 넌 튕길걸 알어 잘 아는 곳인데도 넌 길을 묻게 만들어 baby 깜빡 하고 다시 눈을 또 깜빡 하고 다시 봐도 넌 달라 쟤들과는 달라 너무 달라 깜빡 하고 다시 눈을 또 깜빡 하고 다시 봐도 넌 달라 달라 달라 hoo Du Du Du Duh 아까부터 계속 널 봤어 CGV 앞에서 눈이 마주칠수록 시크해져가 넌 나같은 놈들은 관심도 없다는 듯 동정하듯 날 쳐다보는 차가운 눈 그래서 더 끌려 배우같은 포즈 높은 high heels 주변을 두리번 기다리나봐 니 애인 그러니까 음 baby girl I'm just sayin' 너의 남자 잠시 깜빡 잊게하고 싶은데 내가 말야 전화번호 같은건 물어보지 않을게 대신 이어폰 한 쪽만 껴봐 이게 누구 노래냐면 깜빡 하고 다시 눈을 또 깜빡 하고 다시 봐도 넌 달라 쟤들과는 달라 너무 달라 깜빡 하고 다시 눈을 또 깜빡 하고 다시 봐도 넌 달라 달라 달라 hoo Du Du Du Duh
앵콜요청금지,브로콜리너마저,안돼요 끝나버린 노래를 다시 부를 순 없어요 모두가 그렇게 바라고 있다 해도 더 이상 날 비참하게 하지 말아요 잡는 척이라면은 여기까지만 제발 내 마음 설레이게 자꾸만 바라보게 하지 말아요 아무 일 없던 것처럼 그냥 스쳐 지나갈 미련인 걸 알아요 아무리 사랑한다 말했어도 다시 돌아올 수 없는 그 때 그 맘이 부른다고 다시 오나요 아무래도 다시 돌아갈 순 없어 아무런 표정도 없이 이런 말하는 그런 내가 잔인한가요 제발 내 마음 설레이게 자꾸만 바라보게 하지 말아요 아무 일 없던 것처럼 그냥 스쳐 지나갈 미련인 걸 알아요 아무리 사랑한다 말했어도 다시 돌아올 수 없는 그 때 그 맘이 부른다고 다시 오나요 아무래도 다시 돌아갈 순 없어 아무런 표정도 없이 이런 말하는 그런 내가 잔인한가요 아무래도 네가 아님 안되겠어 이런 말하는 자신이 비참한가요 그럼 나는 어땠을까요 아무래도 다시 돌아갈 순 없어 아무런 표정도 없이 이런 말하는 그런 내가 잔인한가요 안돼요 끝나버린 노래를 다시 부를 순 없어요 모두가 그렇게 바라고 있다 해도 더 이상 날 비참하게 하지 말아요 잡는 척이라면은 여기까지가 좋을 것 같아요
