Title,Singer,Lyric
오래된 노래,스탠딩 에그,오래전에 함께 듣던 노래가 발걸음을 다시 멈춰 서게 해 이 거리에서 너를 느낄 수 있어 널 이곳에서 꼭 다시 만날 것 같아 너일까 봐 한 번 더 바라보고 너일까 봐 자꾸 돌아보게 돼 어디선가 같은 노래를 듣고 날 생각하며 너 역시 멈춰있을까 오래전에 함께 듣던 노래가 거리에서 내게 우연히 들려온 것처럼 살아가다 한 번쯤 우연히 만날 것 같아 사랑했던 그 모습 그대로 내 사랑이 그대로인 것처럼 발걸음이 여길 찾는 것처럼 꼭 만날 거야 지금 이 노래처럼 날 사랑하는 네 맘도 같을 테니까 오래전에 함께 듣던 노래가 거리에서 내게 우연히 들려온 것처럼 살아가다 한 번쯤 우연히 만날 것 같아 사랑했던 그 모습 그대로 운명처럼 아니면 우연처럼 우리가 다시 예전처럼 만날 수 있다면 너에게 나 해주고 싶은 말이 하나 있어 널 다시는 놓치지 않을게 오래전에 함께 듣던 노래가 거리에서 내게 우연히 들려온 것처럼 살아가다 한 번쯤 우연히 만날 것 같아 사랑했던 그 모습 그대로
안아줘,정준일,서러운 맘을 못 이겨 잠 못 들던 어둔 밤을 또 견디고 내 절망관 상관없이 무심하게도 아침은 날 깨우네 상처는 생각보다 쓰리고 아픔은 생각보다 깊어가 널 원망하던 수많은 밤이 내겐 지옥같아 내 곁에 있어줘 내게 머물러줘 네 손을 잡은 날 놓치지 말아줘 이렇게 니가 한걸음 멀어지면 내가 한걸음 더 가면 되잖아 하루에도 수천번씩 니 모습을 되뇌이고 생각했어 내게 했던 모진 말들 그 싸늘한 눈빛 차가운 표정들 넌 참 예쁜 사람 이었잖아 넌 참 예쁜 사람 이었잖아 제발 내게 이러지 말아줘 넌 날 잘 알잖아 내 곁에 있어줘 내게 머물러줘 네 손을 잡은 날 놓치지 말아줘 이렇게 니가 한걸음 멀어지면 내가 한걸음 더 가면 되잖아 내겐 내가 없어 난 자신이 없어 니가 없는 하루 견딜 수가 없어 이젠 뭘 어떻게 해야 할지 모르겠어 니가 없는 난 그냥 날 안아줘 나를 좀 안아줘 아무 말 말고서 내게 달려와줘 외롭고 불안하기만 한 맘으로 이렇게 널 기다리고 있잖아 난 너를 사랑해 난 너를 사랑해 긴 침묵 속에서 소리 내 외칠게 어리석고 나약하기만 한 내 마음을
스토커,10CM,나도 알아 나의 문제가 무엇인지 난 못났고 별 볼 일 없지 그 애가 나를 부끄러워 한다는 게 슬프지만 내가 뭐라고 빛나는 누군갈 좋아하는 일에 기준이 있는 거라면 이해할 수 없지만 할 말 없는걸 난 안경 쓴 샌님이니까 내가 이렇게 사랑하는데 이렇게 원하는데 나는 아무것도 할 수 없고 바라만 보는데도 내가 그렇게 불편할까요 내가 나쁜 걸까요 아마도 내일도 그 애는 뒷모습만 이제 알아 나의 할 일이 무엇인지 다 포기하고 참아야 하지 저 잘 나가는 너의 남자친구처럼 되고 싶지만 불가능하지 빛나는 누군갈 좋아하는 일에 기준이 있는 거라면 이해할 수 없지만 할 말 없는걸 난 안경 쓴 샌님이니까 내가 이렇게 사랑하는데 이렇게 원하는데 나는 아무것도 할 수 없고 바라만 보는데도 내가 그렇게 불편할까요 내가 나쁜 걸까요 아마도 내일도 그 애는 나는 왜 이런 사람 이런 모습이고 이런 사랑을 하고 나는 아무것도 될 수 없고 바라만 보는데도 내가 그렇게 불편하니까 내가 나쁜 거니까 아마도 내일도 그 애는 나도 알아 나의 문제가 무엇인지
오빠야,신현희와김루트,오빠야 내가 진짜 좋아하는 사람이 생겨서 혼자 끙끙 앓다가 죽어버릴 것만 같아서 얘기를 한다 눈 앞에 아른아른거리는 잘생긴 얼굴 자꾸 귀에 맴도는 그의 촉촉한 목소리 예 네가 좋아하는 그 남자 도대체 누구길래 이렇게나 들뜬 거니 얼굴은 어떻게 생겼는지 무슨 일을 하는지 나는 너무나 궁금해 나는 너를 좋아하고 너를 좋아하고 너도 나를 좋아하고 나를 좋아하고 우린 서로 좋아하는데도 그 누구도 말을 안 해요 나는 너를 좋아하고 너를 좋아하고 너도 나를 좋아하고 나를 좋아하고 우린 서로 좋아하는데도 그 누구도 말을 안 해요 말을 하면 멀어질까 너무 두려워 너를 잃기가 나는 너무 무서워 말을 하면 멀어질까 너무 두려워 너를 잃기가 나는 너무 무서워 예 좋아하는 마음에 떨리는 날들에 더 없이 덧없이 마음이 커지고 두근대는 마음에 설레는 날들에 난 헤어 나올 수 없어 나는 너를 좋아하고 너를 좋아하고 너도 나를 좋아하고 나를 좋아하고 우린 서로 좋아하는데도 그 누구도 말을 안 해요 나는 너를 좋아하고 너를 좋아하고 너도 나를 좋아하고 나를 좋아하고 우린 서로 좋아하는데도 그 누구도 말을 안 해요 나는 너를 좋아하고 너를 좋아하고 너도 나를 좋아하고 나를 좋아하고 우린 서로 좋아하는데도 그 누구도 말을 안 해요 나는 너를 좋아하고 너를 좋아하고 너도 나를 좋아하고 나를 좋아하고 우린 서로 좋아하는데도 그 누구도 말을 안 해요 나는 너를 좋아하고 너를 좋아하고 너도 나를 좋아하고 나를 좋아하고 우린 서로 좋아하는데도 그 누구도 말을 안 해요 나는 너를 좋아하고 너를 좋아하고 너도 나를 좋아하고 나를 좋아하고 우린 서로 좋아하는데도 그 누구도 말을 안 해요
겨울을 걷는다,윤딴딴,벌써 몇 달 짼가 너 만난다는 그 사람 얘길 들었어 아마 뭔 일이 있었나 저쨌나 떠들어대던 심보가 이젠 여기까지 발동해서 널 떠올리게 됐나봐 또 어쩌다 친구들에게 그 시절 얘길 들어도 내가 한 마디 못한 너를 멋대로 막돼먹게 말을 맘대로 막해 막 때리지도 못해 내 자신을 난 그게 문제였어 너와 이별에 난 버린 것이 많고 찾을 것이 많고 가는 마음마다 머물지를 잘 못해 사랑했던 시간 널 좋아했던 그 많은 아픈 날을 걸었네 너와 이별은 또 많은 날을 울게 만들었어 이젠 모두 지난 얘기지만 시간이 지난 난 처음 널 만났던 그 겨울 속을 걸어가 눈물없인 볼 수 없다던 한참 인기 많은 영화를 봤어 아마 주인공이 죽었나 저쨌나 떠들어대는 사람들 아마 둘은 다신 볼 수 없었지 그건 영화이니까 오 내 주변에 여자가 많단 그런 헛소릴 듣고 웃을 때가 아니야 아니 왜 내 얘길 내가 맘대로 못해 변명도 못해 남탓도 못해 암말도 못해 웃어 이자식이 난 그게 재미없어 너와 이별에 난 버린 것이 많고 찾을 것이 많고 가는 마음마다 머물지를 잘 못해 사랑했던 시간 널 좋아했던 그 많은 아픈 날을 걸었네 너와 이별은 또 많은 날을 울게 만들었어 이젠 모두 지난 얘기지만 시간이 지난 난 처음 널 만났던 그 겨울 속을 걸어가 걷다보면 시간이 말하겠지 그 겨울 속을 걸어가 걷다보면 마음이 말해주겠지 너와 이별은 참 버린 것이 많던 찾을 것이 많던 가는 마음 따라 흘러갔던 시간이 내게 줬던 아픈 힘들었었던 모든 걸 참으라고 말했네 너와 이별은 더 꺼내지도 않는 말이 돼버린걸 이젠 모두 지난 얘긴거야 시간이 지난 난 시간이 지난 난 그 겨울 속을 걸어가
Madeleine Love,CHEEZE (치즈),오늘같이 싱그러운 날 길거리 차도 별로 다니지 않아 문득 지나가다 거울을 보면 오늘 내 모습은 좀 예뻐 보이네 이따가 널 보면 무슨 말을 할까 날씨가 좋다고 뻔한 말이라도 건네볼까 어색한 장난이라도 용감하게 오늘은 널 웃음 짓게 만들 거야 I’m in madeleine love I’m in madeleine love I’m in madeleine love 오늘같이 햇볕 좋은 날엔 매일 걷던 거리도 지겹지 않아 문득 지나가다 거울을 보면 내 얼굴도 이 정도면 잘생겼네 이따가 널 보면 무슨 말을 할까 날씨가 좋다고 공원이라도 좀 걷자 할까 짓궂은 장난이라도 용감하게 오늘은 널 웃음 짓게 만들 거야 I’m in madeleine love I’m in madeleine love I’m in madeleine love I’m in madeleine love I’m in madeleine love I’m in madeleine love
위잉위잉,혁오 (HYUKOH),비틀비틀 걸어가는 나의 다리 오늘도 의미없는 또 하루가 흘러가죠 사랑도 끼리끼리 하는거라 믿는 나는 좀처럼 두근두근 거릴일이 전혀없죠 위잉위잉 하루살이도 처량한 나를 비웃듯이 멀리 날아가죠 비잉비잉 돌아가는 세상도 나를 비웃듯이 계속 꿈틀대죠 Tell me Tell me Please don’t tell 차라리 듣지 못한 편이 내겐 좋을거야 Tell me Tell me Please don’t tell 차라리 보지 못한 편이 내겐 좋을거야 ai ai ai ai ai ai ai ai ai ai ai ai ai ai ai ai ai ai ai ai ai ai ai ai ai ai ai 사람들 북적대는 출근길의 지하철엔 좀처럼 카드찍고 타볼일이 전혀없죠 집에서 뒹굴뒹굴 할 일없어 빈둥대는 내 모습 너무 초라해서 정말 죄송하죠 위잉위잉 하루살이도 처량한 나를 비웃듯이 멀리 날아가죠 비잉비잉 돌아가는 세상도 나를 비웃듯이 계속 꿈틀대죠 쌔앵 쌔앵 칼바람도 상처난 내 마음을 어쩌지는 못할거야 뚜욱 뚜욱 떨어지는 눈물이 언젠가는 이세상을 덮을거야 Tell me Tell me Please don’t tell 차라리 듣지 못한 편이 내겐 좋을거야 Tell me Tell me Please don’t tell 차라리 보지 못한 편이 내겐 좋을거야 Tell me Tell me Please don’t tell 차라리 느껴보지 못한 편이 좋을거야 Tell me Tell me Please don’t tell 차라리 살아보지 못한 편이 좋을거야 비틀비틀 걸어가는 나의 다리 오늘도 의미없는 또 하루가 흘러가죠 사랑도 끼리끼리 하는거라 믿는 나는 좀처럼 두근두근 거릴일이 전혀없죠 위잉위잉 하루살이도 처량한 나를 비웃듯이 멀리 날아가죠 비잉비잉 돌아가는 세상도 나를 비웃듯이 계속 꿈틀대죠
널 생각해,원 모어 찬스 (one more chance),Tonight 널 바래다 주는 길 내내 내가 변했다고 말하지 널 생각하지 않는다고 너는 투덜대지 언제나 넌 사랑이 설레임이니 내겐 사랑은 익숙함야 너를 떠올리는 그 시간을 따로 두진 않아 늘 널 생각해 그래 널 생각해 바쁜 하루의 순간 순간 그 순간도 니가 보여 모두 보여줄 순 없지만 조금은 너도 느끼잖아 늘 널 생각해 매일 널 생각해 잠이 들어 꿈꾸는 순간도 내 앞에 웃는 그런 너를 생각해 기억나 내가 처음 고백했던 그 날 멋진 이벤트도 없었지만 나 받아준 널 내 가슴에 늘 지금처럼 늘 널 생각해 그래 널 생각해 바쁜 하루의 순간 순간 그 순간도 니가 보여 모두 보여줄 순 없지만 조금은 너도 느끼잖아 늘 널 생각해 매일 널 생각해 잠이 들어 꿈꾸는 순간도 내 앞에 웃는 그런 너를 생각해 늘 널 생각해 그래 널 생각해 우리 함께 한 순간 순간 그 순간이 소중해서 말로 다 할 수는 없지만 조금씩 네게 보여줄게 늘 난 생각해 매일 난 생각해 이른 아침 잠에서 깨어나 이 세상에서 가장 행복한 너를 내 앞에 웃는 그런 널 보며 I Love You
고백,정준일,우리 이제 그만하자 다신 마주치지 않도록 그렇게 지내자 별다를 거 없어 사는 게 그렇잖아 언제나처럼 우린 늘 혼자였잖아 생각보단 쉬울 것 같아 너없이 하루를 사는 게 내겐 지금보다 마음 졸이며 널 기다린 하루보다 어쩌면 혼자인 게 더 편할 테니까 그런데 왜 지금 나 널 그리워하는 거니 네가 없는 하루하루가 왜 이리 힘드니 네가 보고 싶다고 너무 보고 싶다고 전하지도 못할 말들을 하곤 했어 이제야 내 맘 다 알 것 같은데 오랜만에 누굴 만나서 시덥잖은 얘길 하고 소리 내어 웃곤 해 괜찮다고 아무렇지 않은 날 보며 너의 마음이 조금만 더 아팠으면 해 그런데 왜 지금 나 널 그리워하는 거니 네가 없는 하루하루가 왜 이리 힘드니 네가 보고 싶다고 너무 보고 싶다고 전하지도 못할 말들을 하곤 했어 이제야 내 맘 다 알 것 같은데 괜찮다고 말하던 친구들의 위로에 아무렇지 않은 것처럼 겨우 웃어보지만 아무리 달려봐도 결국엔 그 자리에 난 너를 그리워하는가봐 미안해 나 지금 너에게 달려가고 있어 차마 네게 할 수 없던 말 이젠 고백할게 너를 사랑한다고 너무 사랑한다고 바보 같은 내 맘 받아 줄 수 있겠니 이제야 내가 날 알 것 같은데 이렇게 난 널 그리워하는데
사랑은 은하수 다방에서,10CM,사랑은 은하수 다방 문 앞에서 만나 홍차와 냉커피를 마시며 매일 똑같은 노래를 듣다가 온다네 그대는 물에 젖지 않은 성냥개비 같죠 아무리 싫은 표정 지어도 불타는 그 마음을 감출 수가 없다네 그대 나에게 무슨 말이라도 해주오 나는 찻잔에 무지개를 띄워주리 하루도 이틀도 사흘도 배겨낼 수가 없네 못 살고 못 죽고 그대 없는 홍대 상수동 신촌 이대 이태원 걸어 다닐 수도 없지 그대 나에게 무슨 말이라도 해주오 나는 찻잔에 무지개를 띄워주리 하루도 이틀도 사흘도 배겨낼 수가 없네 못 살고 못 죽고 그대 없는 홍대 상수동 신촌 이대 이태원 걸어 다닐 수도 없지 사랑은 은하수 다방 문 앞에서 만나 홍차와 냉커피를 마시며 매일 똑같은 노래를 듣다가 온다네 사랑은 은하수 다방 문 앞에서 만나 홍차와 냉커피를 마시며 매일 똑같은 노래를 듣다가 온다네 그대 그댈 그댄 그대 그댈 그댄 그대 그대 그댄 대박 대박
Little Star,스탠딩 에그,눈을 감고 내가 하는 이야기를 잘 들어봐 나의 얘기가 끝나기 전에 너는 꿈을 꿀거야 Little star tonight 밤새 내가 지켜줄거야 처음 너를 만났을 때 정말 눈이 부셨어 너의 미소를 처음 봤을 땐 세상을 다 가졌어 Little star tonight 밤새 내가 지켜줄거야 내 품에 안긴 채 곤히 잠든 널 보며 나는 잠시도 눈을 뗄 수 없어 이렇게 예쁜데 숨이 멎을 것 같아 내가 어떻게 잠들 수 있겠니 나의 사랑 나의 전부 하늘이 내린 천사 나의 두 눈을 나의 세상을 모두 훔쳐버렸어 Little star tonight 밤새 내가 지켜줄거야 내 품에 안긴 채 곤히 잠든 널 보며 나는 잠시도 눈을 뗄 수 없어 이렇게 예쁜데 숨이 멎을 것 같아 내가 어떻게 잠들 수 있겠니 눈을 감고 내가 하는 이야기를 잘 들어봐 나의 얘기가 끝나기 전에 너는 꿈을 꿀거야 Little star tonight 밤새 내가 지켜줄거야 내 사랑 tonight 밤새 내가 지켜줄거야 평생 내가 지켜줄거야
그대와 나 설레임 (Feat. 소울맨),어쿠스틱 콜라보,나 그대가 너무 좋은데 말하고 싶은데 용기가 안나 나도 그대가 너무 좋은데 말하고 싶은데 용기가 안나 사랑해 말하고 싶은데 이렇게 속만 태우다가 그대가 떠나가 버릴까 늘 바보같이 걱정만 하는 우리 오늘은 떨리는 맘으로 그대 바라보며 고백할게요 나도 오늘은 용기낼래요 그대 바라보며 고백할게요 사랑해 말하고 싶은데 이렇게 속만 태우다가 그대가 떠나가 버릴까 늘 바보같이 걱정만 하는 우리 그대 눈길보면 당황해서 눈을 돌리고 그대 앞에서면 바보같이 얼굴 붉히고 그대를 사랑한다 수없이 연습하고 연습했는데 말도 못하고 사랑해 말하고 싶은데 이렇게 속만 태우다가 그대가 떠나가 버릴까 늘 바보같이 걱정만 하는 우리
가끔 미치도록 네가 안고 싶어질 때가 있어,가을방학,만약이라는 두 글자가 오늘 내 맘을 무너뜨렸어 어쩜 우린 웃으며 다시 만날 수 있어 그렇지 않니 음악을 듣고 책을 읽고 영화를 보고 사람들을 만나고 우습지만 예전엔 미처 하지 못했던 생각도 많이 하게 돼 넌 날 아프게 하는 사람이 아냐 수 없이 많은 나날들 속을 반짝이고 있어 항상 고마웠어 아무도 이해할 수 없는 얘기겠지만 그렇지만 가끔 미치도록 네가 안고 싶어질 때가 있어 너 같은 사람은 너 밖에 없었어 마음 둘 곳이라곤 없는 이 세상 속에  넌 날 아프게 하는 사람이 아냐 수 없이 많은 나날들 속을 반짝이고 있어 항상 고마웠어 아무도 이해할 수 없는 얘기겠지만 그렇지만 가끔 미치도록 네가 안고 싶어질 때가 있어 너 같은 사람은 너 밖에 없었어 마음 둘 곳이라곤 없는 이 세상 속에
고백,델리스파이스,중2때까지 늘 첫째 줄에 겨우 160 이 됐을 무렵 쓸만한 녀석들은 모두 다 이미 첫사랑 진행 중 정말 듣고 싶었던 말이야 물론 2년전 일이지만 기뻐야하는 게 당연한데 내 기분은 그게 아냐 하지만 미안해 이 넓은 가슴에 묻혀 다른 누구를 생각했었어 미안해 너의 손을 잡고 걸을 때에도 떠올렸었어 그 사람을 널 좋아하면 좋아할수록 상처 입은 날들이 더 많아 모두가 즐거운 한 때에도 나는 늘 그곳에 없어 정말 미안한 일을 한걸까 나쁘진 않았었지만 친구인 채 였다면 오히려 즐거웠을 것만 같아 하지만 미안해 네 넓은 가슴에 묻혀 다른 누구를 생각했었어 미안해 너의 손을 잡고 걸을 때에도 떠올랐었어 그 사람이 정말 듣고 싶었던 말이야 물론 2년전 일이지만 기뻐야하는 게 당연한데 내 기분은 그게 아냐 하지만 미안해 네 넓은 가슴에 묻혀 다른 누구를 생각했었어 미안해 너의 손을 잡고 걸을 때에도 떠올렸었어 그 사람을 하지만 미안해 네 넓은 가슴에 묻혀 다른 누구를 생각했었어 미안해 너의 손을 잡고 걸을 때에도 떠올랐었어 그 사람이
와리가리,혁오 (HYUKOH),그런 슬픈 말을 하지 마요 아마 그럴 줄은 알았는데 이젠 좀 잔잔하다 했었는데 뒤도 돌아보지 않아 그런 마음을 낮추지 마요 저기 다가온다 기대했는데 또 한 편 언젠가는 떠나갈걸 이젠 슬쩍 봐도 알아 And we play comes and goes cause we did this when we were child before and we play comes and goes cause big boys still play the game all the time 다 쓴 야광별을 떼어냈죠 옅은 빛을 살피고 있으면 내일이 그리 기다려졌는데 이젠 그렇지도 않아 어렸을 때 몰래 훔쳐봤던 아빠의 수첩 같은 일기장엔 오늘의 걱정이 적혀있던 게 이제야 생각나네 And we play comes and goes cause we did this when we were child before and we play comes and goes cause big boys still play the game all the time 익숙하니 또 무뎌지네요 흘러간 장면이 펼쳐지네요 다시 그 순간을 마주한대도 그땐 또 지금 같진 않겠지 And we play comes and goes cause we did this when we were child before and we play comes and goes cause big boys still play the game all the time Familiarity is a common sense I feel like I’m not here anymore 그냥 다들 안고선 살고 있더라고 다들 그렇게들 떠나나요 이미 저 너머 멀리에 가있네 여기에는 아무도 안 올 테니 그냥 집으로 돌아갈래
고백,뜨거운 감자,달이 차고 내 마음도 차고 이대로 담아 두기엔 너무 안타까워 너를 향해 가는데 달은 내게 오라 손짓하고 귓속에 얘길 하네 지금 이 순간이 바로 그 순간이야 제일 마음에 드는 옷을 입고 노란 꽃 한 송이를 손에 들고 널 바라 보다 그만 나도 모르게 웃어버렸네 이게 아닌데 내 마음은 이게 아닌데 널 위해 준비한 오백 가지 멋진 말이 남았는데 사랑한다는 그 흔한 말이 아니야 그 보단 더욱더 로맨틱하고 달콤한 말을 준비했단 말야 숨이 차고 밤 공기도 차고 두 눈을 감아야만 네 모습이 보여 걸을 수가 없는데 구름 위를 걷는다는 말이 과장이 아니란 걸 알게 됐어 널 알게 된 후부터 나의 모든 건 다 달라졌어 이게 아닌데 내 마음은 이게 아닌데 널 위해 준비한 오백 가지 멋진 말이 남았는데 사랑한다는 그 흔한 말이 아니야 그 보단 더욱더 로맨틱하고 달콤한 말을 준비했단 말야 나를 봐줘요 내 말을 들어봐 줘요 아무리 생각을 하고 또 해도 믿어지지 않을 만큼 사랑해
작두 (Feat. 넉살 Huckleberry P),딥플로우,난 작두 타지 네 박자 위에서 내 무대는 굿판이고 또 그 분이 오셔 정중히 모셔 판을 벌이자고 홍대 바닥에 박수들아 모여 Loyal rumble 의 종을 울려 땡땡 이 곳의 Back packers and ladies 옷 헐렁한 걸뱅이들이 뒤섞여 랩 Gang bang 냄새 풀풀 나 킁킁 That's true true 여기는 공개 진품명품 쇼 I prove prove 난 꿀꿀 대며 신명나게 춤을 출 뿐 다 나가 떨어지는 낙엽 내 Flow 추풍 Blow 후후 오늘 내게 내린 걸신 다 쩝쩝쩝 먹어 치워 이 비트는 내 입가심 나를 보러 빨리 와 접신한 계집들은 교성 지르며 난리 나 이번 굿판도 작두 위는 내 것 이 동네 잔칫상의 메뉴판 다 불가항력으로 메꿔 땀 냄새 나 다 푹 젖어서 푹푹 찌네 어디 창문 좀 열어 줘 지루한 래퍼들은 다 물러서 이제 그 분이 오셔 그 분이 오셔 작두 타타타타 그 분이 오셔 자꾸 하하하 하품 나는 짝퉁 가가가 가짜들은 싹둑 Cut cut cut 싹둑 작두 타타타타 그 분이 오셔 자꾸 하하하 하품 나는 짝퉁 가가가 가짜들은 싹둑 Cut cut cut 싹둑 저 애들을 봐 온 동네 구경이라도 난 듯 내 춤을 구경하네 날이 선 무대 위에 내 정신은 아득 다들 무엇을 원하는지 손을 뻗은 채로 홀린 눈빛 날 보는 너와 내가 본 너는 이미 둘이 아닌 하나일 지도 우린 다들 돈에 씌인 채로 살아 필요한 건 그걸 걷어내는 살풀이 일지도 넉살아 넌 무엇에 눈이 돌아갔냐 난 그저 흥이 좀 과한 놈이 아닐까 몇 년 전에는 또 뻔하게 펜을 굴렸었는데 그건 날 내린 그 분의 뜻이 아닌 것 같아 개새끼들 잡아먹는 야차로 태어났어 난 모습 그대로 몽둥이를 들고 소매를 바짝 올려 붙여 그래 계속 북 쳐 찾지 마라 부처 싹 다 밀어 불도저 상구 형 등짝엔 도깨비들이 춤춰 귀신이 씐 얼굴 작두 위에 악마들이 춤춰 땀 냄새 나 다 푹 젖어서 푹푹 찌네 어디 창문 좀 열어 줘 지루한 래퍼들은 다 물러서 이제 그 분이 오셔 그 분이 오셔 작두 타타타타 그 분이 오셔 자꾸 하하하 하품 나는 짝퉁 가가가 가짜들은 싹둑 Cut cut cut 싹둑 작두 타타타타 그 분이 오셔 자꾸 하하하 하품 나는 짝퉁 가가가 가짜들은 싹둑 Cut cut cut 싹둑 래퍼들 굿판 싹 다 망치는 게 내 악취미 여기엔 날 그대로 빼다 박은 700 Bounce with me 네 눈엔 이게 아직도 공연으로 보이냐 이 신내림을 막기엔 이제 V Hall 도 좁다 내가 뿌리는 물을 성수처럼 받아먹는 걔네들 때문에 난 거의 완전 신이라도 된 기분 나랑 비슷한 무당들이 다섯이나 대기 중 H I L I T E 좆나 쩌는 무대의 기준 난 자의 반 또는 타의 반으로 Hilite 의 Highlight 공연 다음 날 Twit timeline 좀 봤냐 죄다 Hilite 우린 다음 Time 을 망가뜨려 안타까운 상황 네가 암만 잘해봤자 넌 그냥 박사 우린 아인슈타인 Now Take it to the next level 이건 전혀 다른 차원의 해적질 난 Jack Sparrow 전 세계를 상대로 우리가 벌이는 춤사위 관심 없어 연예인 병 걸린 놈들의 Dance Battle 땀 냄새 나 다 푹 젖어서 푹푹 찌네 어디 창문 좀 열어 줘 지루한 래퍼들은 다 물러서 이제 그 분이 오셔 그 분이 오셔 작두 타타타타 그 분이 오셔 자꾸 하하하 하품 나는 짝퉁 가가가 가짜들은 싹둑 Cut cut cut 싹둑 작두 타타타타 그 분이 오셔 자꾸 하하하 하품 나는 짝퉁 가가가 가짜들은 싹둑 Cut cut cut 싹둑
수고했어 오늘도,옥상달빛,세상 사람들 모두 정답을 알긴 할까 힘든 일은 왜 한번에 일어날까 나에게 실망한 하루 눈물이 보이기 싫어 의미 없이 밤 하늘만 바라봐 작게 열어둔 문틈 사이로 슬픔 보다 더 큰 외로움이 다가와 더 날 수고했어 오늘도 아무도 너의 슬픔에 관심 없대도 난 늘 응원해 수고했어 오늘도  빛이 있다고 분명 있다고 믿었던 길마저 흐릿해져 점점 더 날 수고했어 오늘도 아무도 너의 슬픔에 관심 없대도 난 늘 응원해 수고했어 수고했어 수고했어 오늘도  수고했어 오늘도 아무도 너의 슬픔에 관심 없대도 난 늘 응원해 수고했어 오늘도
