Title,Singer,Lyric
사랑의 시작은 이사에서부터 (Duet With 은종),윤딴딴,옆 동네에 살던 니가 이사 온 그 날에 우린 처음 알게 됐지 이 동네는 처음이라 아는 게 없다고 니가 내게 말을 건 거야 하루 하루 우린 더욱 가까워졌고 니가 내 맘에 들어왔지 용기 내어 건넨 말에 활짝 넌 웃으며 와락 나를 안았던 거야 그대를 안고 안아도 또 보고 싶고 늘 곁에 있단 느낌을 받고 싶어 니가 날 몰라도 더 알게 될 걸 늘 곁에 두고 영원을 약속할 테야 옆 동네에 살던 내가 이사온 그 날에 너를 처음 보게 됐지 이 동넨 몇 번 와 봤었어 친구가 살아서 그냥 네게 말을 건 거야 하루 하루 우린 더욱 가까워졌고 니가 내 맘에 들어왔지 용기 내어 건넨 그 말 용기 내어 건넨 그 말 그게 우리의 시작이었어 그대를 안고 안아도 또 보고 싶고 늘 곁에 있단 느낌을 받고 싶어 니가 날 몰라도 더 알게 될 걸 늘 곁에 두고 영원을 약속할 테야 가끔 이렇게 떨어져 있을 땐 니가 내게 먼저 말해줘 많이 보고 싶다 그치 가끔 이렇게 떨어져 있을 땐 니가 나만 생각하고 딴짓 않기 이 이 그대를 안고 안아도 또 보고 싶고 늘 곁 늘 곁에 있단 느낌을 받고 싶어 니가 날 몰라도 더 알게 될 걸 늘 곁에 두고 영원을 약속할 테야 안아도 또 보고 싶고 늘 곁에 있단 느낌을 받고 싶어 니가 날 몰라도 더 알게 될 걸 늘 곁에 두고 영원을 약속할게
하드코어 인생아,옥상달빛,뭐가 의미 있나 뭐가 중요하나 정해진 길로 가는데 축 쳐진 내 어깨 위에 나의 눈물샘 위에 그냥 살아야지 저냥 살아야지 죽지 못해 사는 오늘 뒷걸음질만 치다가 벌써 벼랑 끝으로 어차피 인생은 굴러먹다 가는 뜬구름 같은 질퍽대는 땅바닥 지렁이 같은 걸 그래도 인생은 반짝반짝 하는 저기 저 별님 같은 두근대는 내 심장 초인종 같은걸 인생아  어차피 인생은 굴러먹다 가는 뜬구름 같은 질퍽대는 땅바닥 지렁이 같은 걸 그래도 인생은 반짝반짝 하는 저기 저 별님 같은 두근대는 내 심장 초인종 같은걸 인생아
아지랑이,쏜애플 (THORNAPPLE),녹아 흐르는 아스팔트 위에 귀를 기울여 들었던 소리 오늘도 지구는 나를 제쳐 두고 아무렇지 않게 돌아가 따가운 날을 피해서 다니다 만나 버렸던 많은 사람들 어딘가 멀리에 멀고 먼 나라에 모두 잠을 자러 돌아가 나는 얼마나 더 달아날 수 있을까 너덜너덜 헤진 몸뚱일 가누네 나는 얼마나 더 너의 까만 눈을 견뎌내야 제대로 설 수 있을까 나는 지금 여기에 살아있어 차는 숨을 내쉬며 살아있어 다신 그대와 느릿느릿하게 늘어져 가는 시간을 세어 볼 수 없어도 당신의 체온을 느끼려 해도 여전히 이곳은 나쁜 날씨 좋은 시절들은 항상 끝이 날까 마음만 잔뜩 커다래져 나는 얼마나 더 살아갈 수 있을까 헤아릴 수 없는 내일이 불안해 나는 얼마나 더 돌아가는 땅을 견뎌내야 제대로 설 수 있을까 나는 지금 여기에 살아있어 차는 숨을 내쉬며 살아있어 어지러워요 날 찾아내 줘요 꺼지지 않는 나의 두려움 새빨갛게 흐드러진 해 질 무렵 공기 하루만큼 늙어 버린 사람들의 냄새 무엇보다 숨을 참기 힘든 이 세계를 분명 나는 좋아한다 생각해 나는 지금 여기에 살아있어 차는 숨을 내쉬며 살아있어 그대도 어딘가에서 살아가 꺼지지 않는 나의 그리움
곳에 따라 비,가을방학,일기예보엔 우산 그림이 제법 많다 전국이 흐리고 곳에 따라 비라 한다 당신이 서 있는 그 스튜디오 안은 아마 아니겠지만 창틀로 배어 오는 비 냄새 난 빈손으로 집을 나선다 우산 속으로 숨고 싶진 않아 어차피 이 비는 나 가는 곳 따라 어디든지 따라 와 이 비는 내 발길을 따라 어디든지 따라 와  전학 가던 날 아침엔 항상 이렇게 비가 오곤 했었지 같이 쓰자던 너의 작은 우산 괜찮아 이 비는 나 가는 곳 따라 어디든지 따라 와 이 비는 내 발길을 따라 어디든지 따라 와 사람들과 반대로 걷고 있네 얼마나 걸었는지 몰라 어느 샌가 나만 홀로 남아서 막다른 길을 향해 가 피할 길이 없어 피할 길이 없어 젖어도 되는 옷을 입고 젖어버린 신발은 벗고 젖은 마음을 쥐어 짠다 눈을 때리는 빗방울들 끝내 눈물은 나지 않고 식어버린 가슴은  식어버린 가슴은  이 비는 나 가는 곳 따라 어디든지 따라 와
항상 엔진을 켜둘께,델리스파이스,휴일을 앞둔 밤에 아무도 없는 새벽 도로를 질주해서 바닷가에 아직은 어두운 하늘 천평궁은 빛났고 차 안으로 스며드는 찬공기들  기다릴께 언제라도 출발할 수 있도록 항상 엔진을 켜둘께 너와 만난 시간보다 많은 시간이 흐르고 그 바닷가에 다시 또 찾아와  만약 그때가 온다면 항상 듣던 스미스를 들으며 저 멀리로 떠나자  기다릴께 언제라도 출발할수 있도록 항상 엔진을 켜둘께 -  기다릴께 언제라도 출발할수 있도록 항상 엔진을 켜둘께 돌아오지 않더라도 난 여기에 서 있겠지 아마 엔진을 켜둔 채  기다릴께 언제라도 출발할수 있도록 항상 엔진을 켜둘께 돌아오지 않더라도 난 여기에 서 있겠지 아마 엔진을 켜둔 채 -
안아줄게,스탠딩 에그,그런 날이 있지 눈물이 막 날 것 같은 그런 날 걷는 것마저 힘겹다고 느껴질 때 네 곁에 그 누구도 몰라줄 때 It's alright It's alright 내가 널 안아줄게 내 품에 안겨 마음껏 울어 안아줄게 It's alright It's alright 내가 다 들어줄게 아무에게도 말 못한 네 맘 내가 들어줄게 그런 날이 있지 모든 걸 다 놓고 싶은 그런 날 걸어가던 길이 버겁다고 느껴질 때 네 곁에 그 누구도 몰라줄 때 It's alright It's alright 내가 널 안아줄게 내 품에 안겨 마음껏 울어 안아줄게 It's alright It's alright 내가 다 들어줄게 아무에게도 말 못한 네 맘 내가 들어줄게 It's alright It's alright 내가 널 안아줄게 내 품에 안겨 마음껏 울어 안아줄게 It's alright It's alright 내가 다 들어줄게 아무에게도 말 못한 네 맘 내가 들어줄게
비밀연애,10CM,잠깐만요 살다보면 작은 비밀 하나쯤은 있어요 남들 몰래 이루는 사랑 생각만 해도 찌릿찌릿해요 지나갈 때 나에게만 그대 짙은 향기를 흘려줘요 내 귓가에 우리만이 알고 있는 휘파람을 불어요 집에 가는 척 몰래 전화해 안되긴 뭐가 안돼 다 돼요 우리는 오늘부터 아찔한 사이 좀 비밀스런 은밀한 관계 친구들이 못 보게 두 눈을 찡긋 그저 들키지만 말구요 이제 우리는 아찔한 사이 누구보다도 불타는 관계 친구들이 안 볼 때 허리를 슬쩍 근데 걸리지만 말구요 좀 있다 봐요 사람들과 어울릴 땐 적당한 거리를 유지해줘요 낯 뜨거운 애정표현은 약속해둔 비밀장소에서만 잠깐만요 내가 먼저 도착하면 있다 들어와줘요 아무 일도 없던 것처럼 태연하게 나를 지나쳐줘요 화장실 가는 척 잠깐 나와봐 비상계단 암호는 우리는 오늘부터 아찔한 사이 좀 비밀스런 은밀한 관계 친구들이 못 보게 두 눈을 찡긋 그저 들키지만 말구요 이제 우리는 아찔한 사이 누구보다도 불타는 관계 친구들이 안 볼 때 허리를 슬쩍 근데 걸리면 또 어때요 좀 있다 봐요 좀 있다 봐요 좀 있다 봐요 어디서 봐요
캠퍼스 커플 (With 옥상달빛),페퍼톤스 (Peppertones),환하게 빛나거라 캠퍼스 커플 눈이 부신 아침 햇살처럼 한 폭의 그림 같은 캠퍼스 커플 싱그러운 꽃 바람 불어라 따뜻한 봄볕 아래 캠퍼스 커플 두근두근 두 뺨을 밝혀라 영원히 노래하라 캠퍼스 커플 마음껏 소리 높여 웃어라 오 오 오 오 오 오 오 설레는 손을 잡고 바람 불면 팔짱을 꼭 끼고 오 오 오 오 오 오 오 경쾌한 둘만의 스텝을 밟고 저 멀리 사라져라 캠퍼스 커플 무너져라 한낮의 신기루처럼 근처에 오지 마라 캠퍼스 커플 비나 와라 먹구름 소나기 뛰다가 쓰러져라 캠퍼스 커플 쓰러져라 조금 더 아프게 장렬히 공중분해 캠퍼스 커플 마음껏 소리 높여 싸워라 오 오 오 오 오 오 오 눈물은 강이 되고 불타는 맘은 잿더미 되고 오 오 오 오 오 오 오 쓰라린 속에 잠 못 이루고 시리도록 달콤한 휘청일 듯 아찔한 다시 로맨스의 계절 찬란한 이 거리 가득 봄바람 사랑이여 피어나라 오 오 오 오 오 오 오 그대 붉은 볼 위에 나의 수줍은 숨결이 닿을 때 오 오 오 오 오 오 오 그대로 눈을 감아요 우린 날아오를 테니 오 오 오 오 오 오 오 설레는 손을 잡고 바람 불면 팔짱을 꼭 끼고 오 오 오 오 오 오 오 멈추지 않을 그 스텝을 밟아라
아름다운 것,언니네 이발관,그대의 익숙함이 항상 미쳐버릴 듯이 난 힘들어 당신은 내 귓가에 소근대길 멈추지 않지만 하고싶은 말이 없어질 때까지 난 기다려 그 어떤 말도 이젠 우릴 스쳐가 앞서간 나의 모습 뒤로 너는 미련 품고 서 있어 언젠가 내가 먼저 너의 맘 속에 들어가 하고싶은 말이 없어지지 않을거라 했지 그랬던 내가 이젠 너를 잊어가 사랑했다는 말 난 싫은데 아름다운 것을 버려야 하네 넌 말이 없었지 마치 아무일도 아닌 것처럼 슬픔이 나를 데려가 데려가 나는 너를 보고 서 있어 그 어떤 말도 내 귓가에 이젠 머물지 않지만 하고싶은 말이 없어질 때까지 만이라도 서로가 전부였던 그 때로 돌아가 넌 믿지 않겠지만  사랑했다는 말 난 싫은데 아름다운 것을 버려야하네 난 나를 지켰지 마치 아무일도 아닌 것처럼 그동안의 근심 어디엔가 버려둔 채 사랑했었나요 살아있나요 잊어버릴까 얼마만에 넌 말이 없는 나에게서 또 무엇을 더 바라는가 슬픔이 나를 데려가 데려가
Insomnia,HUS (허밍어반스테레오),Taking a nap all day long There's nobody disturbs me but I can't feel free There's no hope There's no despair only the anger remined into my heart There's no chance and there's no clue You're gone so fareway I'm hiding myself from you I hate myself who can't stop loving you I feel so stupid because I'm still in love you Fall over precipiate but there's no one can rescue me My heart has broken two pieces I can't love you anymore Fall over precipiate but there's no one can rescue me My heart has broken two pieces I can't love you anymore  It's hard for me go on my life without you suffering from insomnia I'm dying day and day day and day day and day  Taking a nap all day long There's nobody disturbs me but I can't feel free There's no hope There's no despair only the anger remined into my heart There's no chance and there's no clue You're gone so fareway I'm hiding myself from you I hate myself who can't stop loving you I feel so stupid because I'm still in love you Fall over precipiate but there's no one can rescue me My heart has broken two pieces I can't love you anymore Fall over precipiate but there's no one can rescue me My heart has broken two pieces I can't love you anymore  It's hard for me go on my life without you suffering from insomnia I'm dying day and day day and day day and day
소녀감성100퍼센트,우효,네 살 때 시작한 농구훈련 그땐 발레가 더 좋았지만 오빠는 말했지 날 키우겠다고 날 선수로 키워보겠다고 오빠의 야망은 이뤄지지 않았지만 난 아주 멋진 여고생이 됐지 치마만 아니면 앞머리만 아니면 일대일 누구든 자신있어 난 말야 난 말야 이럴 때가 좋아 옆반 훈남이 농구 할때 오 어쩌다 눈 마주치면 난 두근두근하고 그런 멍청한 짓은 안 해 난 순정만화 캐릭터가 아니니까 어쩌면 난 니가 멋있어서 보는지 몰라 어쩌면 난 니가 비웃고 있는지도 몰라 어쩌면 난 그냥 재밌는 건지도 몰라 난 난 난 난 말야 난 말야 이럴 때가 좋아 옆반 훈남이 농구 할때 오 어쩌다 눈 마주치면 난 두근두근하고 그런 멍청한 짓은 안 해 난 순정만화 캐릭터가 아니니까 어쩌면 난 니가 멋있어서 보는지 몰라 어쩌면 난 니가 비웃고 있는지도 몰라 어쩌면 난 그냥 재밌는 건지도 몰라 난 난 난 난 말야 난 말야 이럴 때가 좋아 재밌는 건지도 몰라
홍콩반점,리미와감자,여보세요 쎄쎄이 홍콩반점이죠 여기가 홍콩반점 여기 풍림1차 908혼데요 풍림1차 608호 풍림1차 908호요 몇동이예요 몇동 몇동이야 동 하나예요 그니까 몇동이냐고요 동 하나예요 아 이 1동 908호 908호이 아저씨 단무지가 안와서요 단무지 젓가락도 안왔는데 젓가락 나무젓가락 그냥 집에 있는걸로 쳐먹어이 허 우리집에 젓가락 없는데 젓가락 없는 집구석이 어딨어이 좀 갖다주시면 안돼요 말이 되는소릴 해야지 그럼 짜장면 환불 안돼요 환불되는 짜장이 어딨어이 왜요 환불 안되는게 어딨어요 짜장면 환불은 라스베가스에서도 상상도 할수 없어이 짜장은 간짜장 돈좀 있음 삼선짜장 술먹은 다음날엔 고추짬뽕이죠 변덕스러운 짱개유져 땜에나온 짬짜면 볶짜면 탕짜면 볶짬면 탕짬면 탕볶밥 안먹어봤고 앞으로 안먹을밥 세트메뉴에는 만두가 오죠 비 내리면 따끈한 우동이 땡기고 안 땡기는건 마파두부덮밥 아저씨 단무지 두배로 줘요 양파는 조금 탕수육에 곱배긴자만 특정식은 부르주아만 골목길 골목길의 홍콩반점 홍콩반점 골목길 남먹던 단무지가 반쪽 홍콩반점 골목길 면의반죽 발로한 반죽 홍콩반점 골목길 홍콩반점 만점의 반점 골목길 골목길의 홍콩반점 홍콩반점 골목길 남먹던 단무지가 반쪽 홍콩반점 골목길 면의반죽 발로한 반죽 홍콩반점 골목길 홍콩반점 만점의 반점 홍콩반점 짜장은 만점 자리가 있음 바닥이라도 앉어 딱어 군만두는 서비스 요새 이렇게 주는데가 어딨음 어디든 배달가요 빛 보다 빠른 그 속도 짬뽕에 혀를 뎌 해산물 신선해 Hurry Up 빨리 안 먹으면 뺏어 먹히고 마는법 그릇에 쳐박힌 머리 하 바닥까지 핥아먹지 하 바삭 튀긴 탕수육 뭔가 있어 마파두부 뺏어먹고 쌩까고마는 인간관계속에 배고픔은 이천오백원이면 해결 행복 느낀대도 면발은 너무 쫄깃해 꼴뚜기들은 팝핑해 고기반찬은 어질어질하게 만들어 여기 저기서 시켜봐도 이맛 못내지 세트A 만천원이면 뽕 빼요 화재집중에도 on Air 살찌는걸 왜왜왜 겁내요 올리브유만 따라 쓰는데요 골목길 골목길의 홍콩반점 홍콩반점 골목길 남먹던 단무지가 반쪽 홍콩반점 골목길 면의반죽 발로한 반죽 홍콩반점 골목길 홍콩반점 만점의 반점 골목길 골목길의 홍콩반점 홍콩반점 골목길 남먹던 단무지가 반쪽 홍콩반점 골목길 면의반죽 발로한 반죽 홍콩반점 골목길 홍콩반점 만점의 반점 여보세요 센쎄 왜끊어요 나 안끊었어 왜 환불이 안돼요 짜장은 환불이 안돼 환불 안되는게 어딨어요 짜장은 환불 저짜장이 환불이 안돼 너 지금 나한테 짜증내니 너 몇살이야 너 혹시 소비자 보호센터라고 알어 어 아 소비자 보호센터요 고객님 우리 아빠 거기서 일하거든 아 예 저희 아버지 거기서 일하는데요 니네 아빠 뭐하는데 우리아빠 사장이거든 우리아빠는 회장이거든 맛도 없구만 뭐 맛이없어 맛이 없어요 이게 어 나는 그 들어가기 힘들다는 미국 우크라 대학에서 짜장학 석박사를 딴 사람이야 니가 짜장의 짜를 알어 이게 어떻게 만든 짜장인데 니가 병풍뒤에서 짜장냄새를 맡아봐야 아 내가 이 사람한테 정말 몹쓸 죄를 지었구나 하지 어 진짜 내가 너같은 애한테 짜장을 파나봐라 내가 너같은 애한테 짜장을 짜장을 짜장을 골목길 골목길의 홍콩반점 홍콩반점 골목길 남먹던 단무지가 반쪽 홍콩반점 골목길 면의반죽 발로한 반죽 홍콩반점 골목길 홍콩반점 만점의 반점 골목길 골목길의 홍콩반점 홍콩반점 골목길 남먹던 단무지가 반쪽 홍콩반점 골목길 면의반죽 발로한 반죽 홍콩반점 골목길 홍콩반점 만점의 반점
좋아해,프롬,언제부터였다고 말하긴 어렵지만 그 앨 생각하면 웃음이 나와 가끔 날 보며 씩 웃는 그 애를 마주보면 아찔한 기분에 어지러워져 그 애가 웃는게 좋아 햇살같아서 난 좋아 바다의 반짝임 보다 더 날 눈부시게 하는 그 애의 향기가 좋아 깨끗한 비누향기가 그 어떤 속삭임 보다 더 날 설레이게 하는 바로 그런 그 애가 지나다니는 골목길 카페에서 하루종일 그 앨 기다리면서 그 애와 손을 맞잡고 걷는 상상을 하면 또 아찔한 기분에 어지러워져 그 애가 웃는게 좋아 햇살같아서 난 좋아 바다의 반짝임 보다 더 날 눈부시게 하는 그 애의 향기가 좋아 깨끗한 비누향기가 그 어떤 속삭임 보다 더 날 설레이게 하는 오늘은 네게 달려가야지 오늘은 네게 고백해야지 넌 해피엔딩을 대답하면돼 예쁜 니 그 입술로 하늘한 치마를 입고 골목길 카페에 앉아 그 애가 오기만 기다리다가 곰곰히 생각해보니 좀 성급한게 아닐까 아무래도 좀더 미뤄야겠어 이 고백 니가 참 좋아 햇살같아서 난 좋아 바다의 반짝임 보다 더 날 눈부시게 하는 난 너의 향기가 좋아 깨끗한 비누향기가 그 어떤 속삭임 보다 더 날 설레이게 하는
blu (Feat. Babylon),아이언,긴 시간이 지났지 나도 많이 변했지 그전보다 더 넌 뭘 하고 사는지 내 생각은 나는지 더는 몰라도 아무렇지 않아 나는 babe 그래 원래 그런 놈 그래 원래 그런 놈 잠깐 동안 가졌었던 죄의식 it ends with the break of dawn i have nuthin' 우리 사진 니 번호와 문자까지 다 지웠지 니가 사준 옷과 신발 니가 만든 반지까지 남김없이 알아 난 더러운 놈 니가 곁에 있을 때도 나는 lonely 사랑하는 척을 해 니 두 눈을 마주보며 다릴 떨지 가책 없이 시간이 지나면 넌 점점 사라지겠지 나를 욕해도 돼 난 나쁜 놈인걸 담배연기처럼 보이지 않게 흩어지겠지 너도 날 버려줘 난 그런 놈인걸 이젠 쉿 너는 없지 너와 나눈 감정은 개나 줬지 내가 했던 변명은 모두 억지 니가 차린 밥상을 전부 엎지 쉿 너는 없지 너와 나눈 감정은 개나 줬지 내가 했던 변명은 모두 억지 니가 차린 밥상을 전부 엎지 그래 나는 너의 nightmare nightmare 쉽게 흔들리는 갈대 갈대 기생했지 난 니 삶에 삶에 니 뒷목에 꽂은 빨대 it's like that 예전과는 다르지 쉽게 얻게 된 유명세 이젠 모든 여자들이 술을 건네 그 속에서 매일 밤을 허우적대 그게 싫지만은 않아 달콤해 니 기억은 단지 가사로 이용할 뿐 나 잘되려 니 얘길 팔어 어쩌면 니 친구들이 뒤에서 나에 대해 했던 말 그래 그 말들이 백번 맞어 이제 그만 쉿 난 잘살지 넌 지금껏 거짓된 나와 만났지 너와 내 현실 ain't no drama scene no drama scene drama scene 시간이 지나면 넌 점점 사라지겠지 나를 욕해도 돼 난 나쁜 놈인걸 담배연기처럼 보이지 않게 흩어지겠지 너도 날 버려줘 난 그런 놈인걸 이젠 쉿 너는 없지 너와 나눈 감정은 개나 줬지 내가 했던 변명은 모두 억지 니가 차린 밥상을 전부 엎지 쉿 너는 없지 너와 나눈 감정은 개나 줬지 내가 했던 변명은 모두 억지 니가 차린 밥상을 전부 엎지 쉿 이젠 쉿
안녕,우효,하나부터 열까지 말해줘야 알겠지 이렇게나 아픈 걸 넘어져야 알겠지 어느새 Good bye 넌 멀어져 가 내 마음만 아파 Good bye 원하지 않아 이젠 원하지 않아 Say your prayers but never let me go Change your name but never let me go 어떤 날은 그랬지 구름 위를 걸었지 어떤 것을 준대도 바꿀 수가 없었지 but 오늘은 Good bye 이제는 그만 내 마음만 아파 Good bye 널 보낼 거야 오늘은 보낼 거야 Say your prayers but never let me go Change your name but never let me go Take your laughter but never let me go Take your life but never let me go Good bye 이제는 그만 내 마음만 아파 Good bye 널 보낼 거야 오늘은 보낼 거야 Say your prayers but never let me go Change your name but never let me go Take your laughter but never let me go Take your life but never let me go
금요일 (Feat. Philtre),우효,그리운 내일은 금요일 내가 사랑하는 날 너는 내가 기다리던 금요일이야 니가 있어서 월요일을 견딜 수 있고 니가 있어서 월요일이 두렵지 않아 지금이 좋아도 난 너를 바라고 내일이 아파도 난 너를 볼 거야 이미 내 마음은 온통 금요일 여전히 아직도 너는 내 금요일 니가 있어서 난 오늘도 웃을 수 있고 니가 있어서 난 오늘도 눈물이 나와 지금이 좋아도 난 너를 바라고 내일이 아파도 난 너를 볼 거야 이미 내 마음은 온통 금요일 여전히 아직도 너는 내 금요일
죽겠네 (Album Ver.),10CM,어떻게 해야 할지 몰라 웃질 않아도 아름다와 바라만 봐도 너무 좋아 죽겠네 코를 골아도 듣기 좋아 냄새가 나도 향기로와 씻지 않아도 너무 빛이 나서 죽겠네 이러다 정말 미쳐 돌아 버리면 어쩌나 이러다 진짜 숨이 덜컥 멎으면 어쩌나 그대의 눈가에 눈곱이 내게는 It's so nice so nice so nice 그대의 스타킹 뜯어진 구멍도 It's so nice so nice so nice 일분일초가 보석 같아 싸울 시간이 나질 않어 사랑만 해도 시간이 모질라서 죽겠네  이러다 정말 미쳐 돌아 버리면 어쩌나 이러다 진짜 숨이 덜컥 멎으면 어쩌나 그대의 잇몸에 김가루 내게는 It's so nice so nice so nice 그대의 가슴이 충분치 않아도 It's so nice so nice so nice 어떻게 해야 할지 몰라 웃질 않아도 아름다와 바라만 봐도 너무 좋아 죽겠네 죽겠네
웃는 것밖에 (With 예슬),스탠딩 에그,여기 있어 가장 가까운 곳에 거기서 바로 보이는 곳에 love is gone 할 수 있는건 없어 그냥 지금 이렇게 웃는 것 밖에 나 왜 있는 거야 두 사람 앞에 하필 우리가 자주 만나던 카페 맘에도 없는 말을 건넬 수밖에 둘이 잘 어울리네 먼저 일어나려다 다시 주저앉아 버렸어 내가 조금 늦었던 거야 어떡해 더 이상은 자신 없어 어제보다 더 멀리서 지켜보고 있어 내가 먼저 말했더라면 네 옆에 앉은 사람 나였을까 여기 있어 가장 가까운 곳에 거기서 바로 보이는 곳에 love is gone 할 수 있는 건 없어 그냥 지금 이렇게 웃는 것 밖에 나 왜 있는 거야 아직 네 앞에 가까이 앉고 싶어 바로 네 옆에 이젠 말하고 싶어 더 늦기 전에 나도 너를 좋아해 먼저 일어나려다 다시 주저앉아 버렸어 내가 조금 늦었던 거야 어떡해 더 이상은 자신 없어 어제보다 더 멀리서 지켜보고 있어 내가 먼저 말했더라면 네 옆에 앉은 사람 나였을까 여기 있어 가장 가까운 곳에 거기서 바로 보이는 곳에 love is gone 할 수 있는건 없어 그냥 지금 이렇게 웃는 것 밖에 여기 있어 가장 가까운 곳에 거기서 바로 보이는 곳에 love is gone 할 수 있는건 없어 그냥 지금 이렇게 웃는 것 밖에
미움 (Vocal 손주희),에피톤 프로젝트,참 미웠지 이렇게 변한 내가 미워서 한참 동안을 바라보다 이젠 어쩔 수가 없는 걸 알아 참 우습지 이런 게 끝이라니 우습지 하루 종일 널 생각하다 이젠 어쩔 수가 없다고 그래 이젠 나를 미워하지 않아도 되고 더는 걱정해야 할 일도 없고 매일 슬퍼해야 할 일 없으니 이젠 그댈 이해하지 않아도 되고 더는 후회해야 소용도 없고 서로 미워할 일도 없는 거지 참 미웠지 이렇게 변한 네가 미워서 한참 동안을 바라보다 이게 끝이라고 한다면 그래 이젠 나를 미워하지 않아도 되고 더는 걱정해야 할 일도 없고 매일 슬퍼해야 할 일 없으니 이젠 그댈 이해하지 않아도 되고 더는 후회해야 소용도 없고 서로 미워할 일도 없는 거지 참 미웠지 이렇게 변한 네가 미워서 한참 동안을 바라보다 이게 끝이라고 한다면 그래
