Title,Singer,Lyric
가슴 아프게,남진,당신과 나 사이에 저 바다가 없었다면 쓰라린 이별만은 없었을 것을 해 저문 부두에서 떠나가는 연락선을 가슴 아프게 가슴 아프게 바라보지 않았으리 갈매기도 내 마음 같이 목메어 운다 당신과 나 사이에 연락선이 없었다면 날 두고 떠나지는 않았을 것을 아득히 바다 멀리 떠나가는 연락선을 가슴 아프게 가슴 아프게 바라보지 않았으리 갈매기도 내 마음같이 목메어 운다
눈물의 부르스,주현미,오색등 네운볼이 속삭이듯 나를 유혹하는 밤 가슴을 휘젓듯이 흐느끼는 색소폰 소리 아 ~~ 나를 울리네 이순간이 지나고 나면 떠날 당신이기에 그대 품에 안기운채 젖은 눈을 감추네 아 ~~ 블루스 블루스 블루스 연주자여 그 음악을 멈추지 말아요  오색등 네운볼이 손짓하듯 나를 유혹하는 밤 내리는 빛물처럼 흐느끼는 색소폰 소리 아 ~~ 나를 울리네 이 순간이 지나고 나면 떠날 당신이기에 그대 가슴에 얼굴을 묻고 젖은 눈을 감추네 아 ~~ 블루스 블루수 블루스 연주자여 그 음악을 멈추지 말아요
친구야,박진광,비바람 몰아치는 캄캄한 밤에 저멀리 떠나버린 나의 친구야 지금은 어디에서 무얼하는지 너무도 그립구나 별들이 반짝이는 바다에 서면 밀려드는 파도같은 인생이구나 어디서 무얼하던 나의 친구야 너의 꿈 잃지마오 그늘진 니 얼굴에 환한 웃음을 뛰우려마 저 하늘이 무너져도 우리 뭐든지 할 수가 있어 친구야 친구야 험한세상에 다리가 될게 친구야 친구야 사랑한다 나의 친구야 어릴때 너는 내게 나의 형처럼 내 어깰 두드리며 날 지켜주었지 어디서 무얼하던 나의친구야 너의 꿈 잃지 마오 그늘진 니 얼굴에 환한 웃음을 띄우려마 자 하늘이 무너져도 우린 뭐든지 할 수가 있어 친구야 친구야 험한세상에 다리가 될게 친구야 친구야 영원한 나의 친구야 누구나 알고있어 넌 쓰러지지 않는다는 걸 너에겐 힘이있어 hey 친구야 친구야 험한세상 다리가 될게 친구야 친구야 사랑한다 나의 친구야 오 친구야 친구야 친구야 친구야 영원한 나의 친구야
안개낀 장충단 공원,배호,안개 낀 장충단 공원 누구를 찾아왔나 낙엽송 고목을 말없이 쓸어안고 울고만 있을까 지난 날 이 자리에 새긴 그 이름 뚜렷이 남은 이 글씨 다시 한 번 어루만지면 떠나가는 장충당 공원 비탈길 산길을 따라 거닐던 산기슭에 수많은 사연에 가슴을 움켜쥐고 울고만 있을까 가 버린 그 사람이 남긴 발자취 낙엽만 쌓여 있는데 외로움을 달래 가면서 떠나가는 장충단 공원
도시의 삐에로,박혜성,생각 없이 길을 걸어도 울적한 마음 무엇으로 달래야 하나 비에 젖은 가로등 되어 밤이 새도록 타오르는 이 마음 늘어지는 음악소리에 몸을 기대고 어디론가 가는 이 마음 반짝이던 푸른 꿈들이 날아가 버린 둥지 잃은 삐에로 사랑도 고독도 영원 속의 잠자는 가녀린 불꽃 언젠간 모두 나를 태워야 하리 춤추던 낭만의 기억 위로 흐르는 노래 연기처럼 사라진 추억 속의 그리움 늘어지는 음악 소리에 몸을 기대고 어디론가 가는 이 마음 반짝이던 푸른 꿈들이 날아가 버린 둥지 잃은 삐에로 사랑도 고독도 영원 속의 잠자는 가녀린 불꽃 언젠간 모두 나를 태워야 하리 춤추던 낭만의 기억 위로 흐르는 노래 연기처럼 사라진 추억 속의 그리움 추억 속의 그리움
사랑이여!,유심초,별처럼 아름다운 사랑이여 꿈처럼 행복했던 사랑이여 머물고 간 바람처럼 기약 없이 멀어져간 내 사랑아 한송이 꽃으로 피어라 지지 않는 사랑의 꽃으로 다시 한번 내 가슴에 돌아오라 사랑이여 내 사랑아 아 사랑은 타버린 불꽃 아 사랑은 한줄기 바람인것을 아 까맣게 잊으려 해도 왜 나는 너를 잊지 못 하나 오 내사랑  아 사랑은 타버린 불꽃 아 사랑은 한줄기 바람인것을 아 까맣게
참아주세요,김혜연,뱀이다 뱀이다 몸에 좋고 맛도 좋은 뱀이다 뱀이다 요놈의 뱀을 사로잡아 우리 아빠 보약을 해드리면 아이구 우리딸 착하구나 하고 좋아하실거야 개구리다 개구리다 몸에 좋고 맛도 좋은 개구리다 개구리다 요놈의 개구리를 사로잡아 우리 아빠 몸보신을 해드리면 아이구 우리딸 착하구나 하고 좋아하실거야 하지만 안되요 왜 그러지 마세요 왜 아빠 참아주세요 싫어싫어싫어 산과 들에 뱀과 개구리가 씨가 말랐데요 싹쓸이 당했대요 정말  똥개다 똥개다 몸에 좋고 맛도 좋은 똥개다 똥개다 요놈의 똥개를 때려잡아 우리 아빠 개소주를 해드리면 아이구 마누라 최고구나 하고 좋아하실거야 사슴이다 사슴이다 몸에 좋고 맛도 좋은 사슴이다 사슴이다 요놈의 사슴뿔을 잘라다가 우리 아빠 사슴피를 받아주면 아이구 마누라 최고구나 하고 좋아하실거야 하지만 안되요 왜 그러지 마세요 왜 아빠 참아주세요 그런다고 남 보다 오래사나 소용없는 일이에요 부질없는 일이에요 증말 하지만 안되요 왜 그러지 마세요 왜 아빠 참아주세요 산과 들에 뱀과 개구리가 씨가 말랐데요 싹쓸이 당했대요 정말
돌아와요 부산항에,조용필,꽃피는 동백섬에 봄이 왔건만 형제 떠난 부산항에 갈매기만 슬피 우네 오륙도 돌아가는 연락선 마다 목메어 불러봐도 대답 없는 내 형제여 돌아와요 부산항에 그리운 내 형제여 가고파 목이 메어 부르던 이거리는 그리워서 헤매이던 긴긴날의 꿈이었지 언제나 말이 없는 저 물결들도 부딪쳐 슬퍼하며 가는 길을 막았었지 돌아왔다 부산항에 그리운 내 형제여
사랑없인 못살아요,조영남,밤 깊으면 너무조용해 책 덮으면 너무 쓸쓸해 불을끄면 너무 외로워 누가 내곁에 있어며 좋겠네  이세상 사랑없인 어이 살수있나요 다른사람 몰라도 사랑없인 난 못살아요  한낮에도 너무 허전해 사람틈에 너무 막막해 오가는 말 너무덧없어 누가 내곁에 있으면 좋겠네  이세상 사랑없인 어이 살 수 있나요 다른 사람몰라도 사랑없인 난 못살아요 다른 사람몰라도 사랑없인 난 못살아요
그것은 인생,최혜영,나나나 나나나 나나나나 나나나 나나나 나나나나 아기 때는 젖주면 좋아하고 아하 아이 때는 노는걸 좋아하고 저 가는 세월 속에 모두 변해가는 건 그것은 인생 철이 들어 친구도 알게되고 아하 사랑하며 때로는 당황하며 저 가는 세월 속에 모두 변해가는 건 그것은 인생 시작도 알 수 없고 끝도 알 수 없네 영원한 시간 속에 잠시 서있을뿐 우리가 얻은 것은 진정 무엇이고 우리가 잃은 것은 과연 무엇인가 저 가는 세월 속에 빈손으로 가는 건 그것은 인생 나나나 나나나 나나나나 나나나 나나나 나나나나 어릴 때는 엄마가 필요하고 아하 커가면서 애인도 필요하고 저 가는 세월 속에 모두 변해가는 건 그것은 인생 부딪히는 갈등과 갈등 속에 아하 숨겨있던 자신을 발견하며 저 가는 세월 속에 모두 변해가는 건 그것은 인생 시작도 알 수 없고 끝도 알 수 없네 영원한 시간 속에 잠시 서있을뿐 우리가 얻은 것은 진정 무엇이고 우리가 잃은 것은 과연 무엇인가 저 가는 세월 속에 빈손으로 가는 건 그것은 인생 나나나 나나나 나나나나 나나나 나나나 나나나나
사랑을 위하여,김종환,이른 아침에 잠에서 깨어 너를 바라볼 수 있다면 물안개 피는 강가에 서서 작은 미소로 너를 부르리 하루를 살아도 행복할 수 있다면 나는 그 길을 택하고 싶다 세상이 우리를 힘들게 하여도 우리들은 변하지 않아 너를 사랑하기에 저 하늘끝에 마지막 남은 진실 하나로 오래 두어도 진정 변하지 않는 사랑으로 남게 해주오  내가 아플 때보다 네가 아파할 때가 내 가슴을 철들게 했고 너의 사랑 앞에 나는 옷을 벗었다 거짓의 옷을 벗어버렸다 너를 사랑하기에 저 하늘 끝에 마지막 남은 진실하나로 오래 두어도 진정 변하지 않는 사랑으로 남게 해주오 너를 사랑하기에 저 하늘 끝에 마지막 남은 진실 하나로 오래 두어도 진정 변하지 않는 사랑으로 남게 해주오 사랑으로 남게 해주오
찔레꽃,이미자,찔레꽃 붉게 피는 남쪽 나라 내 고향 언덕 위에 초가 삼간 그립습니다 자주 고름 입에 물고 눈물 젖어 이별가를 불러주던 못 잊을 사람아  달 뜨는 저녁이면 노래하던 그 장소 천리객창 북두성이 서럽습니다 작년봄에 모여앉아 찍은 사진 하염없이 바라보니 즐거운 시절아
아미새,김용현,
위대한 약속,리아킴,좋은 집에서 말다툼 보다 작은 집의 행복 느끼며 좋은 옷 입고 불편한 것보다 소박함에 살고 싶습니다 비가 오거나 눈이 오거나 때론 그대가 아플 때도 약속한 대로 그대 곁에 남아서 끝까지 같이 살고 싶습니다 위급한 순간에 내 편이 있다는 건 내겐 마음의 위안이고 평범한 것이 얼마나 소중한 지 벼랑 끝에서 보면 알아요 하나도 모르면서 둘을 알려고 하다 사랑도 믿음도 떠나가죠 세상 살면서 힘이야 들겠지만 사랑하며 살고 싶습니다 위급한 순간에 내 편이 있다는 건 내겐 마음의 위안이고 평범한 것이 얼마나 소중한 지 벼랑 끝에서 보면 알아요 하나도 모르면서 둘을 알려고 하다 사랑도 믿음도 떠나가죠 세상 살면서 힘이야 들겠지만 사랑하며 살고 싶습니다
최고다 당신,정서영,
아따 고것참,윙크,아따 고것참 인물이구나 남자 중에 남자로구나 아따 고것참 이 땅에 잘생긴 남자중에 으뜸인 남자를 들라하면 누가 뭐라해도 뭐니뭐니해도 하늘아래 하나뿐인 꽃과같은 내 사랑이야 내 사랑이야 방아방아 내 서방아 어화둥둥 내 기둥아 아따 고것참 인물이구나 남자 중에 남자로구나 아따 고것참 이 땅에 자상한 남자중에 으뜸인 남자를 들라하면 누가 뭐라해도 뭐니뭐니해도 하늘아래 하나뿐인 바다같은 내 사랑이야 내 사랑이야 방아방아 내 서방아 어화둥둥 내 기둥아 아따 고것참 인물이구나 남자 중에 남자로구나 아따 고것참 방아방아 어화둥둥 내 서방아 남자 중에 남자로구나 아따 고것참 이 땅에 일잘하는 남자중에 으뜸인 남자를 들라하면 누가 뭐라해도 뭐니뭐니해도 하늘아래 하나뿐인 천하장사 내 사랑이야 내 사랑이야 방가방가 내 서방아 어화둥둥 내 기둥아 아따 고것참 인물이구나 남자 중에 남자로구나 아따 고것참 남자 중에 남자로구나 아따 고것참 방아방아 어화둥둥 내 서방아
마지막 잎새,배호,그 시절 푸르던 잎 어느덧 낙엽 지고 달빛만 싸늘히 허전한 가지 바람도 살며시 비켜가건만 그 얼마나 참았던 사무친 상처길래 흐느끼며 떨어지는 마지막 잎새 싸늘히 파고드는 가슴을 파고들어 가는 발길도 끊어진 거리 애타게 부르며 서로 찾은 길 어이해 보내고 참았던 눈물인데 흐느끼며 길 떠나는 마지막 잎새
빠이 빠이야,소명,사랑의 그 약속을 내팽개치고 떠나가는 여자야 울 줄 알았지 착각하지마 너를 잡을 줄 아냐 이 세상에 어디 여자가 너뿐이더냐 너보다 착한 여자 너보다 고운여자 만나 살면 되는 걸 그래 가거라 행복해라 빠이빠이 빠이빠이야 사랑의 그 맹세를 나 몰라라고 돌아서는 남자야 나를 떠난건 너의 실수야 속이 편할 줄 아냐 이 세상에 어디 남자가 너뿐이더냐 너보다 잘난 남자 너보다 멋진 남자 만나 살면 되는 걸 그래 가거라 잘살아라 빠이빠이 빠이빠이야  사랑의 그 약속을 내팽개치고 떠나가는 여자야 울 줄 알았지 착각하지마 너를 잡을 줄 아냐 이 세상에 어디 여자가 너뿐이더냐 너보다 착한 여자 너보다 고운여자 만나 살면 되는 걸 그래 가거라 행복해라 빠이빠이 빠이빠이야 이 세상에 어디 남자가 너뿐이더냐 너보다 잘난 남자 너보다 멋진 남자 만나 살면 되는 걸 그래 가거라 잘살아라 빠이빠이 빠이빠이야 빠이빠이 빠이빠이야
존재의 이유 1,김종환,언젠가는 너와 함께 하겠지 지금은 헤어져 있어도 네가 보고 싶어도 참고 있을뿐이지 언젠간 다시 만날테니까 그리 오래 헤어지진 않아 너에게 나는 돌아갈거야 모든걸 포기하고 네게 가고싶지만 조금만 참고 기다려줘 알 수 없는 또 다른 나의 미래가 나를 더욱 더 힘들게 하지만 니가 있다는 것이 나를 존재하게해 니가 있어 나는 살 수 있는거야 조금만 더 기다려 네게 달려갈테니 그때까지 기다릴수 있겠니 그래 다시 시작하는거야 조금 늦는다고 바뀌는건 없겠지 남자란 때론 그 무엇을 위해서 모든것을 버릴때도 있는거야 넌 이해 할 수 있겠지 정말 미안해 널 힘들게해서 하지만 너무 슬퍼는 하지마 너의곁엔 항상 내가 있을테니까 우리의 미래를 위해 슬퍼도 조금만 참아줘 내가 이렇게 살아 갈 수 있는 이유는 니가 있기 때문이야 널 사랑해 저녁 늦게 나는 잠이 들었지 너를 생각할 시간도 없이 너무나 피곤해서 쓰러져 잠이 들었지 난 왜 이렇게 사는거야 눈을 뜨면 또 하루가 가고 내 손엔 작은 너의 사진뿐 너를 다시 만나면 꼭 안고 놓지 않으리 헤어져 있던 시간만큼 알 수 없는 또 다른 나의 미래가 나를 더욱 더 힘들게 하지만 니가 있다는 것이 나를 존재하게해 니가 있어 나는 살 수 있는거야 조금만 더 기다려 네게 달려갈테니 그때까지 기다릴수 있겠니 조금만 더 기다려 네게 달려갈테니 그때까지 기다릴수 있겠니
천년을 빌려 준다면,진성/이명주/찬이/유정희/김해남,1. @당신을 사랑하`(오)고 정`말 정말 @사랑하~아아(오)고 그래도 모자라면 당신을 위해 무엇이든 @다 해주고 싶어 만`약에 @하늘이 하`늘이 내~에에게 천`년을 빌~히일려준~후우운다면` 그 천`년을 당신`을 위해 사랑을 위~이이해 아~하낌없~업이~히이 모`두 쓰겠~헤엣소` 2. 당~~~~고 너`무~후우 너무~우우후 사~~~~해 원`하는 것 다~~~~어 어`느 날 하~~~~소`.
타타타,김국환,네가 나를 모르는데 난들 너를 알겠느냐 한치앞도 모두 몰라 다 안다면 재미없지 바람이 부는 날은 바람으로 비오면 비에 젖어 사는거지 그런거지 음음음 아 하하 산다는건 좋은거지 수지맞는 장사잖소 알몸으로 태어나서 옷한벌은 건졌잖소 우리네 헛짚는 인생살이 한세상 걱정조차 없이 살면 무슨 재미 그런게 덤이잖소 네가 나를 모르는데 난들 너를 알겠느냐 한치앞도 모두 몰라 다 안다면 재미없지 바람이 부는 날은 바람으로 비오면 비에 젖어 사는거지 그런거지 음음음 아 하하 산다는건 좋은거지 수지맞는 장사잖소 알몸으로 태어나서 옷한벌은 건졌잖소 우리네 헛짚는 인생살이 한세상 걱정조차 없이 살면 무슨 재미 그런게 덤이잖소
사랑아,강승모,1.사랑아 이제는 울지말아요 내맘이 너무 아파요 떠나야 하는데 나는못가요 그눈물 가슴에 맺혀  사랑을 했던 우리추억이 흐느껴 울고 있는데 가져선 안될 사랑이기에 이제는 멈춰야해요 아~사랑아 사랑아 울면 안돼요 그대울면 나는 못가요 아~이별아 이별아 아프지않게 내사랑 데려가줘요...  2.사랑아 이제는 슬퍼말아요 슬픔에 목이메어요 가야만하는데 가지못해요 그슬픔 길을 막아요  사랑을했던 우리두가슴 까맣게 타고있는데 만나선 안될 사랑이기에 여기서 멈춰야해요 아~사랑아 사랑아 슬퍼말아요 그대슬픔 두고 못가요 아~이별아 이별아 아프지않게 내사랑 데려가줘요...
비와외로움,위일청,낯설은 이 비가 내몸을 적시며 살며시 찾아드는 외로움 조용한 선술집에서 생각하는 그대 모습 길가의 가로등 내몸을 비추면 살며시 찾아드는 외로움 조용한 그 카페에서 생각하는 그대 모습 그대가 내곁에서 멀어져 바람속에 묻힐때 또 다시 길을 나서며 맞는 낯설은 비와 외로움 내마음 쓰러져 길가에 쓸쓸함이 쌓이네  길가의 가로등 내몸을 비추면 살며시 찾아드는 외로움 조용한 그 카페에서 생각하는 그대 모습 그대가 내곁에서 멀어져 바람속에 묻힐때 또 다시 길을 나서며 맞는 낯설은 비와 외로움 내마음 쓰러져 길가에 쓸쓸함이 쌓이네 내마음 쓰러져 길가에 쓸쓸함이 쌓이네
유일한 사람,김혜연,그대는 나의 모자람을 미소로 채워주고 감싸주는 유일한 사람 그대는 나의 마음속에 해가 뜨고 지는 지를 알고있는 유일한 사람 가는길이 아무리 험하고 멀어도 우리 서로를 지켜주리라 내가 기뻐할때도 내가 슬퍼할때도 언제나 내곁에 있어줄 사람 내가 외로울때도 내가 아파할때도 따뜻한 미소로 지켜줄 사람 - 간 주 중 - 그대는 나의 모자람을 미소로 채워주고 감싸주는 오직 한사람 그대는 나의 마음속에 비가 오고 개는 지를 알고있는 오직 한사람 누구하나 힘들고 지치고 아프면 우리 서로를 업어주리라 내가 기뻐할때도 내가 슬퍼할때도 언제나 내곁에 있어줄 사람 내가 외로울때도 내가 아파할때도 따뜻한 미소로 지켜줄 사람 따뜻한 미소로 지켜줄사람
찔레꽃,나훈아,<1절 찔레꽃 붉게 피는 남족나라 내고향 언덕위에 초가삼간 그립습니다. 자주고름 입에물고 눈물 젖어 이별가를 불러주던 못잊을 사람아  (2절 달뜨는 저녘이면 노래하던 새동무 철리객장 북극성이 서럽습니다 작년봄에 모여 앉아 매일같이 하염없이 바라보니 즐거운 시절아
녹슬은 기찻길,나훈아,휴전선 달빛아래 녹 슬은 기찻길 어이해서 피 빛 인가 말 좀 하렴아 전해다오 전해다오 고향 잃은 서러움을 녹 슬은 기찻길아 어버이 정 그리워 우는 이 마음  대동강 한강 물은 서해에서 만나 남과 북의 이야기를 주고받는데 전해다오 전해다오 고향 잃은 서러움을 녹 슬은 기찻길아 너처럼 내 마음도 울고 있단다
봄날은 간다,심수봉,연분홍 치마가 봄바람에 휘날리더라 오늘도 옷고름 씹어가며 산제비 넘나드는 성황당 길에 꽃이 피면 같이 웃고 꽃이 지면 같이 울던 알뜰한 그 냄새에 봄날은 간다
두바퀴,박구윤,우리사랑 두바퀴 사랑 바라만 봐도 좋은 당신 그려만 봐도 좋은 당신 멀리 있어도 가까이 있어도 너무 좋은 사람 내 당신 두바퀴로 달려가는 자전거 페달을 힘껏 밟으면 당신은 앞바퀴 나는 뒷바퀴 두바퀴로 달리는 사랑 당신 없으면 쓰러지는 내 사랑 우리사랑 두바퀴 사랑 쓰러지지 말고 달려요 두바퀴로 달려요 우리사랑 영원히 영원히 우리사랑 두바퀴 사랑 바라만 봐도 좋은 당신 그려만 봐도 좋은 당신 멀리 있어도 가까이 있어도 너무 좋은 사람 내 당신 두바퀴로 달려가는 자전거 페달을 힘껏 밟으면 당신은 앞바퀴 나는 뒷바퀴 두바퀴로 달리는 사랑 당신 없으면 쓰러지는 내 사랑 우리사랑 두바퀴 사랑 쓰러지지 말고 달려요 두바퀴로 달려요 우리사랑 영원히 영원히 우리사랑 두바퀴 사랑
화개장터,조영남,전라도와 경상도를 가로지르는 섬진강 줄기따라 화개장터엔 아랫마을 하동사람 윗마을 구례사람 닷새마다 어우러져 장을 펼치네 구경한번 와보세요 보기엔 그냥 시골장터지만 있어야 할 건 다 있구요 없을 건 없답니다 화개장터 전라도 쪽 사람들은 나룻배 타고 경상도 쪽 사람들은 버스를 타고 경상도 사투리에 전라도 사투리가 오손도손 왁자지껄 장을펼치네 구경한번 와보세요 오시면 모두모두 이웃사촌 고운 정 미운 정 주고 받는 경상도 전라도의 화개장터  전라도와 경상도를 가로지르는 섬진강 줄기따라 화개장터엔 아랫마을 하동사람 윗마을 구례사람 닷새마다 어우러져 장을 펼치네 구경한번 와보세요 보기엔 그냥 시골 장터지만 있어야 할 건 다 있구요 없을 건 없답니다 화개장터 구경한번 와보세요 오시면 모두모두 이웃사촌 고운 정 미운 정 주고 받는 경상도 전라도의 화개장터 경상도 전라도의 화개장터 경상도 전라도의 화개장터
천생연분,윙크,천생연분 내 사랑 하늘이 맺어준 사람 천년만년 내 사랑 영원히 지켜주세요 꽃비가 내리던 날 당신을 만났어요 스치는 손길에 나는 알았죠 당신은 내 사람이죠 사랑이 스며들죠 수줍은 내 가슴에 떨리는 내 볼에 입 맞추었죠 내 맘은 녹아버렸죠 사랑인가요 이런게 사랑이라면 그대와 난 이 세상에서 인연인가요 천생연분 내 사랑 하늘이 맺어준 사람 천년만년 내 사랑 영원히 지켜주세요 천생연분 내 사랑 하늘이 맺어준 사람 천년만년 내 사랑 영원히 지켜주세요 쓸쓸한 달빛 아래 사랑을 맹세했죠 빨개진 귓가에 속삭여주며 내 맘을 사로잡았죠 꿈속을 헤맸어요 당신을 기다리며 나에게 다가올 인연이라면 머물러 주길 바랬죠 사랑인가요 이런게 사랑이라면 그대와 난 이 세상에서 인연인가요 천생연분 내 사랑 하늘이 맺어준 사람 천년만년 내 사랑 영원히 지켜주세요 영원히 지켜주세요 그대와 난 천생연분
영시의 이별,배호,1. 네온불이 쓸쓸하게 꺼저가는 삼거리 이별 앞에 너와 나는 한 없이 울었다. 추억만 남겨놓은 젊은 날에 불 장난 원점으로 돌아가는 영시처럼 사랑아 안녕  2. 밤안개가 자욱한 길 깊어 가는 이 한밤 너와 나의 주고 받는 인사는 슬펐다. 울기도 안타까운 잊어야 할 아쉬움 원점으로 돌아가는 영시처럼 사랑아 안녕
사랑을 한 번 해보고 싶어요,하동진,사랑에 한 번 빠지고싶어요 아주 멋진 여자를 만나 바다가 있는 아름다운 해변을 둘이서 걷고 싶어요 가슴이 불타 올라요 눈물마저 핑 도네요 지금까지 살아오면서 나를 위해 무엇을 했나 세월이 다 가기전에 내 모습 변하기 전에 그대와 둘이 밤을 지세며 지난날을 잊고 싶어요   사랑을 한 번 해보고싶어요 매력있는 여자를 만나 아무도 없는 무인도에서 그녀와 함께 있고싶어요 가슴이 벅차 올라요 눈물마저 핑 도네요 지금까지 살아오면서 나를 위해 무었을 했나 세월이 다 가기전에 내 모습 변하기 전에 사랑하는 그대 그대와둘이 지난날을 잊고싶어요 지난날을 잊고 싶어요
찻집의 고독,나훈아,그 다방에 들어설 때에 내 가슴은 뛰고 있었지 기다리는 그 순간만은 꿈길처럼 감미로왔다 약속시간 흘러 갔어도 그 사람은 보이지 않고 싸늘하게 식은 찻잔에 슬픔처럼 어리는 고독 아 사랑이란 이렇게도 애가 타도록 괴로운 것이라서 잊으려 해도 잊을 수 없어 가슴 조이며 기다려봐요  아 사랑이란 이렇게도 애가 타도록 괴로운 것이라서 잊으려 해도 잊을 수 없어 가슴 조이며 기다려봐요
사랑하는 날까지,김종환,사랑은 운명 속에 언제나 살고 있다 가슴을 치는 슬픔 그 고통 속에도 나와 함께 길을 걷는다 외로움이 나는 싫어 당신을 선택했다 내가 사는 날까지 운명의 길 위에서 당신과 살고 싶다 너를 사랑하기에 내가 존재하는 것 널 위해 내가 살 수 있다면 나의 뜨거운 젊음 모두 다 주고 싶다 몇백년 사는 것도 아닌데 천년을 기다려도 너를 사랑하겠다 마지막 남은 사랑을 위해 내 꿈이 깨질까봐 불안한 삶이 싫다 내가 선택한 길을 내가 걸어가면서 사랑에 운명을 건다 너를 사랑하기에 내가 존재하는 것 널 위해 내가 살 수 있다면 나의 뜨거운 젊음 모두 다 주고 싶다 몇백년 사는 것도 아닌데 천년을 기다려도 너를 사랑하겠다 마지막 남은 사랑을 위해 천년을 기다려도 너를 사랑하겠다 마지막 남은 사랑을 위해 마지막 남은 사랑을 위해
