Title,Singer,Lyric
유행가,송대관,유행가 유행가 신나는 노래 나도 한번 불러본다 쿵쿵따리 쿵쿵따 짜리자짜 유행가 노래 가사는 우리가 사는 세상 이야기 오늘 하루 힘들어도 내일이 있으니 행복하구나 유행가 유행가 신나는 노래 나도 한번 불러본다 유행가 유행가 서글픈 노래 가슴치며 불러본다 유행가 노래 가사는 사랑과 이별 눈물이구나 그 시절 그 노래 가슴에 와 닿는 당신의 노래  유행가 유행가 신나는 노래 나도 한번 불러본다 쿵쿵따리 쿵쿵따 짜리자짜 유행가 노래 가사는 우리가 사는 세상 이야기 오늘 하루 힘들어도 내일이 있으니 행복하구나 쿵쿵따리 쿵쿵따 신나는 노래 우리 한번 불러보자 쿵쿵따리 쿵쿵따 서글픈 노래 가슴치며 불러보자 유행가 노래 가사는 사랑과 이별 눈물이구나 음정 박자 따로지만 넘치는 감정으로 부르는 노래 쿵쿵따리 쿵쿵따 신나는 노래 우리 한번 불러보자 쿵쿵따리 쿵쿵따 서글픈 노래 가슴치며 불러보자 유행가 노래 가사는 사랑과 이별 눈물이구나 음정 박자 따로지만 넘치는 감정으로 부르는 노래 넘치는 감정으로 부르는 노래 짠짠
부끄부끄,윙크,부끄 부끄 부끄 부끄 부끄러워요  부끄 부끄 부끄 부끄 부끄 honey honey  부끄 부끄 부끄 부끄 부끄러워요  부끄 부끄 부끄 부끄 부끄러워    Honey honey 날 좋아허니  왜 자꾸 자꾸 느끼하게 바라보니  너무 뜨거워 앗 뜨거 녹아 내리잖아    Honey honey 날 사랑허니  왜 자꾸 자꾸 원하는게 많아지니  살짝 겁이 나 여자맘이 이런거잖아    겉으론 새침해 보여도 가슴은 두근두근  쿨하게 보여도 사실은 수줍은 여자랍니다    그렇게 쳐다보면 부끄러워요  슬며시 손 잡으면 부끄러워  갑자기 입 맞추면 부끄러워요  더 많이 원하시면 부끄러워    부끄 부끄 부끄 부끄 부끄러워요  부끄 부끄 부끄 부끄 부끄 honey honey  부끄 부끄 부끄 부끄 부끄러워요  부끄 부끄 부끄 부끄 부끄러워      Honey honey 날 좋아허니  왜 자꾸 자꾸 느끼하게 바라보니  너무 뜨거워 앗 뜨거 녹아 내리잖아    Honey honey 날 사랑허니  왜 자꾸 자꾸 원하는게 많아지니  살짝 겁이 나 여자맘이 이런거잖아    겉으론 새침해 보여도 가슴은 두근두근  쿨하게 보여도 사실은 수줍은 여자랍니다    그렇게 쳐다보면 부끄러워요  슬며시 손 잡으면 부끄러워  갑자기 입 맞추면 부끄러워요  더 많이 원하시면 부끄러워    부끄 부끄 부끄 부끄 부끄러워요  부끄 부끄 부끄 부끄 부끄 honey honey  부끄 부끄 부끄 부끄 부끄러워요  부끄 부끄 부끄 부끄 부끄러워
쓰러집니다,서주경,쓰러집니다 쓰러집니다 쓰러집니다 올때는 내게 예고없이 다가왔다가 이제와서 날 떠나요 말도 안돼 핑계 어쩌면 잘 갖다 붙여 뻔뻔하게도 차라리 내가 싫어졌다 말을 한다면 잡을 나도 아니겠지만 사랑해서 떠난다는 말 지금 뭐하자는 겁니까 쓰러집니다 쓰러집니다 그대 말을 듣고 있으면 뭐가 어때서 그런건가요 사랑이 장난인가요 가던길 그냥 떠나지 왜 돌려요 이제는 그만 나를 울려요 가던길 그냥 떠나지 왜 돌려요 가던길 그냥 떠나지 하루가 멀다 나를 찾던 그대 사랑은 모두 연극이란 말이죠 나 없으면 못산다는말 없던 걸로 하잔 말이죠 쓰러집니다 쓰러집니다 그대 말을 듣고 있으면 뭐가 어때서 그런건가요 사랑이 장난인가요 가던길 그냥 떠나지 왜 돌려요 이제는 그만 나를 울려요 가던길 그냥 떠나지 왜 돌려요 가던길 그냥 떠나지 가던길 그냥 떠나지 왜 돌려요 이제는 그만 나를 울려요 가던길 돌려 왔다가 다시 가면 나 정말 쓰러집니다 쓰러집니다 쓰러집니다 쓰러집니다
가을비 우산속,최헌,그리움이 눈처럼 쌓인 거리를 나혼자서 걸었네 미련때문에 흐르는 세월따라 잊혀진 그 얼굴이 왜 이다지 속눈썹에 또다시 떠오르나 정다웠던 그 눈길 목소리 어딜갔나 아픈 가슴 달래며 찾아 헤매이는 가을비 우산속에 이슬 맺힌다  잊어야지 언젠가는 세월 흐름 속에 나혼자서 잊어야지 잊어봐야지 슬픔도 그리움도 나혼자서 잊어야지 그러다가 언젠가는 잊어지겠지 정다웠던 그 눈길 목소리 어딜갔나 아픈 가슴 달래며 찾아 헤매이는 가을비 우산속에 이슬 맺힌다
사랑해요,장윤정,사랑해요 말로는 못 해도 이런 내 맘 꼭 전해지기를 이젠 내가 지켜 줄게요 평생 살아가는 동안에 내가 세상에 오던 날 뜨겁던 그대 눈물이 오늘도 날 살게 하네요 그대 정말 고마워요 살다가 힘이 들 때면 서운해 미워질 때면 그 날을 우리 기억하면서 나 평생 약속할게요 사랑해요 말로는 못 해도 이런 내 맘 꼭 전해지기를 이젠 내가 지켜 줄게요 평생 살아가는 동안에 바쁘게 살다가 보면 가끔은 소홀해져도 그대를 향한 나의 마음은 언제나 변하지 않죠 사랑해요 말로는 못 해도 이런 내 맘 꼭 전해지기를 이젠 내가 지켜 줄게요 평생 살아가는 동안에 사랑해요 세상이 변해도 이런 내 맘 늘 변치 않기를 영원토록 행복하기를 평생 살아가는 동안에 평생토록 지켜 줄게요 우리 살아가는 동안에
사나이 눈물,조항조,지금가지 않으면 못 갈것 같아 아쉬움만 두고 떠나야겠지 여기까지가 우리 전부 였다면 더이상은 욕심이겠지 피할수 없는 운명 앞에 소리내어 울지 못하고 까만 숯덩이 가슴안고 삼켜버린 사나이 눈물 이별할 새벽 너무 두려워 이대로 떠납니다  돌아서서 흘린 내눈물 속에 우리들의 사랑 묻어버리면 못다부른 나의 슬픈 노래도 바람으로 흩어 지겠지 피할수 없는 운명 앞에 소리내어 울지 못하고 까만 숯덩이 가슴 안고 삼켜버린 사나이눈물 아침이 오면 너무 초라해 이대로 떠납니다
사랑은 아무나 하나,태진아,사랑은 아무나 하나 사랑은 아무나 하나 사랑은 아무나 하나 눈이라도 마주쳐야지 만남의 기쁨도 이별의 아픔도 두사람이 만드는걸 어느 세월에 너와 내가 만나 점 하나를 찍을까 사랑은 아무나 하나 어느누가 쉽다고 했나  사랑은 아무나 하나 사랑은 아무나 하나 사랑은 아무나 하나 흔히하는 얘기가 아니지 만나고 만나도 느끼지 못하면 외로운건 마찬가지야 어느 세월에 너와 내가 만나 점 하나를 찍을까 사랑은 아무나 하나 어느누가 쉽다고 했나 어느 세월에 너와 내가 만나 점 하나를 찍을까 사랑은 아무나 하나 어느누가 쉽다고 했나
분위기 좋고,송대관,분위기 좋고좋고 느낌이 와요와요 준비는 됐어됐어 오메 좋은거 분위기 좋고좋고 폼도 좋구나 좋아 준비는 됐어됐어 나는 행복해  봐요봐요 봐요봐요 아싸 이쁜 내사랑 보고싶어 갑니다 가요 내가 가요 당신만의 사랑이 되어 길은 멀어도 마음은 하나요 뜨거운 내마음 받아만 준다면  분위기 좋고좋고 느낌이 와요와요 준비는 됐어됐어 오메 좋은거 분위기 좋고좋고 폼도 좋구나 좋아 준비는 됐어됐어 나는 행복해  내 인생에도 봄이 온다 내 사랑에도 꽃이 핀다  분위기 좋고좋고 느낌이 와요와요 준비는 됐어됐어 오메 좋은거 분위기 좋고좋고 폼도 좋구나 좋아 준비는 됐어됐어 나는 행복해  봐요봐요 봐요봐요 아싸 이쁜 내사랑 보고싶어 갑니다 가요 내가 가요 당신만의 사랑이 되어 길은 멀어도 마음은 하나요 뜨거운 내마음 받아만 준다면  분위기 좋고좋고 느낌이 와요와요 준비는 됐어됐어 오메 좋은거 분위기 좋고좋고 폼도 좋구나 좋아 준비는 됐어됐어 나는 행복해  사랑이 온다와요 옵니다 옵니다와요 느낌이 와요와요 오메 좋은거 그님이 온다와요 좋구나 좋구나좋아 준비는 됐어됐어 나는 행복해
천년 바위,박정식,동녘 저편에 먼동이 트면 철새처럼 떠나리라 세상 어딘가 마음 줄 곳을 집시되어 찾으리라 생은 무엇인가요 삶은 무엇인가요 부질없는 욕심으로 살아야만 하나  서산 저 넘어 해가 기울면 접으리라 날개를 내가 숨쉬고 내가 있는 곳 기쁨으로 밝히리라 생은 무엇인가요 삶은 무엇인가요 부질없는 욕심으로 살아야만 하나 이제는 아무 것도 그리워 말자 생각을 하지 말자 세월이 오가는 길목에 서서 천년바위 되리라 천년바위 되리라 천년바위 되리라
안동역에서,진성,바람에 날려버린 허무한 맹세였나 첫눈이 내리는 날 안동역 앞에서 만나자고 약속한 사람 새벽부터 오는 눈이 무릎까지 덮는데 안 오는 건지 못 오는 건지 오지 않는 사람아 안타까운 내 마음만 녹고 녹는다 기적 소리 끊어진 밤에 어차피 지워야 할 사랑은 꿈이었나 첫눈이 내리는 날 안동역 앞에서 만나자고 약속한 사람 새벽부터 오는 눈이 무릎까지 덮는데 안 오는 건지 못 오는 건지 대답 없는 사람아 기다리는 내 마음만 녹고 녹는다 밤이 깊은 안동역에서
정말 좋았네,주현미,사랑 그사랑이 정말 좋았네 세월 그 세월이 가는줄도 모르고 불타던 두 가슴에 그정을 새기면서 사랑을 주고 사랑을 받고 그밤이 좋았네 사랑 그 사랑이 정말 좋았네  사랑 그 사랑이 정말 좋았네 이별 그 이별이 오는줄도 모르고 푸르던 두 가슴에 참사랑 새기면서 마음을 주고 마음을 받고 그때가 좋았네 사랑 그 사랑이 정말 좋았네 정말 좋았네
천년지기,금잔디,넌 정말 좋은 친구야 내가 지쳐 있을 때 내가 울고 있을 때 위로가 되어준 친구 너는 나의 힘이야 너는 나의 보배야 천년지기 나의 벗이야 친구야 우리 우정의 잔을 높이 들어 건배를 하자 같은 배를 함께 타고 떠나는 인생길 니가 있어 외롭지 않아 넌 정말 좋은 친구야 넌 정말 좋은 친구야 내가 외로워 할 때 내가 방황을 할 때 위로가 되어준 친구 너는 나의 힘이야 너는 나의 보배야 천년지기 나의 벗이야 친구야 우리 우정의 잔을 높이 들어 건배를 하자 같은 배를 함께 타고 떠나는 인생길 니가 있어 외롭지 않아 넌 정말 좋은 친구야
해운대 연가,전철,푸른물결 춤을 추고 물새 날아드는 해운대의 밤은 또 그렇게 지나가는데 솔밭길을 걷던 우리들의 사랑얘기가 파도에 밀려 사라지네  하얀 모래밭에 사랑해란 글씨를 쓰며 영원히 날 사랑한다 맹세하던 그대 널 널 널 사랑해  떨리는 내 입술에 키스해 주던 너 보고싶은 사랑 추억속의 그대 해운대의 사랑이여  푸른물결 춤을 추고 물새 날아드는 해운대의 밤은 또 그렇게 지나가는데 솔밭길을 걷던 우리들의 사랑얘기가 파도에 밀려 사라지네  하얀 모래밭에 사랑해란 글씨를 쓰며 영원히 날 사랑한다 맹세하던 그대 널 널 널 사랑해  떨리는 내 입술에 키스해 주던 너 보고싶은 사랑 추억속의 그대 해운대의 사랑이여  보고싶은 사랑 추억속의 그대 해운대의 사랑이여 -
비가,혜은이,사랑하는 사람아 그이름을 끝내 부르지 못해 그리움 하나로 잊혀져가는 내 이름 석자 등을 돌려 내게서 등돌려 가는 사람이여 그래 말없이 떠나라 다신 돌아오지 말아라 바람에 스치우는 그대 그리운맘 이젠 잊으리라 노을 한 자락에도 떨어지는 이눈물은 씻어 지리라 살다 살다 외로워질때 나보다 더 그대 외로울때 그땐 그리워지리라 잊혀진 내 이름 석자  바람에 스치우는 그대 그리운맘 이젠 잊으리라 노을 한 자락에도 떨어지는 이 눈물은 씻어 지리라 살다 살다 외로워질때 나보다 더 그대 외로울때 그땐 그리워지리라 잊혀진 내 이름 석자 잊혀진 내이름 석자
내 마음 갈 곳을 잃어,최백호,가을엔 가을엔 떠나지 말아요  낙엽지면 서러움이 더해요  차라리 하얀 겨울에 떠나요 눈길을 걸으며 눈길을 걸으며 옛 일을 잊으리라 거리엔 어둠이 내리고 안개속에 가로등 하나 비라도 우울히 내려 버리면 내마음 갈곳을 잃어 가을엔 가을엔 떠나지 말아요  차라리 하얀 겨울에 떠나요  거리엔 어둠이 내리고 안개속에 가로등 하나 비라도 우울히 내려 버리면 내마음은 갈곳을 잃어 가을엔 가을엔 떠나지 말아요 차라리 하얀 겨울에 떠나요 하얀 겨울에 떠나요
우린 너무 쉽게 헤어졌어요,최진희,그대의 옷자락에 매달려 눈물을 흘려야했나요 길목을 가로막고 가지말라고 애원해야 했나요 떠나가버린 그대때문에 내모습이 야위어가요 아무에게도 말을 못하고 남 모르게 가슴아파요  우린 너무 쉽게 헤어졌어요 우린 너무 쉽게 헤어졌어요 한번쯤 다시 만나 생각해봐요 너무 쉽게 헤어졌어요  떠나가 버린 그대때문에 내모습이 야위어가요 아무에게도 말을 못하고 남 모르게 가슴아파요 우린 너무 쉽게 헤어졌어요 우린 너무 쉽게 헤어졌어요 한번쯤 다시 만나 생각해봐요 너무 쉽게 헤어졌어요
멋진인생,박정식,아리 아리 아리 동동  쓰리 쓰리 쓰리 동동    잘났다고 못났다고  누가 말했나  서로 믿고 사랑하면  그것이 멋진 인생  많고 많은 사람중에  우리 만남은  하늘에서 맺어주신  천생연분 일세  아리랑 쓰리랑  아라리가 났구나  아리 아리 아리 동동  쓰리 쓰리 쓰리 동동  아름다운 이 세상에 한번 왔다  가는 인생 멋지게 살아보세    아리 아리 아리 동동  쓰리 쓰리 쓰리 동동    잘난 사람 못난 사람  따로 있더냐  서로 믿고 사랑하면  그것이 멋진 인생  백짓장도 맛들며는 가볍다는데  세상살이 힘들거든  함께 살아봐요  아리랑 쓰리랑  아라리가 났구나  아리 아리 아리 동동  쓰리 쓰리 쓰리 동동  아름다운 이 세상에 한번 왔다  가는 인생 멋지게 살아보세  멋지게 살아보세
골목길,이재민,오늘밤은 너무 깜깜해 별도 달도 모두 숨어버렸어 니가 오는 길목에 나 혼자 서있네 혼자 있는 이 길이 난 정말 싫어 찬바람이 불어서 난 더욱 싫어 기다림에 지쳐 눈물이 핑 도네 이제 올 시간이 된 것도 같은데 이제 네 모습이 보일것도 같은데 혼자 있는 이 길이 아직도 쓸쓸해 골목길에서 널 기다리네 아무도 없는 쓸쓸한 골목길  오늘밤은 너무 깜깜해 별도 달도 모두 숨어버렸어 니가 오는 길목에 나 혼자 서있네 혼자 있는 이 길이 난 정말 싫어 찬바람이 불어서 난 더욱 싫어 기다림에 지쳐 눈물이 핑 도네 이제 올 시간이 된 것도 같은데 이제 네 모습이 보일것도 같은데 혼자 있는 이 길은 아직도 쓸쓸해 골목길에서 널 기다리네 아무도 없는 쓸쓸한 골목길 골목길 골목길 골목길 골목길 골목길 골목길 골목길 골목길
딱 좋아,송대관,사랑도 해 봤다 이별도 해 봤다 산전수전 다 겪어 봤다 눈물도 흘렸다 원망도 해 봤다 삶에 지쳐 쓰러져도 봤다 이 나이에 못할 게 뭐가 있을까 더도 말고 덜도 말고 지금이 딱 좋아 지난 일은 생각 말자 후회를 말자 더도 말고 덜도 말고 지금이 딱 좋아 한 때는 겁 없이 잘 나가도 봤다 무서울 게 없던 나였다 실패를 해 보고 욕심도 버렸다 이제 마음도 다 비워 버렸다 이 나이에 못할 게 뭐가 있을까 더도 말고 덜도 말고 지금이 딱 좋아 지난 일은 생각 말자 후회를 말자 더도 말고 덜도 말고 지금이 딱 좋아 이 나이에 못할 게 뭐가 있을까 더도 말고 덜도 말고 지금이 딱 좋아 지난 일은 생각 말자 후회를 말자 더도 말고 덜도 말고 지금이 딱 좋아 더도 말고 덜도 말고 지금이 딱 좋아
당돌한 여자,서주경,일부러 안 웃는거 맞죠 아하 나에게만 차가운거 맞죠 아하 알아요 그대 마음을 내게 빠질까봐 두려운거죠 그대는 그게 매력이에요 아하 관심 없는 듯한 말투 눈빛 아하 하지만 그대 시선은 나는 안보고도 느낄 수 있죠 집으로 들어가는 길인가요 그대의 어깨가 무거워 보여 이런 나 당돌한가요 술 한잔 사주실래요 야이야야야이 날 봐요 우리 마음 속이지는 말아요. 날 기다렸다고 먼저 얘기하면 손해라도보나요 야이야이야이 말해요. 그대 여자 되달라고 말해요 난 이미 오래전 그대 여자이고 싶었어요 - 간 주 중 - 애인이 없다는거 맞죠 아하 혹시 숨겨둔거 아니겠죠 아하 믿어요 그대의 말을 행여 있다 해도 양보는 싫어 그대는 그게 맘에 들어 여자 많은 듯한 겉모습에 사실은 아무에게나 마음주지 않는 그런 남자죠 집으로 들어가는 길인가요 그대의 어깨가 무거워 보여 이런 나 당돌한가요 술 한잔 사주실래요 야이야야야이 날 봐요 우리 마음 속이지는 말아요. 날 기다렸다고 먼저 얘기하면 손해라도보나요 야이야이야이 말해요. 그대 여자 되달라고 말해요 난 이미 오래전 그대 여자이고 싶었어요
애수,진시몬,아직도 모르겠어 난 정말  꿈이라 생각해야 하는지  너 떠난 그 길목에서 널 기다리는데  세월 모두 흘러가나 잊혀진건 아닌데  되돌아 오는 그길은 너무나도 멀었어  널 매일 생각했어  보이지 않는 환상을 쫓고있어  그리워 목이 메어 눈물흘려도 눈물닦아도  언젠간 돌아올거라 믿었는데  그대여 제발 내게로 돌아와줘요  내마음 오직 그대뿐인걸  꿈속에서도 눈을 떠봐도 온통 너의모습 그뿐인걸  널 매일 생각했어  보이지 않는 환상을 쫓고있어  그리워 목이 메어 눈물흘려도 눈물닦아도  언젠간 돌아올거라 믿었는데  그대여 제발 내게로 돌아와줘요  내마음 오직 그대뿐인걸  꿈속에서도 눈을 떠봐도 온통 너의모습 그뿐인걸
휴식을 위하여,장철웅,아무래도 난 돌아가야겠어 이곳은 나에게 어울리지않아 화려한 유혹 속에서 웃고 있지만 모든 것이 낯설기만 해 외로움에 길들여짐으로 차라리 혼자가 마음 편한 것을 어쩌면 너는 아직도 이해못하지 내가 너를 모르는 것처럼 언제나 선택이란 둘 중에 하나 연인 또는 타인 뿐인걸 그 무엇도 될 수 없는 나의 슬픔은 무심하게 바라만 보는 너 처음으로 난 돌아가야겠어 힘든건 모두가 다를게 없지만 나에게 필요한 것은 휴식 뿐이야 약한 모습 보여서 미안해  하지만 언젠가는 돌아올거야 휴식이란 그런거니까 내 마음이 넓어지고 자유로워져 너를 다시 만나면 좋을거야
찰랑찰랑,이자연,찰랑 찰랑 찰랑 대네  잔에 담긴 위스키처럼  그 모습이 찰랑 대네  사랑이란 한잔 술이던가  오오오 그대는 나를  취하게 하는 사람이었고  가까이에서 이마음을  자꾸 흔들었어  촉히 젖은 눈빛 하나로  이마음을 적셔주었어  그것이 사랑이라면 이순간  모든걸 다 줄수 있어  그것이 거짓없는 진실이라면  나는 나는 그대 잔속에서  찰랑찰랑 되는 술이 되리라        오오오 그대는나를 취하게 하는  사람이었고가까이에서  이 마음을 자꾸 흔들었어  촉촉히 젖은 눈빛 하나로  이마음을 적셔주었어  그것이 사랑이라면 이순간  모든걸 다 줄수 있어  그것이 거짓없는 진실이라면  나는 나는 그대 잔속에서  찰랑찰랑 되는 술이 되리라  나는 나는 그대 잔속에서  찰랑찰랑 되는 술이 되리라  그대 위하여
제3한강교,혜은이,강물은 흘러갑니다 제3한강교 밑을 당신과 나의 꿈을 싣고서 마음을 싣고서 젊음은 피어나는 꽃처럼 이밤을 맴돌다가 새처럼 바람처럼 물처럼 흘러만 갑니다 어제 다시 만나서 다짐을 하고 우리들은 맹세를 하였습니다 이밤이 새이며는 첫차를 타고 행복어린 거리로 떠나갈거예요 강물은 흘러갑니다 제3한강교 밑을 바다로 쉬지않고 바다로 흘러만 갑니다 어제 다시 만나서 다짐을 하고 우리들은 맹세를 하였습니다 이밤이 새이며는 첫차를 타고 행복어린 거리로 떠나갈거예요 강물은 흘러갑니다 제3한강교 밑을 바다로 쉬지않고 바다로 흘러만 갑니다 흘러만 갑니다 흘러만 갑니다
또 만났네요,주현미,또 만났네 또 만났어 야속한 그 사람 약속이나 한 것처럼 또 만났네 나도 모르게 생각만해도 설레이는 내 마음 언제 볼까 궁금했는데 또 만났네요 어쩌다 눈길이 마주칠 때면 자꾸만 가슴이 두근 거리네 그 언제쯤 말을 붙일까 때가 되면은 때가 되면은 사랑을 고백할거야 또 만났네 또 만났어 야속한 그 사람 약속이나 한 것처럼 또 만났네 나도 모르게 그려만봐도 보고싶은 내 마음 며칠동안 안보이더니 또 만났네요 당신과 헤어져 헤어 질때면 자꾸만 아쉬워 아쉬워 지네 이게 바로 정이란 걸까 때가 되면은 때가 되면은 사랑을 고백할거야 어쩌다 눈길이 마주칠 때면 자꾸만 가슴이 두근 거리네 그 언제쯤 말을 붙일까 때가 되면은 때가 되면은 사랑을 고백할거야
초연,김연숙,먼 산 부엉이 밤새워 울어대고 앞내 물소리 가슴을 적실때 나는 사랑이 무언줄 알았네 그러나 당신은 나를두고 어딜갔나 아 아 그대를 기다리네 돌아와요 내게 돌아와요 기다리는 내 사랑  나는 사랑이 무언줄 알았네 그러나 당신은 나를두고 어딜갔나 아 아 그대를 기다리네 돌아와요 내게 돌아와요 기다리는 내 사랑
꿈의 대화,이범용,땅거미 내려 앉아 어두운 거리에 가만히 너에게 나의 꿈 들려주네  조용한 호수가에 아무도 없는 곳에 우리의 나무집을 둘이서 짓는다 흰눈이 온 세상을 깨끗이 덮으면 작은 불 피워놓고 사랑을 하리라 네가 제일 좋아하는 별들이 불밝히리 네가 제일 좋아하는 창가에 마주 앉아 따뜻이 서로의 빈곳을 채우리 내 눈에 반짝이는 별빛을 헤리라 외로움이 없단다 우리들의 꿈 속에 서러움도 없어라 너와 나의 눈빛엔 마음 깊은 곳에서 우리 함께 나누자 너와 나만의 꿈의 대화를 외로움이 없단다 우리들의 꿈 속에 서러움도 없어라 너와 나의 눈빛엔 마음 깊은 곳에서 우리 함께 나누자 너와 나 너와 나만의 꿈의 대화를
사랑은 장난이 아니야,태진아,한~사-람~사-랑~하-는~게~ 왜-이~렇~게~ 힘-이~드-는~가~ 나-좋~다~고~ 말~해-놓~고~ 그-냥~가-면~나-는~어~쩌~나~ 나-없~인~ 못~산-다~고~ 말-해-놓~고-서~ 나-없~인~ 못~산-다~고~ 말-해~놓-고~서~ 거-짓~말-이-엇~나~ 나-한~테-한~말-이~ 거-짓~말~이-엇~나~  사-랑~은-장-난~이-아~니-야~ 사-랑~은-장-난~이-아~니-야~ 진~실~인~거~야~  사-랑~은-장-난~이-아~니-야~ 사-랑~은-장-난~이-아~니-야~ 진~실~인~거~야~   당~신-을~사-랑~하-는~게~ 왜-이~렇~게~ 힘-이~드-는~가~ 사-랑~한~다~ 말~해-놓~고~ 떠-나~가-면~나-는~어~쩌~나~ 나-없~인~ 못~산-다~고~ 말-해-놓~고-서~ 나-없~인~ 못~산-다~고~ 말-해~놓-고~서~ 거-짓~말-이-엇~나~ 나-한~테-한~말-이~ 거-짓~말~이-엇~나~  사-랑~은-장-난~이-아~니-야~ 사-랑~은-장-난~이-아~니-야~ 진~실~인~거~야~  사-랑~은-장-난~이-아~니-야~ 사-랑~은-장-난~이-아~니-야~ 진~실~인~거~야~
나 어떡해,샌드 페블즈,나 어떡해 너 갑자기 가버리면 나 어떡해 너를 잃고 살아갈까 나 어떡해 나를 두고 떠나가면 그건 안돼 정말 안돼 가지 말아 누구 몰래 다짐했던 비밀이 있었나 다정했던 네가 상냥했던 네가 그럴 수 있나 못 믿겠어 떠난다는 그 말을 안 듣겠어 안녕이란 그 말을  다정했던 네가 상냥했던 네가 그럴 수 있나 못 믿겠어 떠난다는 그 말을 안 듣겠어 안녕이란 그 말을 나 어떡해 나 어떡해 나 어떡해 나 어떡해 나 어떡해 나 어떡해 나 어떡해 나 어떡해 나 어떡해 나 어떡해 나 어떡해 나 어떡해 나 어떡해 나 어떡해
