Title,Singer,Lyric
초혼,장윤정,살아서는 갖지 못하는 그런 이름 하나 때문에 그리운 맘 눈물 속에 난 띄워 보낼 뿐이죠 스치듯 보낼 사람이 어쩌다 내게 들어와 장미의 가시로 남아서 날 아프게 지켜보네요 따라가면 만날 수 있나 멀고 먼 세상 끝까지 그대라면 어디라도 난 그저 행복할 테니  살아서는 갖지 못하는 그런 이름 하나 때문에 그리운 맘 눈물 속에 난 띄워 보낼 뿐이죠 스치듯 보낼 사람이 어쩌다 내게 들어와 장미의 가시로 남아서 날 아프게 지켜보네요 따라가면 만날 수 있나 멀고 먼 세상 끝까지 그대라면 어디라도 난 그저 행복할 테니 난 너무 행복할 테니
사랑아,장윤정,안돼요 안돼 날 두고 떠나면 안돼 그렇게 못해 난 절대 보낼 순 없어 갈테면 가라 모든 걸 잊고 떠나봐 그땐 뒤돌아서 후회를 할꺼야  희미한 기억속에 너의 이름 불러도 다신 볼 수 없던 사랑한 사람 사랑아 나를 두고 떠나 가지마 나만 두고 가려거든 다신 나를 찾지마  언젠가 그대 나를 찾는다 해도 그땐 내가 먼저 뒤돌아서 그댈 볼 수 없으니  안돼요 안돼 날 두고 떠나면 안돼 그렇게 못해 난 절대 보낼 순 없어 갈테면 가라 모든 걸 잊고 떠나봐 그땐 뒤돌아서 후회를 할꺼야  희미한 기억속에 너의 이름 불러도 다신 볼 수 없던 사랑한 사람 사랑아 나를 두고 떠나 가지마 나만 두고 가려거든 다신 나를 찾지마  언젠가 그대 나를 찾는다 해도 그땐 내가 먼저 뒤돌아서 그댈 볼 수 없으니 -
안동역에서,진성,1.바람에 날려버린 허무한 맹세였나  첫눈이 내리는 날 안동역 앞에서  만나자고 약속한사람  새벽부터 오는 눈이 무릎까지 덮는데  안오는 건지 못오는 건지 오지 않는 사람아  안타가운 내 마음만 녹고 녹는다  기적소리 끊어진 밤에  2.어차피 지워야할 사랑은 꿈이였나  첫눈이 내리는 날 안동역 앞에서  만나자고 약속한사람  새벽부터 오는눈이 무릎까지 덮는데  안오는 건지 못오는 건지 대답 없는 사람아  기다리는 내 마음만 녹고 녹는다  기다리는 내 마음만 녹고 녹는다  기다리는 안동역에서
꽃,장윤정,날 찾아 오신 내님 어서 오세요 당신을 기다렸어요 라이 라이야 어서오세요 당신의 꽃이 될래요 어디서 무엇하다 이제 왔나요 당신을 기다렸어요 라이 라이야 어서오세요 당신의 꽃이 될래요 사랑의 꽃씨를 뿌려 기쁨을 주고 서로 행복 나누면 니이 라이 라이 라이 라이야 당신은 나의 나무가 되고 니이 라이 라이 라이 라이야 나는 당신의 꽃이 될래요 날 찾아오신 내님 어서 오세요 당신을 기다렸어요 라이 라이야 어서오세요 당신의 꽃이 될래요 어디서 무엇하다 이제 왔나요 당신을 기다렸어요 라이 라이야 어서오세요 당신의 꽃이 될래요 사랑의 꽃씨를 뿌려 기쁨을 주고 서로 행복 나누면 니이 라이 라이 라이 라이야 당신은 나의 나무가 되고 니이 라이 라이 라이 라이야 나는 당신의 꽃이 될래요 나는 당신의 꽃이 될래요
보릿고개,진성,아야 뛰지마라 배 꺼질라 가슴시린 보릿고갯길 주린 배잡고 물 한바가지 배 채우시던 그 세월을 어찌 사셨소 초근목피에 그 시절 바람결에 지워져 갈 때 어머님 설움 잊고 살았던 한 많은 보릿고개여 풀피리 꺾어 불던 슬픈 곡조는 어머님의 한숨이었소 아야 우지마라 배 꺼질라 가슴시린 보릿고갯길 주린배 잡고 물 한바가지 배 채우시던 그 세월을 어찌 사셨소 초근목피에 그 시절 바람결에 지워져 갈 때 어머님 설움 잊고 살았던 한 많은 보릿고개여 풀피리 꺾어 불던 슬픈 곡조는 어머님의 한숨이었소 풀피리 꺾어 불던 슬픈 곡조는 어머님의 통곡이었소
당신이 좋아,장윤정,그대는 내 사랑 당신도 내 사랑 이 세상에 그 무엇도 쨉이 안되지 원앙이 따로 있나 우리가 원앙이지 환상의 해피한 원앙이지  아 꿀맛같은 그대 사랑에 내 인생을 걸었잖아 비가 와도 좋아 눈이 와도 좋아 바람 불어도 좋아 좋아 좋아 당신이 좋아  그대는 내 운명 당신도 내 운명 하늘 아래 누가 와도 쨉이 안되지 그댄 꽃 중에 꽃 당신은 불나비 환상의 해피한 꽃과 나비지  아 꿀맛같은 그대 사랑에 내 인생을 걸었잖아 비가 와도 좋아 눈이 와도 좋아 바람 불어도 좋아 좋아 좋아 당신이 좋아  아 꿀맛같은 그대 사랑에 내 인생을 걸었잖아 비가 와도 좋아 눈이 와도 좋아 바람 불어도 좋아 좋아 좋아 당신이 좋아 좋아 좋아 당신이 좋아
내 사랑 (줄까 말까) (2014 Ver.),홍진영,내 사랑 그대에게 줄까 말까 고민하다 그 사람 영영 떠나요 이것저것 재지 말고 그 사람 잡아요 사랑한다는 그 말 할까 말까 망설이다 그 사람 영영 떠나요 이 남자다 싶을 때는 눈치코치 보지 말고 아낌없이 다 줘요 줄까 말까 살짝쿵 다가서도 모른 척 괜시리 좋으면서 아닌 척 보일락 말락 잡힐락 말락 애간장 녹이네 애타게 바라보는 그 심정 속타게 기다리는 그 심정 사랑을 할거면 사랑을 할거면 화끈하게 내 사랑 그대에게 줄까 말까 고민하다 그 사람 영영 떠나요 이것 저것 재지 말고 그 사람 잡아요 사랑한다는 그 말 할까 말까 망설이다 그 사람 영영 떠나요 이 남자다 싶을 때는 눈치코치 보지 말고 아낌없이 다 줘요 줄까 말까 애타게 바라보는 그 심정 속타게 기다리는 그 심정 사랑을 할거면 사랑을 할거면 화끈하게 내 사랑 그대에게 줄까 말까 고민하다 그 사람 영영 떠나요 이것 저것 재지 말고 그 사람 잡아요 사랑한다는 그 말 할까 말까 망설이다 그 사람 영영 떠나요 이 남자다 싶을 때는 눈치코치 보지 말고 아낌없이 다 줘요 줄까 말까 그대 훌쩍 떠나면 눈물만 훌쩍일 텐데 암만 후회해도 그땐 늦어요 내 사랑 그대에게 모든 걸 그대에게 줄까 말까 고민하다 그 사람 영영 떠나요 이것저것 재지 말고 그 사람 잡아요 사랑한다는 그 말 할까 말까 망설이다 그 사람 영영 떠나요 이 남자다 싶을때는 눈치코치 보지 말고 아낌없이 다 줘요 줄까 말까
어머나!,장윤정,어머나 어머나 이러지마세요 여자의 마음은 갈대랍니다 안돼요 왜이래요 묻지 말아요 더이상 내게 원하시면 안돼요 오늘 처음 만난 당신이지만 내사랑인걸요 헤어지면 남이 되어 모른척하겠지만 좋아해요 사랑해요 거짓말처럼 당신을 사랑해요 소설속에 영화속의 멋진 주인공은 아니지만 괜찮아요 말해봐요 당신 위해서라면 다줄께요  간주  어머나 어머나 이러지마세요 여자의 마음은 바람입니다 안돼요 왜이래요 잡지 말아요 더이상 내게 바라시면 안돼요 오늘 처음 만난 당신이지만 내사랑인걸요 헤어지면 남이 되어 모른척하겠지만 좋아해요 사랑해요 거짓말처럼 당신을사랑해요 소설속에 영화속의 멋진 주인공은 아니지만 괜찮아요 말해봐요 당신 위해서라면 다줄께요  소설속에 영화속의 멋진 주인공은 아니지만 괜찮아요 말해봐요 당신 위해서라면 다줄께요
시계바늘,신유,사는게 뭐 별거있더냐 욕 안먹고 살면 되는거지 술한잔에 시름을 털고 너털웃음 한번웃어보자 세상아 시계바늘처럼 돌고돌다가 가는길을 잃은사람아 미련따위 없는거야 후회도없는거야 아 아 세상살이 뭐 다 그런거지 뭐 돈이좋아 여자가좋아 술이좋아 친구가좋아 싫다하는 사람은없어 너도한번해보고 나도한번해본다 시계바늘처럼 돌고돌다가 가는길을 잃은사람아 미련따위없는거야 후회도없는거야 아 아 세상살이뭐 다 그런거지 뭐 세상살이뭐 다 그런거지 뭐
천태만상,윤수현,천태만상 인간세상 사는법도 가지가지 귀천이 따로있나 재판한다 판사 변호한다 변호사 범인잡는 형사 계룡산에 부채도사 연구한다 박사 운전한다 기사 트럭 택시 기차 전차 버스 봉고 도저 기중기 요리한다 요리사 소개한다 중계사 파마한다 미용사 간호한다 간호사 얼럴러리여 천태만상 인간세상 사는법도 가지가지 귀천이 따로있나 술판다 술장수 밥판다 밥장수 옷판다 옷장수 고기채소 과일장수 놀고먹는 백수 운동한다 선수 축구 야구 농구 배구 씨름 골프 복싱 태권도 말을탄다 기수 집짓는다 목수 돌깎는다 석수 고라니잡는 포수 얼럴러리여 천태만상 인간세상 사는법도 가지가지 귀천이 따로있나 천태만상 인간세상 사는법도 가지가지 귀천이 따로있나 설교한다 목사님 염불한다 스님 가르친다 선생님 병고친다 의사님 재롱둥이 연예인 나라지키는 군인 육군 공군 해군 해병대 특전사 카츄샤 순경 의경 공무보는 공무원 업무보는 회사원 경비보는 경비원 청소하는 미화원 얼럴러리여 천태만상 인간세상 사는법도 가지가지 귀천이 따로있나 농사짓는 농부 고기잡는 어부 공사장에 잡부 알바 도우미 파출부 약초캐는 심마니 오일장에 할머니 달래 냉이 취나물 콩나물 고사리 더덕 단감 곶감 이고 지고 오셔서 한푼두푼 벌어서 손주 용돈 주면서 고생고생하는데 백수가 웬말이냐 천태만상 인간세상 사는법도 가지가지 귀천이 따로있나
미운 사랑,진미령,남몰래 기다리다가 가슴만 태우는 사랑 어제는 기다림에 오늘은 외로움 그리움에 적셔진 긴 세월 이렇게 살라고 인연을 맺었나 차라리 저 멀리 둘 걸 미워졌다고 갈 수 있나요 행여나 찾아 올까봐 가슴이 사랑을 잊지 못해 이별로 끝난다해도 그 끈을 놓을 순 없어 너와 난 운명인 거야 이렇게 살라고 인연을 맺었나 차라리 저 멀리 둘 걸 미워졌다고 갈 수 있나요 행여나 찾아 올까봐 가슴이 사랑을 잊지 못해 이별로 끝난다해도 그 끈을 놓을 순 없어 너와 난 운명인 거야 그 끈을 놓을 순 없어 너와 난 운명인 거야
둥지,남진,너 빈자리 채워 주고 싶어 내 인생을 전부 주고 싶어 이젠 너를 내 곁에다 앉히고 언제까지나 사랑 할까봐  우리 더 이상 방황하지마 한눈 팔지마 여기 둥지를 틀어  지난날의 아픔은 잊어버려 스쳐 지나가는 바람처럼 이제 너는 혼자가 아니잖아 사랑하는 나 있잖아  너는 그냥 가만이 있어 다 내가 해 줄께 현실일까 꿈일까 사실일까 아닐까 헷갈리고 서 있지만 우-  사랑이 뭔지 그동안 몰랐지 내 품에 둥지를 틀어봐  너 빈자리 채워 주고 싶어 내 인생을 전부 주고 싶어 이젠 너를 내 곁에다 앉히고 언제까지나 사랑 할까봐  우리 더 이상 방황하지마 한눈 팔지마 여기 둥지를 틀어  지난날의 아픔은 잊어버려 스쳐 지나가는 바람처럼 이제 너는 혼자가 아니잖아 사랑하는 나 있잖아  너는 그냥 가만이 있어 다 내가 해 줄께 현실일까 꿈일까 사실일까 아닐까 헷갈리고 서 있지만 우-  사랑이 뭔지 그동안 몰랐지 내 품에 둥지를 틀어봐  내 품에 둥지를 틀어봐-
내 나이가 어때서,오승근,야 야 야 내 나이가 어때서 사랑에 나이가 있나요 마음은 하나요 느낌도 하나요 오오 그대만이 정말 내 사랑인데 눈물이 나네요 내 나이가 어때서 사랑하기 딱 좋은 나인데 어느 날 우연히 거울 속에 비춰진 내 모습을 바라보면서 세월아 비켜라 내 나이가 어때서 사랑하기 딱 좋은 나인데 야 야 야 내 나이가 어때서 사랑에 나이가 있나요 마음은 하나요 느낌도 하나요 오오 그대만이 정말 내 사랑인데 눈물이 나네요 내 나이가 어때서 사랑하기 딱 좋은 나인데 어느 날 우연히 거울 속에 비춰진 내 모습을 바라보면서 세월아 비켜라 내 나이가 어때서 사랑하기 딱 좋은 나인데 사랑하기 딱 좋은 나인데
오라버니,금잔디,날 사랑하신다 하니 정말 그러시다니 구름타고 빛나는 하늘 훨훨 날아갑니다 날 사랑하신다 하니 정말 행복하여서 설레이다 떠는 가슴은 아픈 줄도 모른답니다 오라버니 어깨에 기대어 볼래요 커다란 가슴에 얼굴을 묻고 지금 이대로 죽어도 여한 없어요 나는 정말 여자라서 행복해요 오라버니 사랑한다 말해주세요 정신을 못 차릴거야 오라버니 목소리에 울고 웃어요 내겐 영원한 오라버니 오라버니 어깨에 기대어 볼래요 커다란 가슴에 얼굴을 묻고 지금 이대로 죽어도 여한 없어요 나는 정말 여자라서 행복해요 오라버니 사랑한다 말해주세요 정신을 못 차릴거야 오라버니 목소리에 울고 웃어요 내겐 영원한 오라버니
짠짜라,장윤정,짠짠짠) (짜라라짜짜짜) 잘가요 안녕 내 사랑 (짠짠짠)  반짝 반짝 반짝이는 밤하늘의 별을 보며 (짜라라짜짜짜) 우리 사랑 변치말자던 그 약속 잊으셨나요 (짠짠)  날 갖고 장난쳤나요 사랑이 그런건가요 이리저리로 왔다 요리조리로 갔다 아직도 헷갈리나요  짠짠짠 하게 하지 말아요 말없이 그냥 가세요 (짜라라짜짜짜) 짠짠짠 이제 울지 않아요 잘가요 안녕 내 사랑 (짠짠)  (짜라라짜짜짜) 잘가요 안녕 내사랑 (짠짠짠)  깜빡 깜빡 깜빡이는 네온싸인 불빛아래 (짜라라짜짜짜) 약속시간 지나갔어도 내 님은 오질 않네요 (짠짠)  날 갖고 장난쳤나요 사랑이 그런건가요 이리저리로 왔다 요리조리로 갔다 아직도 헷갈리나요   짠짠짠 하게 하지 말아요 말없이 그냥 가세요 (짜라라짜짜짜) 짠짠짠 이젠 울지 않아요 잘가요 안녕 내 사랑 (짠짠) 잘가요 안녕 내 사랑 (짠짠)  (짜라라짜짜짜) 잘가요 안녕 내 사랑 (짠짠짠) -
첫사랑,장윤정,그대를 처음 본 순간 내 가슴 너무 떨렸어요 그때 이미 예감했죠 사랑에 빠질 것을 그대의 몸짓 그대의 미소 다정스런 그대 목소리 나 어떡해요 숨이 멎을 것 같아 그대에게 빠져버렸어요 하루 온 종일 그대 생각 뿐이죠 내일 역시도 그리 보낼 거예요 손 내밀어 잡아주세요 이런 내 사랑 받아 주세요  그대의 몸짓 그대의 미소 다정스런 그대 목소리 나 어떡해요 숨이 멎을 것 같아 그대에게 빠져버렸어요 하루 온종일 그대 생각뿐이죠 내일 역시도 그리 보낼 거예요 손 내밀어 잡아주세요 이런 내 사랑 받아 주세요 이런 내 사랑 받아 주세요
바람의 노래,조용필,살면서 듣게될까 언젠가는 바람에 노래를 세월가면 그때는 알게될까 꽃이지는 이유를 나를 떠난 사람들과 만나게될 또 다른 사람들 스쳐가는 인연과 그리움은 어느곳으로 가는가 나의 작은 지혜로는 알수가 없네 내가 아는건 살아가는 방법뿐이야 보다 많은 실패와 고뇌의 시간이 비켜갈 수 없다는 걸 우린 깨달았네 이제 그 해답이 사랑이라면 나는 이 세상 모든 것들을 사랑하겠네  나를 떠난 사람들과 만나게될 또다른 사람들 스쳐가는 인연과 그리움은 어느 곳으로 가는가 나의 작은 지혜로는 알수가 없네 내가 아는건 살아가는 방법뿐이야 보다 많은 실패와 고뇌의 시간이 비켜갈 수 없다는 걸 우린 깨달았네 이제 그 해답이 사랑이라면 나는 이 세상 모든 것들을 사랑하겠네  보다 많은 실패와 고뇌의 시간이 비켜갈 수 없다는 걸 우린 깨달았네 이제 그 해답이 사랑이라면 나는 이 세상 모든 것들을 사랑하겠네 나는 이 세상 모든 것들을 사랑하겠네 이 세상 모든것들을 사랑하겠네
백만송이 장미,심수봉,먼엣날 어느별에서 내다시 세상에 나올때 사랑을 주고 오라는 작은 음성 하나 들었지 사랑할때만 피는꽃 백만송이 피어 보래는 진실한 사랑할때만 피어나는 사랑의 장미  미워하는 미워하는 미워하는 마음없이 아낌없이 아낌없이 사랑을 주기만 할때 수백만송이 백만송이 백만송이 꽃은 피고 그립고 아름다운 내별나라로 갈수 있다네  진실한 사랑은 뭔가 괴로운 눈물 흘렸네 헤어져간사람 많았던 너무나 슬픈 세상 이었기에 수많은 세월 흐른뒤 자기의 생명까지 모두다준 비처럼 홀연이 나타난 그런 사랑 나는 알았네  미워하는 미워하는 미워하는 마음없이 아낌없이 아낌없이 사랑을 주기만 할때 수백만송이 백만송이 백만송이 꽃은 피고 그립고 아름다운 내별나라로 갈수 있다네  이제는 모두가 떠날지라도 그러나 사랑은 계속 될거야 저별에서 나를 찾아온 그토록 기다리던 이인데 그대와 나함께 하면 더욱더 많은 꽃을 피우고 하나가 되는 우리는 영원한 저별로 돌아가리라  미워하는 미워하는 미워하는 마음없이 아낌없이 아낌없이 사랑을 주기만 할때 수백만송이 백만송이 백만송이 꽃은 피고 그립고 아름다운 내별나라로 갈수 있다네
보약같은 친구,진시몬,같이 가세 같이 가세 보약같은 친구 같이 가세 같이 가세 아침에 눈을 뜨면 제일 먼저 생각나는 자네는 좋은 친구야 보약같은 친구 피한방울 섞이지 않은 우리 두사람 전생에 인연일거야 자식보다 자네가 좋고 돈보다 자네가 좋아 자네와 난 보약같은 친구야 아아아 사는날까지 같이 가세 보약같은 친구야 같이 가세 같이 가세 보약같은 친구 같이 가세 같이 가세 사랑도 해봤고 이별도 해봤지 사는거 별거 없더라 보약같은 친구 언제갈지 모르는 인생 우리 둘이서 웃으며 살아가보자 자식보다 자네가 좋고 돈보다 자네가 좋아 자네와 난 보약같은 친구야 아아아 사는날까지 같이 가세 보약같은 친구야 자식보다 자네가 좋고 돈보다 자네가 좋아 자네와 난 보약같은 친구야 아아아 사는날까지 같이 가세 보약같은 친구야 같이 가세 보약같은 친구야 보약같은 친구 친구
단발머리,조용필,그 언젠가 나를 위해 꽃다발을 전해주던 그 소녀 오늘따라 왜 이렇게 그 소녀가 보고싶을까 비에 젖은 풀잎처럼 단발머리 곱게 빗은 그소녀 반짝이는 눈망울이 내 마음에 되살아 나네 내마음 외로워질때면 그날을 생각하고 그날이 그리워질때면 꿈길을 헤매는데 못잊을 그리움 남기고 그소녀 데려간 세월이 미워라 그 언젠가 나를 위해 꽃다발을 전해주던 그 소녀 오늘따라 왜 이렇게 그 소녀가 보고싶을까 비에 젖은 풀잎처럼 단발머리 곱게 빗은 그소녀 반짝이는 눈망울이 내 마음에 되살아 나네 내마음 외로워질때면 그날을 생각하고 그날이 그리워질때면 꿈길을 헤매는데 못잊을 그리움 남기고 그소녀 데려간 세월이 미워라 그 언젠가 나를 위해 꽃다발을 전해주던 그 소녀 오늘따라 왜 이렇게 그 소녀가 보고싶을까 비에 젖은 풀잎처럼 단발머리 곱게 빗은 그소녀 반짝이는 눈망울이 내 마음에 되살아 나네 그 언젠가 나를 위해 꽃다발을 전해주던 그 소녀
사랑찾아 인생찾아,조항조,라라랄라 라라라라 랄라 라라라라 라라라랄라 사랑찾아 인생을 찾아 하루종일 숨이차게 뛰어다닌다 서울 하늘 하늘 아래서 내 꿈도 가까이 온다 사랑도 있고 우정도 있고 하늘 아래 살고 있고 저마다 다른 인생속에 또 하루를 바쁘게 산다 우리 인생 살다보면 힘든 날도 수없이 찾아오지만 사랑 하나 그 사랑 하나 찾으려고 몸부림치네 사랑찾아 인생을 찾아 하루종일 숨이차게 뛰어다닌다 서울 하늘 하늘 아래서 내 꿈도 가까이 온다 사랑을 알고 우정도 알고 정하나로 살고 있고 저마다 값진 인생속에 또 하루를 바쁘게 산다 우리 인생 살다보면 힘든 날도 수없이 찾아오지만 오늘보다 더 멋진 인생 찾기위해 몸부림치네 사랑 찾아 인생을 찾아 하루종일 숨이 차게 뛰어다닌다 서울 하늘 하늘 아래서 내 꿈도 가까이 온다 사랑찾아 인생을 찾아 지친 가슴 끌어안고 뛰어다닌다 서울 하늘 하늘 아래서 내 꿈도 가까이 온다
거짓말,조항조,사랑했다는 그 말도 거짓말 돌아온다던 그 말도 거짓말 세상의 모든 거짓말 다 해놓고 행여 나를 찾아와 있을 너의 그 마음도 다칠까 너의 자리를 난 또 비워둔다 이젠 더 이상 속아선 안되지 이젠 더 이상 믿어선 안되지 하지만 그게 말처럼 쉽지 않아 다시 한번만 더 나 너를 다시 한번만 더 너에게 나를 사랑할 기횔 주어본다 어떤 사랑으로 나의 용서에 답하련지 또 잠시 날 사랑하다 떠날 건지 마치 처음 날 사랑하듯 가슴 뜨겁게 와 있지만 난 왠지 그 사랑이 두려워 오직 나만을 위한 그 약속과 내 곁에서 날 지켜준다는 말 이번만큼은 제발 변치않길 어떤 사랑으로 나의 용서에 답하련지 또 잠시 날 사랑하다 떠날 건지 마치 처음 날 사랑하듯 가슴 뜨겁게 와 있지만 난 왠지 그 사랑이 두려워 오직 나만을 위한 그 약속과 내 곁에서 날 지켜준다는 말 이번만큼은 제발 변치않길 오직 나만을 위한 그 약속과 내 곁에서 날 지켜준다는 말 이번만큼은 제발 변치않길
올래,장윤정,올래 올래 올래 올래 올래 올래  올래 올래 살랑 살랑 불어오는 바람타고 왔나요 살랑 살랑 내 맘을 흔들흔들 흔들리게 해놓고 알고도 알고도 알고도 모른척 한다면 너무나 얄미운 당신 올래 올래 올래 올래 올래 튕기지 말고 내게 다가올래 니 맘에 들었다면 날 한번쯤 안아 봐도 괜찮아 올래 올래 올래 올래 올래 멋지게 후끈하게 다가올래 살며시 입 맞춰도 난 모른 척 눈감아 줄게 올래 올래  올래 올래 힐끔힐끔 바라보는 그대눈빛 알지만 힐끔힐끔 모른 척 돌아서면 애가타서 어쩌나 하지만 하지만 하지만 후회는 안 해요 내 맘에 쏙 드는 당신 올래 올래 올래 올래 올래 튕기지 말고 내게 다가올래 니 맘에 들었다면 날 한번쯤 안아 봐도 괜찮아 올래 올래 올래 올래 올래 멋지게 후끈하게 다가올래 살며시 입 맞춰도 난 모른 척 눈감아 줄게 올래 올래 올래 올래 올래 올래 올래 올래 올래 올래 올래 튕기지 말고 내게 다가올래 니 맘에 들었다면 날 한번쯤 안아 봐도 괜찮아 올래 올래 올래 올래 올래 멋지게 후끈하게 다가올래 살며시 입 맞춰도 난 모른 척 눈감아 줄게 올래 올래 올래 올래 오 올래 오 올래 올래
사랑을 위하여,김종환,이른 아침에 잠에서 깨어 너를 바라볼 수 있다면 물안개 피는 강가에 서서 작은 미소로 너를 부르리 하루를 살아도 행복할 수 있다면 나는 그 길을 택하고 싶다 세상이 우리를 힘들게 하여도 우리들은 변하지 않아 너를 사랑하기에 저 하늘 끝에 마지막 남은 진실 하나로 오래 두어도 진정 변하지 않는 사랑으로 남게 해주오 내가 아플 때보다 네가 아파할 때가 내 가슴을 철들게 했고 너의 사랑 앞에 나는 옷을 벗었다 거짓의 옷을 벗어버렸다 너를 사랑하기에 저 하늘 끝에 마지막 남은 진실하나로 오래 두어도 진정 변하지 않는 사랑으로 남게 해주오 너를 사랑하기에 저 하늘 끝에 마지막 남은 진실 하나로 오래 두어도 진정 변하지 않는 사랑으로 남게 해주오 사랑으로 남게 해주오
